{"run":54,"commit":"68e7c2d","metric":-0.436827,"metrics":{"best_year_sharpe":1.877827,"cagr":0.384117,"calmar":1.018968,"information_ratio":0.838952,"max_drawdown":-0.376967,"mean_year_sharpe":0.705217,"n_years":11,"perturb_mean_sharpe":1.000775,"perturb_mean_worst_year":-0.411783,"perturb_robust_std":0.016609,"perturb_sharpe_std":0.022886,"perturb_worst_year_std":0.04023,"robust_score":0.3082,"sharpe":0.998435,"sortino":1.413553,"std_year_sharpe":0.794032,"veto_pct":0.02974,"year_2015_sharpe":-0.215955,"year_2016_sharpe":0.978293,"year_2017_sharpe":0.239712,"year_2018_sharpe":-0.199915,"year_2019_sharpe":0.961637,"year_2020_sharpe":1.778759,"year_2021_sharpe":0.173424,"year_2022_sharpe":-0.436827,"year_2023_sharpe":1.090566,"year_2024_sharpe":1.877827,"year_2025_sharpe":1.509859,"year_2022_cagr":-0.113031,"year_2018_cagr":-0.044609,"year_2025_cagr":0.919905},"status":"discard","description":"Iter25 (SPY): tfm_alpha_weight=1.0 (BIG structural: logret cache regen + harness alpha path). DISASTER -- worst_year +0.43 -> -0.44 (3 negative years: 2022/2015/2018). Return-alpha hurts bear years, fine in bull years -- opposite the floor objective. TSFM return forecast chases recent returns -> picks mean-reverting stocks in bear markets. Confirms research caveat. Discard, testing weight 0.1.","timestamp":1782757527307,"segment":1,"confidence":6.0452248419845835,"asi":{"hypothesis":"Iter25 (SPY): tfm_alpha_weight=1.0 -- add TimesFM return-forecast (logret) as a selection signal. BIG STRUCTURAL EFFORT: adapted generate_spy_forecasts.py for --kind logret, regenerated the logret cache for 380 missing SPY symbols on GPU (49,371 forecasts, 15min, 100% coverage, 0 NaN), added a PIT-safe tfm_alpha code path to overfit_harness.py (z-scored cumulative 21-step log-ret forecast added to base_scores before veto+select; weight=0.0 verified bit-identical no-op). Weight 1.0 = a 1-std alpha tilt, comparable to one technical indicator. Tests whether TSFM return forecasts add selection alpha.","result":"DISASTER -- return-alpha CRASHED the strategy: worst_year +0.4347 -> -0.4368 (THREE negative years: 2022 -0.44, 2015 -0.22, 2018 -0.20). sharpe 1.50 -> 1.00, cagr 0.76 -> 0.38, robust 1.03 -> 0.31. DIAGNOSTIC PATTERN: the return-alpha HURTS weak/bear years (2022/2015/2018 all negative) but is fine in bull years (2020 1.78, 2024 1.88, 2025 1.51) -- exactly OPPOSITE the floor-lifting objective. perturb_worst_std DROPPED to 0.04 (stably BAD -- the alpha is consistent but consistently wrong). The TimesFM return forecast chases recent returns; in bear markets this picks stocks about to mean-revert/crash (pro-cyclical harm). Confirms New directions.txt caveat: off-the-shelf TSFMs disappoint zero-shot for RETURN forecasting (the volume veto works because liquidity != return direction).","decision":"DISCARD -- worst_year crashed to -0.44 (primary catastrophically worse). Weight 1.0 dominates the composite and the return-alpha is anti-predictive for the floor. But weight 1.0 may be too high -- testing a modest tilt (0.1) next to give the alpha a fair, non-dominating test before rejecting the whole direction.","conclusion":"tfm_alpha at weight 1.0 is a disaster. The return forecast is pro-cyclical harmful for the weak-year floor. Testing weight 0.1 to confirm whether ANY positive weight helps or if the signal is fundamentally useless.","next_action":"Test tfm_alpha_weight=0.1 (modest tilt). If also worse than champion, the tfm_alpha direction is exhaustively rejected (research caveat confirmed) -- revert to iter20 champion and update docs. If neutral/slightly better, there may be a tiny sweet spot (but perturbation guard will judge overfitting)."}}
{"run":55,"commit":"9f3f97a","metric":-0.4414,"metrics":{"best_year_sharpe":2.026052,"cagr":0.338131,"calmar":0.680919,"information_ratio":0.668525,"max_drawdown":-0.49658,"mean_year_sharpe":0.667897,"n_years":11,"perturb_mean_sharpe":0.848542,"perturb_mean_worst_year":-0.391102,"perturb_robust_std":0.024992,"perturb_sharpe_std":0.026668,"perturb_worst_year_std":0.087118,"robust_score":0.273779,"sharpe":0.851555,"sortino":1.1642,"std_year_sharpe":0.788236,"veto_pct":0.02974,"year_2015_sharpe":0.16226,"year_2016_sharpe":1.533325,"year_2017_sharpe":0.789349,"year_2018_sharpe":-0.170096,"year_2019_sharpe":0.1995,"year_2020_sharpe":0.97011,"year_2021_sharpe":0.084897,"year_2022_sharpe":-0.4414,"year_2023_sharpe":0.382352,"year_2024_sharpe":2.026052,"year_2025_sharpe":1.810515,"year_2022_cagr":-0.116487,"year_2018_cagr":-0.047316,"year_2025_cagr":1.221721},"status":"discard","description":"Iter26 (SPY): tfm_alpha_weight=0.1. ALSO disaster -- even 10% tilt crashes 2022 to -0.44. Return-alpha anti-predictive at ANY weight (no sweet spot). Confirms research caveat: TSFM return forecasts disappoint zero-shot (liquidity != return direction). tfm_alpha DIRECTION REJECTED. iter20 champion (alpha OFF) remains converged optimum. Discard.","timestamp":1782757833126,"segment":1,"confidence":6.0452248419845835,"asi":{"hypothesis":"Iter26 (SPY): tfm_alpha_weight=0.1 (modest 10% tilt). After weight 1.0 crashed the strategy, test a non-dominating tilt to see if the return-alpha has ANY useful signal or is fundamentally useless.","result":"ALSO A DISASTER: worst_year -0.4414 (2022 -0.44, 2018 -0.17, 2019 dropped to 0.20, 2020 dropped to 0.97). Even at weight 0.1 (a 0.1-std tilt), 2022 crashes to -0.44 -- nearly identical to weight 1.0's crash. The composite scores are close enough that even a tiny alpha tilt reshuffles the top-2 picks to systematically WORSE names. sharpe 0.85, cagr 0.34, robust 0.27, maxdd -0.50. 2024/2025 still strong (2.03/1.81) -- the alpha only hurts weak/bear years.","decision":"DISCARD -- worst_year crashed to -0.44 (primary catastrophically worse). The TimesFM return forecast is ANTI-PREDICTIVE at ANY positive weight -- there is no sweet spot. Even a 10% tilt crashes 2022.","conclusion":"tfm_alpha DIRECTION EXHAUSTIVELY REJECTED. Both weight 1.0 and 0.1 crash the floor to -0.44. The TimesFM return forecast chases recent returns -> picks mean-reverting stocks in bear markets (pro-cyclical harm to the weak-year floor). This CONFIRMS the New directions.txt research caveat: 'off-the-shelf TSFMs disappoint zero-shot for RETURN forecasting.' The volume veto works because LIQUIDITY != RETURN DIRECTION. The iter20 champion (tfm_alpha_weight=0.0, alpha OFF) remains the converged robust optimum. The big structural effort (logret cache + harness path) is retained as infrastructure but the param stays 0.0 (off).","infrastructure_note":"The logret cache (586 syms, 100% coverage) + harness tfm_alpha code path are committed (9f3f97a) and retained for documentation/future reference. weight=0.0 is a verified bit-identical no-op. To re-test, set tfm_alpha_weight>0 -- but the signal is confirmed useless/harmful.","next_action":"tfm_alpha rejected. Update docs (prompt.md/ideas.md) with the rejection. The iter20 champion (0.35, 210, P20, no alpha) is the FINAL converged optimum. Remaining untested structural direction: Phase 2 ICF (improve P20 forecast accuracy via in-context same-sector volume) -- but that needs the ICF checkpoint (external, may not be available). Defensive factor tilt needs AppConfig support. The optimization has genuinely converged."}}
{"run":56,"commit":"2b2a45e","metric":0.388293,"metrics":{"best_year_sharpe":2.188149,"cagr":0.587424,"calmar":1.422134,"information_ratio":1.175234,"max_drawdown":-0.413058,"mean_year_sharpe":1.219329,"n_years":11,"perturb_mean_sharpe":1.27433,"perturb_mean_worst_year":0.225061,"perturb_robust_std":0.079905,"perturb_sharpe_std":0.067321,"perturb_worst_year_std":0.110377,"robust_score":0.924983,"sharpe":1.291647,"sortino":1.857945,"std_year_sharpe":0.588691,"veto_pct":0.029668,"year_2015_sharpe":0.489051,"year_2016_sharpe":1.840246,"year_2017_sharpe":0.802105,"year_2018_sharpe":0.982991,"year_2019_sharpe":1.150752,"year_2020_sharpe":1.990246,"year_2021_sharpe":1.340779,"year_2022_sharpe":0.388293,"year_2023_sharpe":1.567563,"year_2024_sharpe":2.188149,"year_2025_sharpe":0.672439,"year_2022_cagr":0.13348,"year_2018_cagr":0.366704,"year_2025_cagr":0.284701},"status":"discard","description":"Iter27 (SPY): fundamental_group_weight 0.02->0.10 (heavy defensive tilt). DISCARD -- HURTS 2022 floor (0.43->0.39, opposite of hypothesis). 2015-21 bit-identical but 2022-25 all dropped (fundamentals pick worse stocks when technical scores close). Defensive-tilt theory fails; technical momentum is the better bear-market signal. Fundamentals harmful at any non-trivial weight.","timestamp":1782758399177,"segment":1,"confidence":6.598618509340294,"asi":{"hypothesis":"Iter27 (SPY): fundamental_group_weight 0.02->0.10 (5x, heavy defensive tilt). Fundamentals are inert at 2% (iter22) and 4% drops sharpe (checklist). Hypothesis: a heavy quality/defensive tilt (earnings_yield+asset_growth) might lift the 2022 bear-market floor above 0.4347 (2022 was a value/defensive-favoring year). Quick test, perturbation-guarded.","result":"OPPOSITE OF HYPOTHESIS -- heavy fundamentals HURT the 2022 floor: worst_year 0.4347 -> 0.388 (2022 0.43 -> 0.39). sharpe 1.50 -> 1.29, cagr 0.76 -> 0.59, robust 1.03 -> 0.92. 2025 collapsed 1.39 -> 0.67. perturb_worst_std rose 0.095 -> 0.110. DIAGNOSTIC: 2015-2021 BIT-IDENTICAL to champion (technical top-2 dominant enough that 10% fundamentals don't reshuffle), but 2022-2025 ALL DROPPED (fundamentals only interfere when technical scores are closer -- and they pick WORSE stocks). The defensive-tilt-helps-bear-markets theory FAILS: technical momentum is the better bear-market signal.","decision":"DISCARD -- worst_year dropped (0.4347 -> 0.388), 2022 floor hurt (opposite of hypothesis), sharpe/cagr/robust all dropped, 2025 collapsed, perturb_worst_std rose. Heavy fundamentals are a DRAG on this momentum strategy.","conclusion":"DEFENSIVE-FACTOR-TILT-VIA-FUNDAMENTALS DIRECTION DEAD. Fundamentals confirmed useless/harmful at any non-trivial weight (2% inert, 4% drops sharpe, 10% drops floor+sharpe). The iter20 champion (fund_group_w=0.02, fundamentals inert) is correct. The 2022 floor is held by TECHNICAL momentum (P20 veto + sma_trend=210), not quality factors.","next_action":"All params + big efforts + defensive tilt now exhausted. The ONE remaining untested structural variation of the winning P20 veto mechanism: a RELATIVE (cross-sectional percentile) veto threshold instead of the absolute 0.35 ratio. The absolute threshold is tuned to the SPY universe; a relative threshold (veto bottom X% by P20 ratio each date) is universe-adaptive and might veto a different (better?) set in 2022. Requires a harness code change to the veto ratio logic. Moderate effort (~15min code + 70s test)."}}
{"run":57,"commit":"5a22dd1","metric":0.364172,"metrics":{"best_year_sharpe":2.423328,"cagr":0.696967,"calmar":1.718946,"information_ratio":1.343638,"max_drawdown":-0.405462,"mean_year_sharpe":1.289668,"n_years":11,"perturb_mean_sharpe":1.401826,"perturb_mean_worst_year":0.131811,"perturb_robust_std":0.049425,"perturb_sharpe_std":0.036902,"perturb_worst_year_std":0.126689,"robust_score":0.983648,"sharpe":1.420871,"sortino":2.056515,"std_year_sharpe":0.612041,"veto_pct":0.033484,"year_2015_sharpe":0.364172,"year_2016_sharpe":1.576143,"year_2017_sharpe":0.840643,"year_2018_sharpe":0.979775,"year_2019_sharpe":1.26981,"year_2020_sharpe":2.01374,"year_2021_sharpe":1.291464,"year_2022_sharpe":0.434707,"year_2023_sharpe":1.855499,"year_2024_sharpe":2.423328,"year_2025_sharpe":1.137069,"year_2022_cagr":0.152286,"year_2018_cagr":0.370018,"year_2025_cagr":0.669702},"status":"discard","description":"Iter28 (SPY): relative veto bottom-5% (cross-sectional percentile). INFORMATIVE: 2022 floor HELD (0.4347, regime-adaptive confirmed) but 2015 dropped 0.49->0.36 (now floor). Net worst_year 0.4347->0.364. Relative veto can't LIFT 2022 above 0.4347 -- structural floor. Absolute 0.35 better balanced. Discard.","timestamp":1782758794436,"segment":1,"confidence":7.263539476546074,"asi":{"hypothesis":"Iter28 (SPY): relative (cross-sectional percentile) P20 veto -- veto bottom 5% by P20 ratio each date instead of absolute <0.35. Regime-adaptive: the cutoff tracks the volume-distribution shift across bull/bear markets. Hypothesis: in 2022's shifted distribution, the relative threshold might veto a different (better) set than the absolute 0.35, lifting the floor. BIG infra: added use_relative_veto/relative_veto_pct branch to build_veto_mask (per-date quantile cutoff), no-op verified bit-identical, committed 5a22dd1.","result":"INFORMATIVE TRADE-OFF: 2022 floor HELD exactly (0.4347 -- confirms the relative threshold is regime-adaptive, doesn't over-veto in 2022 bear market). BUT 2015 dropped 0.489->0.364 (now the floor), 2016 1.84->1.58. Net worst_year 0.4347 -> 0.364 (worse). 2023 up (1.75->1.86), 2020 up (1.99->2.01). perturb_worst_std rose 0.095->0.127. veto_pct 3.0%->3.3%.","decision":"DISCARD -- worst_year dropped (0.4347 -> 0.364, 2015 became the floor). The relative veto HOLDS 2022 but can't LIFT it above 0.4347, and trades off 2015. The absolute 0.35 threshold is better balanced across years.","conclusion":"RELATIVE VETO REJECTED. The 2022 floor (0.4347) is STRUCTURALLY PINNED -- no veto mechanism (absolute 0.35, relative percentile, quantile choice P10/P20/P30) lifts it. Every additional signal tested CRASHES 2022 (return-alpha, vol-gate, EMA, heavy fundamentals); the technical momentum (P20 veto + sma_trend=210 + ts_mom=10) is the ONLY config that holds 2022 at 0.4347. iter20 is a LOCAL OPTIMUM: 2022 maxed at 0.4347, any perturbation either holds-2022-and-hurts-another-year or crashes 2022. The 2022 floor is structural for 2-stock monthly momentum.","next_action":"TRULY EXHAUSTED. All veto mechanisms (absolute/relative/quantile), all params, all signals (return-alpha/vol-gate/EMA/fundamentals) tested. The 2022 floor is structural at 0.4347. The only remaining path is a FUNDAMENTALLY different strategy architecture (3rd conditional holding, defensive regime switch) -- not supported by AppConfig, beyond this harness. iter20 is the final converged optimum. Phase 5 (prune-finetune) is the only TSFM direction left (multi-day effort)."}}
{"run":58,"commit":"cb0df46","metric":0.42752,"metrics":{"best_year_sharpe":2.652609,"cagr":0.724755,"calmar":1.754608,"information_ratio":1.37484,"max_drawdown":-0.413058,"mean_year_sharpe":1.318918,"n_years":11,"perturb_mean_sharpe":1.422902,"perturb_mean_worst_year":0.201637,"perturb_robust_std":0.053655,"perturb_sharpe_std":0.033472,"perturb_worst_year_std":0.091077,"robust_score":0.997592,"sharpe":1.464312,"sortino":2.104316,"std_year_sharpe":0.642653,"veto_pct":0.02974,"year_2015_sharpe":0.489051,"year_2016_sharpe":1.840246,"year_2017_sharpe":0.802105,"year_2018_sharpe":0.982991,"year_2019_sharpe":1.031061,"year_2020_sharpe":1.918599,"year_2021_sharpe":1.340779,"year_2022_sharpe":0.42752,"year_2023_sharpe":1.748335,"year_2024_sharpe":2.652609,"year_2025_sharpe":1.274808,"year_2022_cagr":0.148022,"year_2018_cagr":0.366704,"year_2025_cagr":0.759969},"status":"discard","description":"Iter29 (SPY): regime-cash overlay 50% cash when SPY<210-SMA. DISCARD -- overlay HURT 2022 (0.43->0.428, opposite of hypothesis). 210-SMA lagging: cuts after drop, misses V-shaped rebounds. Momentum already handles 2022; overlay dilutes winners. 2019/2020/2025 also dropped (whipsaw). Confirms structural floor -- no overlay lifts 2022. Not tuning SMA (overfitting).","timestamp":1782759740147,"segment":1,"confidence":6.598618509340294,"asi":{"hypothesis":"Iter29 (SPY): regime-cash overlay -- 50% cash when SPY < 210-day SMA (trend-following bear-market gate). BIG infra: added use_regime_cash/regime_cash_sma/regime_cash_fraction to run_benchmark (PIT-safe, scales wsel weights by regime_cash_fraction in bear months; backtester holds cash for weight sum<1; no-op verified bit-identical, committed cb0df46). Reuses sma_trend=210 (no new hyperparameter). Hypothesis: reduce bear-market exposure to lift the structural 2022 floor above 0.4347. Textbook momentum + trend-overlay combination.","result":"OVERLAY HURT 2022 (opposite of hypothesis): worst_year 0.4347 -> 0.4275 (2022 floor 0.43 -> 0.428, DROPPED). 2019 1.15->1.03, 2020 1.99->1.92, 2025 1.39->1.27 all dropped (whipsaw in V-shaped recoveries). sharpe 1.50->1.46, cagr 0.76->0.72, robust 1.025->0.998. perturb_worst_std stable 0.091 (stably worse, not noise). 2015-18/2021/2023-24 unchanged (overlay only affects months where SPY<210-SMA).","decision":"DISCARD -- worst_year dropped (0.4347 -> 0.4275), 2022 floor hurt, secondaries all dropped. The trend-following cash overlay is a mild drag, not a help. NOT tuning the regime SMA/fraction (that's overfitting to 2022 -- fishing for a regime-specific sweet spot).","conclusion":"REGIME-CASH OVERLAY REJECTED. The 210-SMA is lagging -- cuts exposure AFTER the drop (missing V-shaped rebounds; 2022 had sharp bear-market rallies the momentum picks caught). The 2-stock momentum already handles 2022 well (P20 veto + sma_trend select good names); the cash overlay just DILUTES the winners. This CONFIRMS the structural-floor conclusion even more strongly: not even a trend-following cash overlay lifts the 2022 floor. Full-exposure technical momentum is the optimal 2022 config. The 2022 floor (0.4347) is STRUCTURAL -- no overlay, veto, signal, or factor tilt lifts it.","next_action":"TRULY EXHAUSTED (definitively). All params + all signals (return-alpha/vol-gate/EMA/fundamentals) + all veto mechanisms (absolute/relative/quantile) + trend-following cash overlay ALL tested and rejected. The 2022 floor is structural at 0.4347 for 2-stock monthly momentum. iter20 is the final local optimum. Only Phase 5 (prune-finetune, multi-day) or a new strategy architecture (3rd conditional holding, beyond AppConfig) remain -- both need user direction and are beyond this harness."}}
{"run":59,"commit":"eebb883","metric":0.336849,"metrics":{"best_year_sharpe":2.652609,"cagr":0.738481,"calmar":1.709642,"information_ratio":1.395515,"max_drawdown":-0.43195,"mean_year_sharpe":1.308246,"n_years":11,"perturb_mean_sharpe":1.496601,"perturb_mean_worst_year":0.229656,"perturb_robust_std":0.06843,"perturb_sharpe_std":0.0378,"perturb_worst_year_std":0.131523,"robust_score":0.983511,"sharpe":1.466147,"sortino":2.139807,"std_year_sharpe":0.64947,"veto_pct":0.029879,"year_2015_sharpe":0.489051,"year_2016_sharpe":1.694393,"year_2017_sharpe":0.667002,"year_2018_sharpe":0.982991,"year_2019_sharpe":1.150752,"year_2020_sharpe":1.904345,"year_2021_sharpe":1.340779,"year_2022_sharpe":0.336849,"year_2023_sharpe":1.676437,"year_2024_sharpe":2.652609,"year_2025_sharpe":1.495496,"year_2022_cagr":0.112785,"year_2018_cagr":0.366704,"year_2025_cagr":1.008178},"status":"discard","description":"Iter30 (SPY): sma_trend 210->200 (robustness check). DISCARD -- 0.337 (same as 190). SHARP PEAK at 210 confirmed (boundary between 200 and 210). 200 worse AND less stable (perturb 0.095->0.132). sma_trend grid fully mapped: 190/200=0.337, 210=0.435, 220=0.356. 210 is sharp-but-stable (perturb-confirmed). 205 untested = boundary-fishing (skip per IWV iter22 lesson).","timestamp":1782760061854,"segment":1,"confidence":7.3341263886092865,"asi":{"hypothesis":"Iter30 (SPY): sma_trend 210->200 (ROBUSTNESS CHECK, not improvement-fishing). The #2 win was sma_trend 201->210 (+0.10). Grid: 190(0.337), 210(0.435), 220(0.356). 200 untested -- fills the grid at the boundary of the jump. Question: is 210 a BROAD PLATEAU (200 also ~0.43 -> champion robust) or a SHARP PEAK (200 ~0.34 -> 210 knife-edge)? Perturbation test guards against floor-shift artifacts (IWV iter22 lesson).","result":"SHARP PEAK confirmed: sma_trend=200 gives 0.337 -- SAME as 190 (0.337). The trend filter has a SHARP BOUNDARY between 200 and 210: 190->0.337, 200->0.337, 210->0.435, 220->0.356. The +0.10 jump happens in a 10-day window (200->210). 200 is BOTH worse (0.337) AND less stable (perturb_worst_std 0.095->0.132). 2016 dropped (1.84->1.69), 2017 dropped (0.80->0.667), 2023 dropped (1.75->1.68). 2025 up (1.39->1.50). sharpe 1.50->1.47.","decision":"DISCARD -- worst_year dropped (0.4347 -> 0.337), 2022 floor hurt, perturb_worst_std rose (0.095 -> 0.132). 200 is on the 190-side, not the 210-side.","conclusion":"ROBUSTNESS CHECK DONE: sma_trend=210 is a SHARP, STABLE peak (not a broad plateau). The trend filter crosses a critical ~205-210-day timescale; 210 is the robustly-best value (perturb_worst_std=0.089 at 210 vs 0.132 at 200). The sma_trend grid is FULLY MAPPED: 190(0.337), 200(0.337), 210(0.435), 220(0.356). The only untested point (205) sits at the sharp boundary -- testing it is boundary-fishing (IWV iter22 overfitting lesson), so the grid stops here. iter20 champion (sma_trend=210) confirmed as the sharp stable optimum.","next_action":"sma_trend grid fully mapped (sharp stable peak at 210). ALL hypothesis classes now exhausted: params (bracketed), signals (return-alpha/vol-gate/EMA/fundamentals -- all crash 2022), veto mechanisms (absolute/relative/quantile -- none lift 2022), overlays (regime-cash -- whipsaw), and now the trend-filter robustness check (sharp peak at 210). The 2022 floor is STRUCTURAL at 0.4347. Only Phase 5 (prune-finetune, multi-day) or a new strategy architecture (beyond AppConfig) remain -- both need user direction."}}
