{"run":103,"commit":"8d3b948","metric":0.543756,"metrics":{"best_year_sharpe":2.853325,"cagr":0.792204,"calmar":1.70511,"information_ratio":1.40085,"max_drawdown":-0.464606,"mean_year_sharpe":1.303261,"n_years":11,"perturb_mean_sharpe":1.467174,"perturb_mean_worst_year":0.281635,"perturb_robust_std":0.032039,"perturb_sharpe_std":0.037497,"perturb_worst_year_std":0.16138,"robust_score":0.963144,"sharpe":1.469727,"sortino":2.116768,"std_year_sharpe":0.680234,"veto_pct":0.032609,"year_2015_sharpe":0.543756,"year_2016_sharpe":1.836511,"year_2017_sharpe":0.662159,"year_2018_sharpe":0.996879,"year_2019_sharpe":1.065866,"year_2020_sharpe":2.189367,"year_2021_sharpe":1.341555,"year_2022_sharpe":0.69787,"year_2023_sharpe":1.132451,"year_2024_sharpe":2.853325,"year_2025_sharpe":1.01613,"year_2022_cagr":0.289189,"year_2018_cagr":0.389945,"year_2025_cagr":0.601709},"status":"keep","description":"Iter74 (SPY): conf_tilt_pow=50.0. KEEP -- 20th improvement! worst_year 0.5437->0.5438 (+0.00004, FLOOR CONVERGED at step-function asymptote). pow=20 and pow=50 give the SAME floor (0.5437) -- the pow->inf limit (binary gate). Robustness still improving (+0.0034->0.963) and perturb more stable (->0.161). Floor plateaued; higher pow only improves stability. pow sweep CONVERGED for floor (iter69-74: +0.0081).","timestamp":1782828202838,"segment":1,"confidence":5.815040835880822,"asi":{"finding":"conf_tilt_pow=50.0: the FLOOR CONVERGED at the step-function asymptote (0.5437, +0.00004 vs pow=20 -- within noise). pow=20 and pow=50 give the SAME floor (0.5437). The floor is at the pow->inf limit (binary gate: full tilt when gap>=median, zero when gap<median). Robustness (0.960->0.963) and stability (0.163->0.161) KEEP improving with higher pow (more binary = more stable, less sensitive to exact gap value). The pow sweep is CONVERGED for the floor; further pow only improves robustness/stability. Total pow sweep (iter69-74): floor 0.5357->0.5438 (+0.0081), re-opened at weight_tilt=0.14+vol-adjusted.","hypothesis":"Iter74: conf_tilt_pow=50.0 (test the step-function asymptote). pow=20 dominated pow=10. Test if pow=50 converges (floor plateaus) or keeps improving.","next_action":"Floor CONVERGED at 0.5437 (pow=20=50). Implement the BINARY GATE directly (tilt only when gap>=median, else 0) as the clean pow->inf asymptote -- same floor, maximal robustness/stability, cleaner config (no magic pow=50). Then the pow direction is closed; the floor 0.5437 is the step-function limit. Next frontier: the 2017 is dropping (0.662) as pow increases -- if 2017 approaches the floor, the binary gate's sharp threshold might need softening. Monitor 2017.","result":"PRIMARY IMPROVEMENT (strict domination, floor converged): worst_year 0.54371->0.54376 (+0.00004, within noise -- floor at asymptote). 2015=0.5438 (converged). 2017=0.6622 (DOWN -0.0015, converging). 2023=1.1325 (UP +0.0137). 2021=1.3416 (UP +0.024). robust 0.9598->0.9631 (UP +0.0034, still improving). perturb_worst_std 0.1627->0.1614 (DOWN -0.0013, still improving). Floor converged; robustness/stability still improving. Guard passes."}}
{"run":104,"commit":"fea72f9","metric":0.54882,"metrics":{"best_year_sharpe":2.863648,"cagr":0.795275,"calmar":1.700848,"information_ratio":1.398802,"max_drawdown":-0.467576,"mean_year_sharpe":1.300222,"n_years":11,"perturb_mean_sharpe":1.466736,"perturb_mean_worst_year":0.280619,"perturb_robust_std":0.032784,"perturb_sharpe_std":0.038218,"perturb_worst_year_std":0.164083,"robust_score":0.958035,"sharpe":1.467434,"sortino":2.112562,"std_year_sharpe":0.684373,"veto_pct":0.032609,"year_2015_sharpe":0.54882,"year_2016_sharpe":1.835753,"year_2017_sharpe":0.652927,"year_2018_sharpe":0.999175,"year_2019_sharpe":1.05681,"year_2020_sharpe":2.198579,"year_2021_sharpe":1.340728,"year_2022_sharpe":0.712787,"year_2023_sharpe":1.09686,"year_2024_sharpe":2.863648,"year_2025_sharpe":0.996353,"year_2022_cagr":0.299407,"year_2018_cagr":0.392624,"year_2025_cagr":0.585798},"status":"keep","description":"Iter75 (SPY): weight_tilt=0.15 + pow=50. KEEP -- 21st primary improvement! worst_year 0.5438->0.5488 (+0.0051). The pow sweep's robustness cushion (0.963) UNLOCKED weight_tilt=0.15 (triggered stop at pow=5/iter63, robust 0.947; now 0.958>0.95). Chain: pow->robustness->higher weight_tilt->floor. 2025 dropped to 0.996 (new canary). robust 0.958>0.95. Guard passes.","timestamp":1782828352312,"segment":1,"confidence":5.849982956482216,"asi":{"finding":"weight_tilt=0.15 + pow=50: PRIMARY IMPROVEMENT (+0.0051). The pow sweep's robustness cushion (0.963 at pow=50) UNLOCKED weight_tilt=0.15, which triggered the robustness stop at pow=5 (iter63, robust 0.947) but now gives robust 0.958 (above 0.95). The chain: pow sweep improves robustness -> unlocks higher weight_tilt -> lifts the floor. Same pattern as vol-adjusted unlocking higher weight_tilt (iter61). 2025 dropped to 0.996 (below 1.0, the new canary approaching the floor). 2017 dropped to 0.653 (above 0.60 stop). robust dropped -0.0051 (0.963->0.958, above 0.95 stop, margin 0.008).","hypothesis":"Iter75: weight_tilt=0.15 + pow=50. The pow sweep improved robustness (0.953->0.963), creating a cushion above the 0.95 stop. iter63's 0.15 triggered the stop at pow=5 (robust 0.947); at pow=50 the cushion might keep 0.15 above 0.95 and lift the floor.","next_action":"0.15 UNLOCKED (robust 0.958>0.95, floor +0.0051). Test weight_tilt=0.16 next. Stops to watch: robust<0.95 (margin 0.008), 2017<0.60 (margin 0.053), and 2025 approaching the floor (0.996, was 1.016). If 0.16 triggers a stop or 2025 becomes the floor, 0.15 is the peak. The 2025 (high-conf underperformer) is the new binding canary.","result":"PRIMARY IMPROVEMENT: worst_year 0.54376->0.54882 (+0.0051). 2015=0.5488 (UP +0.0051, the floor). 2022=0.7128 (UP +0.015). 2017=0.6529 (DOWN -0.009, above 0.60). 2025=0.9964 (DOWN -0.020, below 1.0, approaching floor). robust 0.9631->0.9580 (DOWN -0.0051, above 0.95). perturb_worst_std 0.1614->0.1641 (UP +0.0027, within guard). Stops NOT triggered. KEEP."}}
{"run":105,"commit":"bb09f05","metric":0.554027,"metrics":{"best_year_sharpe":2.873482,"cagr":0.798497,"calmar":1.696678,"information_ratio":1.396815,"max_drawdown":-0.470624,"mean_year_sharpe":1.29729,"n_years":11,"perturb_mean_sharpe":1.466226,"perturb_mean_worst_year":0.279747,"perturb_robust_std":0.033752,"perturb_sharpe_std":0.03897,"perturb_worst_year_std":0.167115,"robust_score":0.953032,"sharpe":1.465157,"sortino":2.108589,"std_year_sharpe":0.688516,"veto_pct":0.032609,"year_2015_sharpe":0.554027,"year_2016_sharpe":1.834949,"year_2017_sharpe":0.643809,"year_2018_sharpe":1.001637,"year_2019_sharpe":1.047405,"year_2020_sharpe":2.207208,"year_2021_sharpe":1.339807,"year_2022_sharpe":0.727227,"year_2023_sharpe":1.063066,"year_2024_sharpe":2.873482,"year_2025_sharpe":0.97757,"year_2022_cagr":0.309684,"year_2018_cagr":0.39544,"year_2025_cagr":0.570787},"status":"keep","description":"Iter76 (SPY): weight_tilt=0.16 + pow=50. KEEP -- 22nd primary improvement! worst_year 0.5488->0.5540 (+0.0052). Robust 0.953 (above 0.95, margin 0.003). 2025 dropped to 0.978 (above floor 0.554). Robustness dropping ~0.005/0.01 weight_tilt; 0.17 will likely trigger the stop. Floor still lifting strongly; weight_tilt reaching robustness-limited peak.","timestamp":1782828499163,"segment":1,"confidence":5.886273089460339,"asi":{"finding":"weight_tilt=0.16 + pow=50: floor +0.0052 (0.5488->0.5540). Robustness dropping ~0.005 per 0.01 weight_tilt: 0.963(0.14)->0.958(0.15)->0.953(0.16). Margin to the 0.95 stop is now only 0.003. 2025 dropping (0.996->0.978) but still well above the floor (0.554). 2017 at 0.644 (margin 0.044 above 0.60). The next step (0.17) would likely trigger robust<0.95 (~0.948). The weight_tilt sweep is reaching its robustness-limited peak at 0.16.","hypothesis":"Iter76: weight_tilt=0.16 + pow=50. 0.15 gave robust 0.958 (margin 0.008). 0.16 might give robust ~0.953 (above 0.95) and lift the floor further.","next_action":"0.16 keeps (robust 0.953, margin 0.003). Test 0.17 -- likely triggers robust<0.95 (~0.948). If it triggers, 0.16 is the weight_tilt peak (robustness-limited). The 2025 canary (0.978) is the binding constraint for further weight_tilt increases. After the weight_tilt peak, the pow sweep could re-open at 0.16 (re-tune pow for the new weight_tilt) -- but pow=50 is the asymptote, so unlikely. The floor 0.554 may be near the structural limit for the binary-gate conf_tilt.","result":"PRIMARY IMPROVEMENT: worst_year 0.54882->0.55403 (+0.0052). 2015=0.5540 (UP +0.0052, the floor). 2022=0.7272 (UP +0.014). 2017=0.6438 (DOWN -0.009, above 0.60). 2025=0.9776 (DOWN -0.019, above floor). robust 0.9580->0.9530 (DOWN -0.005, above 0.95, margin 0.003). perturb 0.1641->0.1671 (UP +0.003, within guard). KEEP (robust>0.95, guard passes)."}}
{"run":106,"commit":"bb09f05","metric":0.559376,"metrics":{"best_year_sharpe":2.882835,"cagr":0.801872,"calmar":1.69261,"information_ratio":1.3949,"max_drawdown":-0.473749,"mean_year_sharpe":1.294474,"n_years":11,"perturb_mean_sharpe":1.465653,"perturb_mean_worst_year":0.279021,"perturb_robust_std":0.0349,"perturb_sharpe_std":0.03974,"perturb_worst_year_std":0.170401,"robust_score":0.948159,"sharpe":1.462909,"sortino":2.104804,"std_year_sharpe":0.692629,"veto_pct":0.032609,"year_2015_sharpe":0.559376,"year_2016_sharpe":1.834101,"year_2017_sharpe":0.634806,"year_2018_sharpe":1.004265,"year_2019_sharpe":1.037661,"year_2020_sharpe":2.215265,"year_2021_sharpe":1.338796,"year_2022_sharpe":0.741205,"year_2023_sharpe":1.031122,"year_2024_sharpe":2.882835,"year_2025_sharpe":0.959785,"year_2022_cagr":0.32002,"year_2018_cagr":0.398394,"year_2025_cagr":0.556659},"status":"discard","description":"Iter77 (SPY): weight_tilt=0.17 + pow=50. DISCARD -- robustness STOP triggered (0.948<0.95). Floor lifted +0.0053 (0.5594) but robust dropped below the stop. 2025 canary dropped to 0.960. Per prompt rule (don't chase floor gains that drop robust) + consistency with iter57/iter63. iter76 (0.16, robust 0.953) is the weight_tilt peak at pow=50.","timestamp":1782828644370,"segment":1,"confidence":5.883343137698537,"asi":{"finding":"weight_tilt=0.17 + pow=50: floor +0.0053 (0.5594) BUT robust 0.948 < 0.95 STOP. The weight_tilt sweep at pow=50 is CONVERGED at 0.16 (iter76, robust 0.953, margin 0.003). Robustness drops ~0.005 per 0.01 weight_tilt: 0.963(0.14)->0.958(0.15)->0.953(0.16)->0.948(0.17 STOP). The 2025 canary dropped to 0.960 (was 1.016 at iter74). The floor-vs-robustness tradeoff is exhausted at 0.16. The perturbation guard passes (+0.009<0.10) but robustness is part of the user's objective ('maximize risk-adjusted return AND robustness').","hypothesis":"Iter77: weight_tilt=0.17 + pow=50. 0.16 gave robust 0.953 (margin 0.003). 0.17 likely triggers robust<0.95 (~0.948) but might lift the floor further.","next_action":"0.17 STOP (robust 0.948<0.95). iter76 (0.16, robust 0.953) is the weight_tilt peak at pow=50. The pow sweep (iter69-74) + weight_tilt unlock (iter75-76) lifted the floor 0.5357->0.5540 (+0.018). Update prompt.md + ideas.md with the pow sweep breakthrough and iter76 champion. The 2025 canary (0.978) is the binding constraint for further weight_tilt. The floor 0.554 may be near the structural limit for the binary-gate conf_tilt + vol-adjusted. Remaining: re-tune pow at 0.16 (unlikely -- pow=50 is the asymptote), or a 2025-canary-protection signal (no PIT signal separates 2015 from 2025).","result":"Floor +0.0053 (0.5594) BUT robust 0.948<0.95 STOP. 2025=0.960 (DOWN -0.018). 2017=0.635 (above 0.60). perturb 0.170 (+0.003, within guard). DISCARD (robustness stop, consistent with iter57/iter63). iter76 (0.16) is the peak."}}
{"run":107,"commit":"a41d0d2","metric":0.566341,"metrics":{"best_year_sharpe":2.846486,"cagr":0.80578,"calmar":1.688972,"information_ratio":1.398738,"max_drawdown":-0.477083,"mean_year_sharpe":1.300498,"n_years":11,"perturb_mean_sharpe":1.4664,"perturb_mean_worst_year":0.285556,"perturb_robust_std":0.035322,"perturb_sharpe_std":0.040448,"perturb_worst_year_std":0.185742,"robust_score":0.955042,"sharpe":1.467115,"sortino":2.11801,"std_year_sharpe":0.690912,"veto_pct":0.032609,"year_2015_sharpe":0.566341,"year_2016_sharpe":1.886558,"year_2017_sharpe":0.71057,"year_2018_sharpe":1.010284,"year_2019_sharpe":1.032919,"year_2020_sharpe":2.263513,"year_2021_sharpe":1.345598,"year_2022_sharpe":0.77354,"year_2023_sharpe":0.930051,"year_2024_sharpe":2.846486,"year_2025_sharpe":0.939621,"year_2022_cagr":0.342338,"year_2018_cagr":0.395763,"year_2025_cagr":0.539119},"status":"keep","description":"Iter78 (SPY): conf_tilt_vol_pow=2.0 (squared vol_factor). KEEP -- 23rd primary improvement! worst_year 0.554->0.566 (+0.0123, BIG). Squared vol amplifies 2015 (vf 1.09->1.18, floor lift) + protects 2017 (vf 0.51->0.26, +0.067) + lifts 2022 (+0.046). Robust improved (0.955). 2023/2025 dropped (0.930/0.940, new canaries). perturb +0.019 (within guard, YELLOW FLAG -- squared vol adds sensitivity).","timestamp":1782828931726,"segment":1,"confidence":6.019651741293531,"asi":{"finding":"conf_tilt_vol_pow=2.0: BIG floor lift (+0.0123, 0.554->0.566). The squared vol_factor (vf=(vol/median)^2, capped 2.0) amplifies high-vol months and protects low-vol months. 2015 (vf 1.087->1.18) floor lifted; 2017 (vf 0.51->0.26) RECOVERED +0.067 (protected); 2022 (vf 1.73->capped 2.0) lifted +0.046; 2020 (vf 1.44->capped 2.0) lifted +0.056. Robust IMPROVED (0.953->0.955). BUT: 2023 dropped -0.133 (1.063->0.930) and 2025 dropped -0.038 (0.978->0.940) -- the squared vol over-tilts the 2023/2025 (moderate-vol, positive-return underperformers). perturb_worst_std rose +0.019 (0.167->0.186) -- the squared vol adds sensitivity to the vol estimate, but within the +0.10 guard. YELLOW FLAG: stability degraded slightly; monitor at vol_pow=3.0.","hypothesis":"Iter78: conf_tilt_vol_pow=2.0 (squared vol_factor). Analogous to conf_tilt_pow (concentrate tilt in high-conf), the vol_pow concentrates the vol-adjusted in very-high-vol months. The 2015 (vf=1.087->1.18) gets a boost (floor lift); the 2017 (vf=0.51->0.26) gets more protection. Tests whether the vol_factor SHAPE (below the inert cap) is a lever.","next_action":"vol_pow=2.0 is a BIG win (+0.0123, robust improved). Test vol_pow=3.0 next. WATCH: perturb_worst_std rose +0.019 (0.167->0.186) -- the squared vol adds sensitivity. If vol_pow=3.0 makes perturb_worst_std rise >+0.10 above iter76's 0.167 (i.e. >0.267), or if 2023/2025 drop to the floor, back off. The 2023 (0.930) and 2025 (0.940) are the new canaries (moderate-vol positive-return underperformers, over-tilted by the squared vol).","result":"PRIMARY IMPROVEMENT: worst_year 0.55403->0.56634 (+0.0123). 2015=0.5663 (UP +0.0123, the floor). 2017=0.7106 (UP +0.067, protected). 2022=0.7735 (UP +0.046). 2020=2.2635 (UP +0.056). 2023=0.9301 (DOWN -0.133, canary). 2025=0.9396 (DOWN -0.038, canary). robust 0.9530->0.9550 (UP +0.002). perturb_worst_std 0.1671->0.1857 (UP +0.019, within +0.10 guard but YELLOW FLAG). Guard passes. KEEP."}}
{"run":108,"commit":"a477b12","metric":0.585852,"metrics":{"best_year_sharpe":2.812161,"cagr":0.799666,"calmar":1.663676,"information_ratio":1.387433,"max_drawdown":-0.480662,"mean_year_sharpe":1.295856,"n_years":11,"perturb_mean_sharpe":1.461448,"perturb_mean_worst_year":0.281689,"perturb_robust_std":0.035886,"perturb_sharpe_std":0.041925,"perturb_worst_year_std":0.185009,"robust_score":0.951983,"sharpe":1.457478,"sortino":2.106118,"std_year_sharpe":0.687745,"veto_pct":0.032609,"year_2015_sharpe":0.585852,"year_2016_sharpe":1.902131,"year_2017_sharpe":0.749899,"year_2018_sharpe":1.005432,"year_2019_sharpe":1.028055,"year_2020_sharpe":2.276331,"year_2021_sharpe":1.351724,"year_2022_sharpe":0.77354,"year_2023_sharpe":0.849447,"year_2024_sharpe":2.812161,"year_2025_sharpe":0.919838,"year_2022_cagr":0.342338,"year_2018_cagr":0.390635,"year_2025_cagr":0.522597},"status":"keep","description":"Iter79 (SPY): conf_tilt_vol_pow=3.0 (cubed vol_factor). KEEP -- 24th primary improvement! worst_year 0.566->0.586 (+0.0195, BIGGER, accelerating). Cubed vol amplifies 2015 (vf 1.09^3=1.28, floor lift) + protects 2017 (vf 0.51^3=0.13, +0.039). 2022 capped (unchanged). perturb STABLE (0.185, sensitivity concern did not worsen). 2023 canary dropped to 0.849. Total from iter20: 0.435->0.586 (+35%).","timestamp":1782829112619,"segment":1,"confidence":6.319653265238353,"asi":{"finding":"conf_tilt_vol_pow=3.0: BIGGER floor lift (+0.0195, 0.566->0.586). The cubed vol_factor (vf=(vol/median)^3) amplifies the 2015 (vf 1.087^3=1.28) more -> floor lifted +0.0195. The 2017 (vf 0.51^3=0.13) more protected (+0.039). 2022 (capped at 2.0) unchanged. 2023 dropped -0.081 (0.930->0.849, the cubed vol over-tilts the 2023 moderate-vol underperformer). 2025 dropped -0.020 (0.940->0.920). perturb_worst_std STABLE (0.186->0.185, not degrading further -- the stability concern from vol_pow=2 did not worsen). robust 0.955->0.952 (above 0.95). The vol_pow sweep is a NEW FRONTIER (vol_pow=1->2: +0.012, 2->3: +0.020, ACCELERATING).","hypothesis":"Iter79: conf_tilt_vol_pow=3.0 (cubed vol_factor). vol_pow=2.0 gave +0.0123. The cubed vol amplifies high-vol more and protects low-vol more. Test if the lift continues/accelerates.","next_action":"vol_pow=3.0 is a BIGGER win (+0.0195, accelerating). Test vol_pow=4.0. WATCH: 2023 canary dropped to 0.849 (margin 0.26 above floor 0.586) -- if vol_pow=4.0 drops 2023 below the floor or triggers the perturb guard (>0.267), back off. The 2023/2025 (moderate-vol positive-return underperformers) are the canaries being over-tilted by the high vol_pow. The perturb is stable (0.185) -- the squared-vol sensitivity concern did not worsen at cubed.","result":"PRIMARY IMPROVEMENT: worst_year 0.56634->0.58585 (+0.0195). 2015=0.5859 (UP +0.0195, the floor). 2017=0.7499 (UP +0.039, protected). 2022=0.7735 (unchanged, capped). 2023=0.8494 (DOWN -0.081, canary). 2025=0.9198 (DOWN -0.020, canary). robust 0.9550->0.9520 (DOWN -0.003, above 0.95). perturb 0.1857->0.1850 (STABLE, within guard). KEEP."}}
{"run":109,"commit":"7f89614","metric":0.587605,"metrics":{"best_year_sharpe":2.784754,"cagr":0.795854,"calmar":1.642009,"information_ratio":1.382157,"max_drawdown":-0.484683,"mean_year_sharpe":1.294446,"n_years":11,"perturb_mean_sharpe":1.457838,"perturb_mean_worst_year":0.278743,"perturb_robust_std":0.035672,"perturb_sharpe_std":0.042468,"perturb_worst_year_std":0.181906,"robust_score":0.952611,"sharpe":1.452799,"sortino":2.096843,"std_year_sharpe":0.683669,"veto_pct":0.032609,"year_2015_sharpe":0.587605,"year_2016_sharpe":1.913072,"year_2017_sharpe":0.772477,"year_2018_sharpe":1.000438,"year_2019_sharpe":1.022043,"year_2020_sharpe":2.280682,"year_2021_sharpe":1.358687,"year_2022_sharpe":0.77354,"year_2023_sharpe":0.847331,"year_2024_sharpe":2.784754,"year_2025_sharpe":0.898272,"year_2022_cagr":0.342338,"year_2018_cagr":0.387098,"year_2025_cagr":0.504685},"status":"keep","description":"Iter80 (SPY): conf_tilt_vol_pow=4.0. KEEP -- 25th improvement (floor converging). worst_year 0.586->0.588 (+0.0018, sharply diminished from vol_pow=3's +0.0195). STRICTLY DOMINATES: floor up + robust up + perturb down. Floor saturating (2015 high-conf tilt capped at weight_tilt=0.16, vf boost 1.28->1.40 doesn't help). vol_pow approaching asymptote. 2025 canary 0.898.","timestamp":1782829259373,"segment":1,"confidence":6.551511135304001,"asi":{"finding":"conf_tilt_vol_pow=4.0: floor lift DIMINISHED SHARPLY (+0.0018 vs vol_pow=3's +0.0195). The floor is saturating: the 2015's high-conf months' effective tilt is CAPPED at weight_tilt=0.16 (conf~1 binary * vf~1.28 > 0.16 -> capped), so further vf boost (1.28->1.40) doesn't lift the floor. The vol_pow sweep is approaching its asymptote. BUT robust improved (+0.0006) and perturb improved (-0.003) -> STRICT DOMINATION. The vol_pow effect on the floor comes from the 2015's moderate-vol months (vf<weight_tilt) and the 2017 protection (vf 0.51^4=0.07, +0.023). 2025 dropped to 0.898 (canary).","hypothesis":"Iter80: conf_tilt_vol_pow=4.0. vol_pow=3 gave +0.0195 (accelerating). Test if vol_pow=4 continues or converges (the 2015 high-conf tilt is capped at weight_tilt, so vf boost may saturate).","next_action":"vol_pow=4 dominates but floor converging (+0.0018). Jump to vol_pow=8 to find the asymptote. The floor is capped by weight_tilt=0.16 on the 2015 high-conf months. To lift further: (a) raise weight_tilt (but robust stop at 0.16), or (b) the vol_pow asymptote. After vol_pow converges, re-test weight_tilt (the vol_pow improved robustness 0.953->0.953, no cushion gained, so unlikely to unlock 0.17). WATCH 2025 canary (0.898, dropping).","result":"PRIMARY IMPROVEMENT (strict domination, floor converging): worst_year 0.58585->0.58761 (+0.0018). 2015=0.5876 (UP +0.0018, the floor, saturating). 2017=0.7725 (UP +0.023, protected). 2023=0.8473 (DOWN -0.002, converged). 2025=0.8983 (DOWN -0.022, canary). robust 0.9520->0.9526 (UP +0.0006). perturb 0.1850->0.1819 (DOWN -0.003, MORE stable). KEEP."}}
