{"run":60,"commit":"eebb883","metric":0.31262,"metrics":{"best_year_sharpe":2.880178,"cagr":0.760242,"calmar":1.760021,"information_ratio":1.433414,"max_drawdown":-0.43195,"mean_year_sharpe":1.337631,"n_years":11,"perturb_mean_sharpe":1.491917,"perturb_mean_worst_year":0.187395,"perturb_robust_std":0.078529,"perturb_sharpe_std":0.073452,"perturb_worst_year_std":0.113379,"robust_score":0.993969,"sharpe":1.495757,"sortino":2.149664,"std_year_sharpe":0.687322,"veto_pct":0.029877,"year_2015_sharpe":0.510874,"year_2016_sharpe":1.840246,"year_2017_sharpe":0.933935,"year_2018_sharpe":0.906131,"year_2019_sharpe":1.460676,"year_2020_sharpe":1.916662,"year_2021_sharpe":1.035732,"year_2022_sharpe":0.31262,"year_2023_sharpe":1.530462,"year_2024_sharpe":2.880178,"year_2025_sharpe":1.386422,"year_2022_cagr":0.103122,"year_2018_cagr":0.331297,"year_2025_cagr":0.931648},"status":"discard","description":"Iter31 (SPY): ts_mom 10->9 (robustness check). DISCARD -- 0.313 (between 8's 0.190 and 10's 0.435). SHARP PEAK at 10 confirmed. ts_mom grid fully mapped: 8/9/10/11. 9 is return-chasing (lifts 2017/19/24, drops 2022 floor). BOTH key param grids now fully mapped -- sharp stable peaks at champion values (210, 10).","timestamp":1782760292568,"segment":1,"confidence":7.555149172833106,"asi":{"hypothesis":"Iter31 (SPY): ts_mom_lookback 10->9 (ROBUSTNESS CHECK on the 2nd key momentum param). Grid: 8(0.190 crash), 10(0.435), 11(0.267 overfit). 9 untested -- between crash and peak. Question: is 10 a BROAD PLATEAU (9 also ~0.43) or a SHARP PEAK (9 ~0.20-0.31)? Perturbation-guarded.","result":"SHARP PEAK confirmed: ts_mom=9 gives 0.313 -- between 8(0.190) and 10(0.435), monotonic interpolation NOT a broad plateau. ts_mom grid FULLY MAPPED: 8(0.190), 9(0.313), 10(0.435), 11(0.267). 9 is RETURN-CHASING: lifts 2017(0.80->0.93), 2019(1.15->1.46), 2024(2.65->2.88) but drops 2022 floor (0.43->0.31), 2018(0.98->0.91), 2021(1.34->1.04), 2023(1.75->1.53). stdY rose 0.644->0.687 (more dispersion). perturb_worst_std rose 0.095->0.113. sharpe/cagr essentially equal (1.496/0.760).","decision":"DISCARD -- worst_year dropped (0.4347 -> 0.313), 2022 floor hurt, perturb_worst_std rose, stdY rose (more dispersion). 9 is return-chasing (lifts some years, drops the floor).","conclusion":"BOTH KEY PARAM GRIDS FULLY MAPPED. sma_trend: 190(0.337), 200(0.337), 210(0.435), 220(0.356) -- sharp stable peak at 210. ts_mom: 8(0.190), 9(0.313), 10(0.435), 11(0.267) -- sharp stable peak at 10. CONSISTENT PATTERN: the momentum params have SHARP peaks, and the champion values (210, 10) are the robustly-best (perturbation-confirmed). Both robustness checks CONFIRM the iter20 champion is the sharp stable optimum, not a broad plateau. The 2022 floor is STRUCTURAL at 0.4347.","next_action":"DEFINITIVELY EXHAUSTED. Both key param grids fully mapped (sharp stable peaks). All params + all signals + all veto mechanisms + overlays + robustness checks DONE. The iter20 champion (0.435, 13x baseline, 6 tests PASS, OOS min +0.730) is the final validated optimum. The 2022 floor is structural. Only Phase 5 (prune-finetune, multi-day) or a new strategy architecture (beyond AppConfig) remain -- both require user direction and are beyond a single run_experiment."}}
{"run":61,"commit":"8de8f94","metric":0.434707,"metrics":{"best_year_sharpe":2.652609,"cagr":0.763133,"calmar":1.766715,"information_ratio":1.426773,"max_drawdown":-0.43195,"mean_year_sharpe":1.347553,"n_years":11,"perturb_mean_sharpe":1.459062,"perturb_mean_worst_year":0.223892,"perturb_robust_std":0.05348,"perturb_sharpe_std":0.038532,"perturb_worst_year_std":0.094912,"robust_score":1.025468,"sharpe":1.495261,"sortino":2.163103,"std_year_sharpe":0.644171,"veto_pct":0.02974,"year_2015_sharpe":0.489051,"year_2016_sharpe":1.840246,"year_2017_sharpe":0.802105,"year_2018_sharpe":0.982991,"year_2019_sharpe":1.150752,"year_2020_sharpe":1.990246,"year_2021_sharpe":1.340779,"year_2022_sharpe":0.434707,"year_2023_sharpe":1.753176,"year_2024_sharpe":2.652609,"year_2025_sharpe":1.386422,"year_2022_cagr":0.152286,"year_2018_cagr":0.366704,"year_2025_cagr":0.931648},"status":"discard","description":"Iter32 (SPY): disable RSI (enable_indicators rsi=false). BIT-IDENTICAL no-op -- RSI doesn't change top-2. PROFOUND: composite is ts_mom+sma dominated; ~8 secondary indicators (rsi/cci/macd/obv/bollinger/breakout/etc) ALL inert. Strategy = ts_mom(10)+sma(3/50/210)+P20 veto(0.35). Explains why EMA/RSI tweaks are no-ops. Discard.","timestamp":1782760645466,"segment":1,"confidence":7.3341263886092865,"asi":{"hypothesis":"Iter32 (SPY): disable RSI (enable_indicators rsi=false). NEW DIRECTION -- never tested indicator-disable. RSI is a mean-reversion oscillator that flags strong momentum as 'overbought'; in a 2-stock MOMENTUM strategy it could dampen the 2022 winners. Disabling it lets pro-momentum signals dominate. Structural change (not peak-fishing), genuinely untested, perturbation-guarded.","result":"BIT-IDENTICAL NO-OP: worst_year=0.434707, sharpe=1.495261, ALL metrics and year sharpes IDENTICAL to iter20 champion. Disabling RSI has ZERO effect -- RSI does not change the top-2 selection.","decision":"DISCARD -- bit-identical no-op. RSI is inert in the composite (doesn't reshape the top-2).","conclusion":"PROFOUND FINDING: the composite (~10 indicators, grouped_equal) is DOMINATED by ts_mom + sma_crossover. The ~8 secondary indicators (rsi, cci, macd, obv, bollinger, breakout, variable_week_high, price_action, ema_crossover) are ALL INERT -- they contribute to the score but don't reshape the top-2 ranking (same as fundamentals at 2%). This explains why tuning EMA (iter23) and disabling RSI (iter32) are both no-ops. The strategy is effectively a ts_mom + sma momentum rotation with a P20 volume veto; everything else is dead weight. NOT worth sweeping indicator-disables (all likely inert -- the top-2 is ts_mom+sma dominated regardless of which weak indicators are present).","next_action":"Indicator-disable direction confirmed INERT (composite is ts_mom+sma dominated). EVERY hypothesis class now tested: params (bracketed, both key grids mapped), signals (return-alpha/vol-gate/EMA/fundamentals/RSI -- all inert or crash 2022), veto mechanisms (absolute/relative/quantile), overlays (regime-cash), robustness checks (sma_trend/ts_mom grids), indicator-disable (RSI inert). The 2022 floor is STRUCTURAL at 0.4347. The strategy reduces to ts_mom(10) + sma(3/50/210) + P20 veto(0.35) + vol_scaled(21) + max_holdings(2). iter20 is the final converged optimum. Only Phase 5 (prune-finetune, multi-day) or a new architecture (beyond AppConfig) remain."}}
{"run":62,"commit":"14b901e","metric":0.425255,"metrics":{"best_year_sharpe":2.675361,"cagr":0.76011,"calmar":1.756119,"information_ratio":1.420774,"max_drawdown":-0.432835,"mean_year_sharpe":1.324197,"n_years":11,"perturb_mean_sharpe":1.446274,"perturb_mean_worst_year":0.206526,"perturb_robust_std":0.053773,"perturb_sharpe_std":0.052316,"perturb_worst_year_std":0.084942,"robust_score":0.992924,"sharpe":1.481958,"sortino":2.115503,"std_year_sharpe":0.662546,"veto_pct":0.02974,"year_2015_sharpe":0.425255,"year_2016_sharpe":1.884311,"year_2017_sharpe":0.814189,"year_2018_sharpe":0.835032,"year_2019_sharpe":1.193104,"year_2020_sharpe":1.895084,"year_2021_sharpe":1.293579,"year_2022_sharpe":0.435127,"year_2023_sharpe":1.820601,"year_2024_sharpe":2.675361,"year_2025_sharpe":1.294529,"year_2022_cagr":0.152548,"year_2018_cagr":0.297256,"year_2025_cagr":0.823786},"status":"discard","description":"Iter33 (SPY): vol_scaled true->false (equal-weight). DISCARD -- 2015 became floor (0.49->0.425), worst_year 0.4347->0.4253. INFORMATIVE: vol_scaled is a REAL lever (unlike inert indicators) -- inverse-vol lifts 2015 (0.425->0.489). Equal-weight MORE stable (perturb 0.085) but lower floor. vol_scaled=true confirmed optimal on SPY. Validates iter32 (sizing matters, indicators don't).","timestamp":1782760999419,"segment":1,"confidence":6.429391946093374,"asi":{"hypothesis":"Iter33 (SPY): vol_scaled_weights true->false (equal-weight sizing). vol_scaled=true was an IWV-specific KEEP (iter7, sharpe 0.94->1.03) for the BROADER high-vol-dispersion universe. SPY is LARGE-CAP (deeper liquidity, less vol dispersion) -- equal-weight might match/beat inverse-vol here. Genuinely untested on the SPY champion (only vol_lookback=34 tested, iter19). The iter32 finding (sizing matters, indicators don't) makes this the highest-EV remaining hypothesis. Structural sizing choice, perturbation-guarded.","result":"DISCARD but INFORMATIVE: worst_year 0.4347 -> 0.4253 (2015 became the floor: 0.489->0.425; 2022 essentially HELD at 0.435). 2018 dropped (0.98->0.835), 2020 (1.99->1.90), 2025 (1.39->1.29). 2016 up (1.84->1.88), 2023 up (1.75->1.82), 2024 up (2.65->2.68). sharpe 1.495->1.482, robust 1.025->0.993. INTERESTING: perturb_worst_std DROPPED 0.095->0.085 (equal-weight MORE perturbation-stable!) but lower floor. stdY rose 0.644->0.663 (more dispersion).","decision":"DISCARD -- worst_year dropped (0.4347 -> 0.4253, 2015 became the floor). vol_scaled=true (inverse-vol) is BETTER for the primary (lifts 2015 from 0.425 to 0.489).","conclusion":"vol_scaled=true CONFIRMED OPTIMAL ON SPY (not just IWV). KEY INSIGHT: vol_scaled is a REAL lever (unlike the inert indicators, iter32) -- inverse-vol sizing specifically lifts the 2015 weak year (0.425->0.489). Tradeoff: equal-weight is MORE perturbation-stable (0.085 vs 0.095) but lower floor; the champion correctly chose the higher floor (primary metric). This validates the iter32 finding: SIZING matters, INDICATORS don't. vol_scaled=true is the right choice on SPY large-caps too.","next_action":"vol_scaled was the LAST untested structural lever. EVERY hypothesis class now tested: params (bracketed, both grids mapped), signals (return-alpha/vol-gate/EMA/fundamentals), veto mechanisms (absolute/relative/quantile), overlays (regime-cash), indicator-disable (RSI inert), IC weighting (disaster), vol_scaled (true optimal), require_positive (no-op), robustness checks. The strategy is FULLY REDUCED (ts_mom+sma+P20 veto+vol_scaled+max_holdings) and ALL components optimized. The 2022 floor is STRUCTURAL at 0.4347. Only Phase 5 (multi-day) or a new architecture (beyond AppConfig) remain."}}
{"run":63,"commit":"e286746","metric":0.364172,"metrics":{"best_year_sharpe":2.709059,"cagr":0.7237,"calmar":1.784878,"information_ratio":1.377623,"max_drawdown":-0.405462,"mean_year_sharpe":1.257064,"n_years":11,"perturb_mean_sharpe":1.413657,"perturb_mean_worst_year":0.131811,"perturb_robust_std":0.067041,"perturb_sharpe_std":0.043619,"perturb_worst_year_std":0.126689,"robust_score":0.932319,"sharpe":1.448972,"sortino":2.09471,"std_year_sharpe":0.64949,"veto_pct":0.029985,"year_2015_sharpe":0.364172,"year_2016_sharpe":1.242499,"year_2017_sharpe":0.936509,"year_2018_sharpe":0.940236,"year_2019_sharpe":1.308901,"year_2020_sharpe":1.990246,"year_2021_sharpe":1.10343,"year_2022_sharpe":0.434707,"year_2023_sharpe":1.753176,"year_2024_sharpe":2.709059,"year_2025_sharpe":1.044769,"year_2022_cagr":0.152286,"year_2018_cagr":0.370109,"year_2025_cagr":0.584654},"status":"discard","description":"iter34 (SPY): forecast_context_len 256->512 (BIG: ctx512 cache regen, 41min GPU). DISCARD -- 2015 became floor (0.49->0.36), 2016 collapsed (1.84->1.24). BUT 2022 HELD at 0.4347 (same as ctx256, different forecast). PROFOUND: 2022 floor is SELECTION-determined (ts_mom+sma), NOT veto-determined. Veto only affects non-floor years. ctx256 optimal.","timestamp":1782764221440,"segment":1,"confidence":7.3341263886092865,"asi":{"hypothesis":"Iter34 (SPY): forecast_context_len 256->512 (BIG infra: made CTX configurable, regenerated ctx512 volume quantile cache on GPU, 75993 forecasts, 41min, 100% coverage, 0 NaN, committed e286746). The TSFM model supports up to 16384 context; I always used 256. Hypothesis: longer context (512) sees more history -> more accurate P20 downside-liquidity forecast -> tighter/better veto -> maybe lifts the floor or Pareto win. Improves the WINNING mechanism (volume veto), not a new signal. Perturbation-guarded.","result":"DISCARD but PROFOUND INSIGHT: worst_year 0.4347 -> 0.364 (2015 became floor: 0.489->0.364; 2016 COLLAPSED 1.84->1.24; 2025 1.39->1.04; 2021 1.34->1.10). perturb_worst_std rose 0.095->0.127. sharpe 1.495->1.449, cagr 0.763->0.724, robust 1.025->0.932. BUT 2022 = 0.4347 HELD EXACTLY (same as ctx256). The ctx512 forecast is a COMPLETELY DIFFERENT P20 forecast (different vetoed set, same 3% rate) yet 2022 is unchanged.","decision":"DISCARD -- worst_year dropped (0.4347 -> 0.364, 2015 became floor), 2016 collapsed, perturb_worst_std rose. The longer context changed the vetoed set in a WORSE direction for 2015/2016/2025. ctx256 confirmed optimal.","conclusion":"PROFOUND STRUCTURAL INSIGHT: the 2022 floor is SELECTION-determined (ts_mom+sma picks), NOT veto-determined. Evidence: 2022=0.4347 at ctx256 AND ctx512 (completely different P20 forecasts, different vetoed sets, same 2022 floor). Combined with iter28 (relative veto also held 2022 at 0.4347), this proves the veto ONLY affects non-floor years. The 2022 floor is purely from the ts_mom(10)+sma(210) 2-stock selection. To lift 2022, one must change the SELECTION (not the veto/overlay/forecast) -- and the selection params (ts_mom=10, sma_trend=210) are at their sharp stable peaks (iters30-31). The 2022 floor is TRULY structural. ctx256 is the optimal forecast context.","next_action":"Forecast context length tested (ctx256 optimal, ctx512 worse). The 2022 floor is now PROVEN selection-determined (not veto-determined) -- the deepest structural insight. EVERY forecast/veto/overlay/signal lever tested. The selection params (ts_mom, sma) are at sharp stable peaks. iter20 (ctx256, 0.35, 210, 10) is the final optimum. Only a DIFFERENT selection signal (new factor, beyond AppConfig) or Phase 5 (prune-finetune) can lift the floor -- both need user direction."}}
{"run":64,"commit":"9203673","metric":0.434707,"metrics":{"best_year_sharpe":2.652609,"cagr":0.763133,"calmar":1.766715,"information_ratio":1.426773,"max_drawdown":-0.43195,"mean_year_sharpe":1.347553,"n_years":11,"perturb_mean_sharpe":1.459062,"perturb_mean_worst_year":0.223892,"perturb_robust_std":0.05348,"perturb_sharpe_std":0.038532,"perturb_worst_year_std":0.094912,"robust_score":1.025468,"sharpe":1.495261,"sortino":2.163103,"std_year_sharpe":0.644171,"veto_pct":0.02974,"year_2015_sharpe":0.489051,"year_2016_sharpe":1.840246,"year_2017_sharpe":0.802105,"year_2018_sharpe":0.982991,"year_2019_sharpe":1.150752,"year_2020_sharpe":1.990246,"year_2021_sharpe":1.340779,"year_2022_sharpe":0.434707,"year_2023_sharpe":1.753176,"year_2024_sharpe":2.652609,"year_2025_sharpe":1.386422,"year_2022_cagr":0.152286,"year_2018_cagr":0.366704,"year_2025_cagr":0.931648},"status":"discard","description":"Iter35 (SPY): full_turnover_rebalance=true (last untested wired param). BIT-IDENTICAL no-op -- vol scaling causes monthly trades, no unchanged months to skip. PARAM SPACE 100% CLOSED: every wired param tested (bracketed/rejected/no-op). iter20 is the final optimum.","timestamp":1782764752873,"segment":1,"confidence":6.429391946093374,"asi":{"hypothesis":"Iter35 (SPY): full_turnover_rebalance=true (force sell+rebuy every rebalance, even unchanged). The LAST untested wired param. Champion uses false (skip unchanged). With vol_scaled=true refreshing weights monthly, the target likely changes whenever vol changes -> no unchanged months to skip -> full_turnover should be a near-no-op. Quick (no cache regen), closes the last lever.","result":"BIT-IDENTICAL NO-OP: worst_year=0.434707, sharpe=1.495261, ALL metrics and year sharpes IDENTICAL to iter20 champion. full_turnover_rebalance has ZERO effect.","decision":"DISCARD -- bit-identical no-op. full_turnover is inert (vol scaling causes monthly trades; no unchanged months to skip).","conclusion":"PARAM SPACE 100% CLOSED. EVERY wired param in the harness is now tested: (1) bracketed -- sma_fast/slow/trend, ts_mom_lookback/skip, veto_threshold, trailing_vol_window, veto_horizon, vol_lookback, max_holdings, cost, min_volume, quantile_col, forecast_context_len; (2) rejected -- tfm_alpha, ema, relative_veto, regime_cash, use_indicator_ic_weights, vol_scaled(=true optimal), heavy fundamentals; (3) no-op -- require_positive_composite, base_filter_requires_trend, full_turnover_rebalance, enable_indicators(RSI), fundamental weights. The ONLY remaining structural lever is rebalance_frequency (weekly/biweekly, champion=monthly) -- but a clean weekly test needs a 2.5h weekly forecast cache regen (300K forecasts) for an uncertain, likely-marginal reward (iter34: 2022 is selection-determined by the monthly ts_mom; weekly ts_mom is the same signal weekly-evaluated).","next_action":"EVERY wired param tested (full_turnover was the last). The param space is 100% closed. iter20 champion (0.435, 13x baseline, 6 tests PASS, OOS min +0.730) is the final validated optimum. Only the weekly rebalance (2.5h cache, uncertain reward) or Phase 5 (multi-day) or a new architecture (beyond AppConfig) remain -- all need user direction and are big efforts."}}
{"run":65,"commit":"4d0089f","metric":-0.813914,"metrics":{"best_year_sharpe":2.699588,"cagr":0.620777,"calmar":1.419317,"information_ratio":1.192659,"max_drawdown":-0.437378,"mean_year_sharpe":1.058212,"n_years":11,"perturb_mean_sharpe":1.208837,"perturb_mean_worst_year":-0.584984,"perturb_robust_std":0.144608,"perturb_sharpe_std":0.066705,"perturb_worst_year_std":0.318123,"robust_score":0.548563,"sharpe":1.283826,"sortino":1.865418,"std_year_sharpe":1.019298,"veto_pct":0.003614,"year_2015_sharpe":0.239663,"year_2016_sharpe":1.748969,"year_2017_sharpe":0.549853,"year_2018_sharpe":0.71123,"year_2019_sharpe":1.27388,"year_2020_sharpe":2.244101,"year_2021_sharpe":-0.813914,"year_2022_sharpe":-0.023143,"year_2023_sharpe":2.089081,"year_2024_sharpe":2.699588,"year_2025_sharpe":0.921019,"year_2022_cagr":-0.021258,"year_2018_cagr":0.256413,"year_2025_cagr":0.484287},"status":"discard","description":"Iter36 (SPY): weekly rebalance HYBRID (monthly cache, no weekly regen). CONFOUNDED CRASH -- worst_year -0.81 (2021), veto_pct 0.4% (off mid-month, NaN). Crash from missing veto, not weekly selection. REFINES iter34: veto is NECESSARY (not just precision-irrelevant) -- off->2022 crashes to -0.02. Hybrid invalid. Need clean 3h weekly cache. Discard.","timestamp":1782765384978,"segment":1,"confidence":6.429391946093374,"asi":{"hypothesis":"Iter36 (SPY): rebalance_frequency=weekly HYBRID PROBE (weekly rebalance + monthly cache, no weekly cache regen). Fast probe to see if weekly SELECTION timing changes 2022 before committing to 3h weekly cache. The harness reindexes monthly cache to weekly dates -> veto NaN/off for non-month-end weeks. iter34 said the veto doesn't touch the 2022 top-2, so this should isolate weekly selection.","result":"CONFOUNDED CRASH: worst_year -0.814 (2021 crashed to -0.81, 2022 to -0.02). veto_pct COLLAPSED to 0.4% (from 3.0%) -- weekly dates don't match monthly cache -> veto OFF mid-month (NaN -> not vetoed). The crash is from the MISSING VETO, not weekly selection. Can't isolate weekly-selection effect. 2020 up (2.24), 2023 up (2.09), 2024 up (2.70) but 2015/2017/2018/2021/2022/2025 all dropped. perturb_worst_std EXPLODED 0.095->0.318. stdY 0.64->1.02 (huge dispersion).","decision":"DISCARD -- worst_year crashed to -0.81 (confounded by missing mid-month veto, not a clean weekly-selection test).","conclusion":"REFINES iter34: the veto is not just precision-irrelevant (ctx256 vs ctx512 same 2022) -- it is NECESSARY. Turning the veto off (hybrid, NaN mid-month) crashes 2022 to -0.02. So the 2022 floor requires the veto ON at every rebalance. The hybrid is INVALID (veto off mid-month). A clean weekly test needs the weekly forecast cache (veto on every week) -- the 3h regeneration. The hybrid could not rule out weekly selection, so the clean 3h test is still needed to definitively test the last structural lever.","next_action":"Proceed with the 3h weekly cache regeneration (delete monthly cache, backup safe in .monthly.bak, generate weekly quantile cache, test with rebalance_frequency=weekly). This is the last structural lever and the user confirmed option 1. The clean test (veto on every week) will show if weekly ts_mom selection timing changes the 2022 floor."}}
