{"run":48,"commit":"aed44a2","metric":0.099232,"metrics":{"best_year_sharpe":2.733823,"cagr":0.785608,"calmar":1.81284,"information_ratio":1.470982,"max_drawdown":-0.433358,"mean_year_sharpe":1.397151,"n_years":11,"perturb_mean_sharpe":1.522612,"perturb_mean_worst_year":0.173179,"perturb_robust_std":0.100156,"perturb_sharpe_std":0.056549,"perturb_worst_year_std":0.228762,"robust_score":1.007571,"sharpe":1.523021,"sortino":2.210969,"std_year_sharpe":0.779159,"veto_pct":0.014148,"year_2015_sharpe":0.836849,"year_2016_sharpe":1.948776,"year_2017_sharpe":1.545377,"year_2018_sharpe":0.708487,"year_2019_sharpe":1.619708,"year_2020_sharpe":2.536222,"year_2021_sharpe":0.689688,"year_2022_sharpe":0.099232,"year_2023_sharpe":1.667581,"year_2024_sharpe":2.733823,"year_2025_sharpe":0.982919,"year_2022_cagr":0.022948,"year_2018_cagr":0.247367,"year_2025_cagr":0.541827},"status":"discard","description":"Iter19 (SPY): vol_lookback 21->34. 2022 floor crashed (0.43->0.10), perturb_worst_std exploded 0.10->0.23. Same pattern as iter18. vol_lookback=21 confirmed sweet spot. All 5 iter14-base tweaks fail -> iter14 converging to robust optimum. Discard.","timestamp":1782753039454,"segment":1,"confidence":9.025562487331367,"asi":{"hypothesis":"Iter19 (SPY): vol_lookback 21->34 (sizing lever) on the sma_trend=210 P20 base. A longer window gives smoother vol estimates for inverse-vol sizing -> potentially better 2022 risk-balancing.","result":"2022 FLOOR CRASHED + INSTABILITY EXPLODED: worst_year 0.435 -> 0.099 (2022 0.43 -> 0.10). perturb_worst_std 0.10 -> 0.23 (EXPLODED, guard violated). 2018 0.98->0.71 (weak year worse). BUT secondaries up: sharpe 1.40->1.52, cagr 0.71->0.79, robust 0.93->1.01, meanY 1.26->1.40. Good years up (2015 0.52->0.84, 2017 0.80->1.55, 2020 1.97->2.54). Same pattern as iter18 (ts_mom_skip=1): chases avg return, crashes 2022 floor.","decision":"DISCARD -- 2022 floor crashed (0.43->0.10) AND perturb_worst_std exploded (0.10->0.23, guard violated). vol_lookback=34 smooths the inverse-vol sizing too much, hurting 2022 risk-balancing. vol_lookback=21 confirmed the sweet spot (same as IWV).","conclusion":"vol_lookback EXHAUSTED: 21 is the sweet spot. All 5 tweaks on the iter14 base (sma_trend=220, sma_slow=45, veto_horizon=10, ts_mom_skip=1, vol_lookback=34) either crash 2022, are overfit, or no-op. iter14 (sma_trend=210, P20 0.30, ts_mom=10 skip=0, sma 3/50, max_holdings=2, vol_scaled vol_lookback=21) is converging to a robust optimum.","next_action":"Run the HONEST 6-test checklist on the iter14 champion (sma_trend=210) to (1) validate it is not overfit, (2) find any new T4 candidates on the 210 base. This is the right closing action -- validate the current champion properly (the iter5 checklist was on the 201 base)."}}
{"run":49,"commit":"9ac65bc","metric":0.434707,"metrics":{"best_year_sharpe":2.652609,"cagr":0.763133,"calmar":1.766715,"information_ratio":1.426773,"max_drawdown":-0.43195,"mean_year_sharpe":1.347553,"n_years":11,"perturb_mean_sharpe":1.459062,"perturb_mean_worst_year":0.223892,"perturb_robust_std":0.05348,"perturb_sharpe_std":0.038532,"perturb_worst_year_std":0.094912,"robust_score":1.025468,"sharpe":1.495261,"sortino":2.163103,"std_year_sharpe":0.644171,"veto_pct":0.02974,"year_2015_sharpe":0.489051,"year_2016_sharpe":1.840246,"year_2017_sharpe":0.802105,"year_2018_sharpe":0.982991,"year_2019_sharpe":1.150752,"year_2020_sharpe":1.990246,"year_2021_sharpe":1.340779,"year_2022_sharpe":0.434707,"year_2023_sharpe":1.753176,"year_2024_sharpe":2.652609,"year_2025_sharpe":1.386422,"year_2022_cagr":0.152286,"year_2018_cagr":0.366704,"year_2025_cagr":0.931648},"status":"keep","description":"Iter20 (SPY): P20 veto_threshold 0.30->0.35 on 210 base. CLEAN PARETO WIN: worst_year EQUAL (0.4347, 2022 floor held exactly), sharpe 1.40->1.50 (+6.7%), cagr 0.71->0.76 (+8.2%), robust 0.93->1.03 (+10.8%, MORE robust), sortino 2.16, calmar 1.77. perturb_worst_std HELD (0.095, no explosion), perturb_floor +0.22 positive. Strong years up (2021/2023/2025), weak years unchanged. 210 base absorbed extra vetoing (3.0% vs 1.4%) without destabilizing. KEEP.","timestamp":1782754325255,"segment":1,"confidence":7.871152750770925,"asi":{"hypothesis":"Iter20 (SPY): P20 veto_threshold 0.30->0.35 on the sma_trend=210 base. The HONEST checklist T4 (re-run on the 210 base) flagged this as a Pareto candidate: worst_year EQUAL (+0.4347, 2022 floor held) but sharpe 1.40->1.50 (+6.7%), cagr 0.71->0.76 (+8.2%). iter7 tested 0.35 on the 201 base and discarded it as return-chasing (perturb_worst_std 0.13->0.14, perturb_floor +0.17->+0.15). But the 210 base is more stable (perturb_worst_std=0.089 vs 0.13), so the stability tradeoff may differ. MUST confirm with the perturbation test.","result":"CLEAN PARETO WIN + STABLE: worst_year EQUAL (+0.4347, 2022 floor held EXACTLY). Weak years 2018/2022 unchanged (0.98/0.43). Strong years improved materially: 2021 1.06->1.34, 2023 1.52->1.75, 2025 0.81->1.39. sharpe 1.40->1.50 (+6.7%), cagr 0.71->0.76 (+8.2%), sortino 2.01->2.16, calmar 1.63->1.77, robust_score 0.93->1.03 (+10.8%, MORE robust), meanY 1.26->1.35, stdY 0.65->0.64 (less dispersion). CRITICAL: perturb_worst_std HELD at 0.0949 (vs champion 0.10; no explosion), perturb_mean_worst_year +0.22 (still strongly positive), perturb_sharpe_std 0.039 (down, more stable). Overfitting guard SATISFIED (perturb_worst_std did not rise >0.10 above best). veto_pct 1.4%->3.0% (more vetoing but floor held -- extra vetoes hit strong-year names, not weak-year floor).","decision":"KEEP -- Pareto win: floor held (0.4347), risk-adjusted return improved (sharpe/sortino/calmar/cagr all up), robustness IMPROVED (robust_score 0.93->1.03, perturb_worst_std held, perturb_floor positive). The 210 base absorbed the extra vetoing without destabilizing (unlike the 201 base in iter7). Following IWV iter13 precedent (kept stable Pareto win with equal primary). Not overfit: perturbation test confirmed, honest checklist T4 flagged it (not cherry-picked), floor not sacrificed. Directly aligned with user objective (risk-adjusted return + robustness).","why_not_overfit":"(1) 2022 floor held exactly (0.4347) -- weak-year robustness NOT sacrificed. (2) perturb_worst_std=0.0949 did NOT explode (guard satisfied). (3) perturb_mean_worst_year=+0.22 positive. (4) robust_score IMPROVED 0.93->1.03. (5) Honest checklist T4 flagged the candidate (not cherry-picked). (6) Improvement material (sharpe +6.7%, cagr +8.2%, well beyond 0.03sigma noise).","next_action":"Re-run the honest 6-test checklist on the iter20 champion (0.35 on 210 base) to (1) validate it with 12 perturbation runs + full T4 sweep, (2) check if any new Pareto candidate emerges on the 0.35 base. The 0.35 threshold is now bracketed: 0.30 (floor-robust, lower return) and 0.35 (Pareto, higher return, floor held). Test 0.325 to find the true sweet spot if 0.35 confirms stable."}}
{"run":50,"commit":"9ac65bc","metric":0.16597,"metrics":{"best_year_sharpe":2.601106,"cagr":0.719151,"calmar":1.773658,"information_ratio":1.378077,"max_drawdown":-0.405462,"mean_year_sharpe":1.294635,"n_years":11,"perturb_mean_sharpe":1.455285,"perturb_mean_worst_year":0.120554,"perturb_robust_std":0.074271,"perturb_sharpe_std":0.04479,"perturb_worst_year_std":0.210446,"robust_score":0.958933,"sharpe":1.453074,"sortino":2.13999,"std_year_sharpe":0.671403,"veto_pct":0.061544,"year_2015_sharpe":0.533768,"year_2016_sharpe":1.242499,"year_2017_sharpe":0.660851,"year_2018_sharpe":1.071771,"year_2019_sharpe":1.463619,"year_2020_sharpe":2.059484,"year_2021_sharpe":1.10343,"year_2022_sharpe":0.16597,"year_2023_sharpe":1.753176,"year_2024_sharpe":2.601106,"year_2025_sharpe":1.585308,"year_2022_cagr":0.047641,"year_2018_cagr":0.432756,"year_2025_cagr":1.079343},"status":"discard","description":"Iter21 (SPY): P20 veto_threshold 0.35->0.40. FLOOR CRASHED + perturb_worst_std EXPLODED (0.095->0.210, guard violated). 2022 floor 0.43->0.17; extra vetoing (6.2%) hit 2022 winners. robust 1.03->0.96. veto_threshold fully bracketed: 0.35 is the confirmed sweet spot. Discard.","timestamp":1782754527342,"segment":1,"confidence":8.35449001928389,"asi":{"hypothesis":"Iter21 (SPY): P20 veto_threshold 0.35->0.40 on the 210 base. Bracket the upper edge. If the floor holds at 0.4347 and perturbation stays stable, another Pareto step. If the floor drops or perturb_worst_std explodes, 0.35 is the confirmed sweet spot.","result":"FLOOR CRASHED + INSTABILITY EXPLODED: worst_year 0.4347 -> 0.166 (2022 floor 0.43 -> 0.17). perturb_worst_std EXPLODED 0.0949 -> 0.210 (overfitting guard VIOLATED, >0.10 above best 0.089). perturb_mean_worst_year 0.22 -> 0.12 (halved). robust_score 1.025 -> 0.959 (dropped). sharpe 1.495 -> 1.453 (dropped). veto_pct 3.0% -> 6.2% (extra vetoing hit 2022 winners). 2016 also dropped (1.84 -> 1.24).","decision":"DISCARD -- 2022 floor crashed (0.4347->0.166) AND perturb_worst_std exploded (0.095->0.210, guard violated). The extra vetoing at 0.40 (6.2%) vetoed 2022 winners. The anti-overfit guard caught it exactly as designed.","conclusion":"veto_threshold FULLY BRACKETED: 0.25 (under-veto, 0.333) -> 0.30 (floor-robust, 0.4347) -> 0.35 (Pareto sweet spot, 0.4347 + best secondaries) -> 0.40 (floor crashed, 0.166). 0.35 is the confirmed sweet spot (iter20 champion). The param space is now TRULY exhausted.","next_action":"Validate iter20 (0.35) champion with the FULL honest 6-test checklist (12 perturbations + full T4 sweep on the 0.35 base). This is the right closing validation -- confirms the Pareto win is real and finds any new T4 candidates on the 0.35 base. After that, structural efforts (Phase 2 ICF) are the only remaining path to lift the floor above 0.4347."}}
{"run":51,"commit":"9ac65bc","metric":0.434707,"metrics":{"best_year_sharpe":2.652609,"cagr":0.763133,"calmar":1.766715,"information_ratio":1.426773,"max_drawdown":-0.43195,"mean_year_sharpe":1.347553,"n_years":11,"perturb_mean_sharpe":1.446179,"perturb_mean_worst_year":0.223892,"perturb_robust_std":0.056435,"perturb_sharpe_std":0.029001,"perturb_worst_year_std":0.094912,"robust_score":1.025468,"sharpe":1.495261,"sortino":2.163103,"std_year_sharpe":0.644171,"veto_pct":0.029739,"year_2015_sharpe":0.489051,"year_2016_sharpe":1.840246,"year_2017_sharpe":0.802105,"year_2018_sharpe":0.982991,"year_2019_sharpe":1.150752,"year_2020_sharpe":1.990246,"year_2021_sharpe":1.340779,"year_2022_sharpe":0.434707,"year_2023_sharpe":1.753176,"year_2024_sharpe":2.652609,"year_2025_sharpe":1.386422,"year_2022_cagr":0.152286,"year_2018_cagr":0.366704,"year_2025_cagr":0.931648},"status":"discard","description":"Iter22 (SPY): combined asset_growth=16 + earnings_yield=2 on 0.35/210 base. BIT-IDENTICAL no-op (sharpe 1.4953, worst_year 0.4347, all years identical). Fundamentals confirmed inert at 2% weight -- 98% technical dominates. Param space truly exhausted. Discard.","timestamp":1782755480381,"segment":1,"confidence":6.0452248419845835,"asi":{"hypothesis":"Iter22 (SPY): combine asset_growth=16 + earnings_yield=2 on the 0.35/210 base. The honest checklist T4 sweep on the 0.35 base flagged both as tiny Pareto wins (floor held, sharpe +0.011/+0.014). Single-param T4 can't catch interactions; combining them might compound to a material gain. The fundamentals are 2% of weight, so they don't touch the 2022 floor (technical-driven) -- pure secondary tilt. Perturbation test judges if the compounded gain is real or noise.","result":"BIT-IDENTICAL NO-OP: worst_year=0.434707, sharpe=1.495261, cagr=0.763133, robust=1.025468, perturb_worst_std=0.094912 -- ALL IDENTICAL to iter20 champion. Every year sharpe identical. The fundamentals (asset_growth, earnings_yield) have ZERO effect at fundamental_group_weight=0.02. The 98% technical momentum dominates -> top-2 stock picks unchanged. The checklist T4 '[rebuild]' differences (sharpe +0.011/+0.014) were numerical noise from the rebuild path, not real signal.","decision":"DISCARD -- bit-identical no-op. The combined fundamental tilt has zero effect. Confirms fundamentals are completely inert at 2% weight.","conclusion":"PARAM SPACE TRULY EXHAUSTED. Fundamentals confirmed dead (2% weight can't move the 98% technical-driven ranking). All param levers now tested: veto_threshold (0.25/0.30/0.35/0.40 bracketed, 0.35 sweet spot), sma_trend (190/210/220, 210 sweet spot), sma_slow (45/50/55, 50 sweet spot), sma_fast (2/3/4, 3 sweet spot), ts_mom (8/10/11, 10 sweet spot), ts_mom_skip (0/1, 0), vol_lookback (21/34, 21), trailing_vol_window (21/34, 21), veto_horizon (10/21, 21 no-op), max_holdings (2/3, 2), fundamentals (inert), macro (dead), min_volume (no-op), cost (noise). iter20 champion (0.35, 210, P20) is the converged robust optimum.","next_action":"Move to STRUCTURAL directions -- the only remaining path to improve. Options: (1) Phase 2 ICF (improve P20 forecast accuracy via in-context same-sector volume), (2) tfm_alpha_weight (add TimesFM return forecast as a NEW selection signal -- untested, structural), (3) defensive factor tilt (lift the 2022 floor above 0.4347 -- structural, may need AppConfig support). Investigate which is feasible next."}}
{"run":52,"commit":"9ac65bc","metric":0.28748,"metrics":{"best_year_sharpe":2.859701,"cagr":0.843291,"calmar":1.952287,"information_ratio":1.55525,"max_drawdown":-0.43195,"mean_year_sharpe":1.419875,"n_years":11,"perturb_mean_sharpe":1.487057,"perturb_mean_worst_year":0.133105,"perturb_robust_std":0.090872,"perturb_sharpe_std":0.09158,"perturb_worst_year_std":0.121257,"robust_score":1.069559,"sharpe":1.58424,"sortino":2.277778,"std_year_sharpe":0.700631,"veto_pct":0.030175,"year_2015_sharpe":0.429678,"year_2016_sharpe":1.840246,"year_2017_sharpe":1.241872,"year_2018_sharpe":0.951494,"year_2019_sharpe":1.237485,"year_2020_sharpe":1.923811,"year_2021_sharpe":1.340779,"year_2022_sharpe":0.28748,"year_2023_sharpe":1.998563,"year_2024_sharpe":2.859701,"year_2025_sharpe":1.507512,"year_2022_cagr":0.09309,"year_2018_cagr":0.356234,"year_2025_cagr":1.061661},"status":"discard","description":"Iter23 (SPY): activate ema_crossover 21/63 (was degenerate 21/21). RETURN-CHASING: 2022 floor regressed 0.43->0.29, primary 0.4347->0.287. Strong years up (sharpe 1.58, cagr 0.84) but floor hurt (trend noise in bear market). Same pattern as vol-gate. Degenerate 21/21 (off) was correct. Param space + quick structural tests exhausted. Discard.","timestamp":1782755704740,"segment":1,"confidence":8.8402986885499,"asi":{"hypothesis":"Iter23 (SPY): activate the degenerate ema_crossover indicator at its config default (ema_slow 21->63, ema_fast stays 21). The ema_crossover is an ENABLED indicator (config.py line 55) computed as (EMA_fast - EMA_slow)/EMA_slow, but the champion sets 21/21 -> signal always 0 (degenerate/off). Never tested in IWV or SPY journeys. Activating it adds a medium-term trend signal (between SMA 3/50 and trend 210) to the composite. Structural change, no cache/code needed. Perturbation test is the guard.","result":"RETURN-CHASING -- 2022 FLOOR REGRESSED: worst_year 0.4347 -> 0.287 (2022 0.43 -> 0.29, 2015 0.49 -> 0.43). The EMA crossover boosts strong years (sharpe 1.50 -> 1.58 +6%, cagr 0.76 -> 0.84 +10.5%, 2023 1.75 -> 2.00, 2024 2.65 -> 2.86) but HURTS the bear-market floor. std_year_sharpe rose 0.64 -> 0.70 (more dispersion = peak-dependent). perturb_mean_worst_year dropped 0.22 -> 0.13 (perturbed floor weakened). perturb_worst_std 0.095 -> 0.121 (rose but within guard). robust_score 1.025 -> 1.070 (up but driven by peak years).","decision":"DISCARD -- primary metric REGRESSED (worst_year 0.4347 -> 0.287). The EMA crossover adds trend noise in bear markets (2022 chop -> whipsaw), hurting the floor. Same return-chasing pattern as vol-gate/ts_mom_skip/vol_lookback=34. The degenerate 21/21 (EMA off) was the CORRECT choice.","conclusion":"EMA crossover REJECTED for this momentum strategy (same lesson as vol-gate: trend signals hurt the 2022 floor). The degenerate 21/21 (off) is correct. Both the param space AND quick structural tests are now exhausted: all params bracketed, fundamentals inert, EMA crossover rejected. The iter20 champion (0.35, 210, P20, ema 21/21 off) is the converged robust optimum, fully validated (6 tests PASS, OOS min +0.730).","next_action":"Remaining structural directions all need BIG efforts (cache regeneration + harness code paths): (1) tfm_alpha_weight (regenerate logret cache for ~380 missing SPY symbols on GPU ~1-2h, add harness alpha code path), (2) Phase 2 ICF (ICF checkpoint + multi-series context), (3) defensive factor tilt (AppConfig support). Update docs with iter20 as final validated champion + EMA rejection, then assess feasibility of the tfm_alpha cache regeneration."}}
{"run":53,"commit":"68e7c2d","metric":0.434707,"metrics":{"best_year_sharpe":2.652609,"cagr":0.763133,"calmar":1.766715,"information_ratio":1.426773,"max_drawdown":-0.43195,"mean_year_sharpe":1.347553,"n_years":11,"perturb_mean_sharpe":1.459062,"perturb_mean_worst_year":0.223892,"perturb_robust_std":0.05348,"perturb_sharpe_std":0.038532,"perturb_worst_year_std":0.094912,"robust_score":1.025468,"sharpe":1.495261,"sortino":2.163103,"std_year_sharpe":0.644171,"veto_pct":0.02974,"year_2015_sharpe":0.489051,"year_2016_sharpe":1.840246,"year_2017_sharpe":0.802105,"year_2018_sharpe":0.982991,"year_2019_sharpe":1.150752,"year_2020_sharpe":1.990246,"year_2021_sharpe":1.340779,"year_2022_sharpe":0.434707,"year_2023_sharpe":1.753176,"year_2024_sharpe":2.652609,"year_2025_sharpe":1.386422,"year_2022_cagr":0.152286,"year_2018_cagr":0.366704,"year_2025_cagr":0.931648},"status":"discard","description":"Iter24 (SPY): require_positive_composite false. BIT-IDENTICAL no-op -- flag is non-binding (top-2 always positive composite in 500-name universe). Entire quick-test space exhausted. Only big structural efforts remain. Discard.","timestamp":1782755975507,"segment":1,"confidence":6.0452248419845835,"asi":{"hypothesis":"Iter24 (SPY): require_positive_composite true->false. The flag gates whether the strategy only holds positive-composite (positive-momentum) stocks. Currently true, never tested in IWV or SPY. In 2022 (bear market), if the top-2 momentum stocks have negative composite, requiring positive would skip them -> hold cash or lower-ranked stocks. Relaxing could change 2022 bear-market selection. Quick test, no cache/code needed.","result":"BIT-IDENTICAL NO-OP: worst_year=0.434707, sharpe=1.495261, all metrics IDENTICAL to iter20 champion. The require_positive_composite flag is NON-BINDING -- the top-2 stocks in the 500-name universe always have positive composite (even in 2022, the momentum rotation finds positive-momentum names; some sectors/stocks are always up). The flag never binds, so relaxing it has zero effect.","decision":"DISCARD -- bit-identical no-op. require_positive_composite is non-binding (dead constraint).","conclusion":"ENTIRE QUICK-TEST SPACE EXHAUSTED. All wired params now tested: bracketed (veto_threshold 0.25/0.30/0.35/0.40, sma_trend 190/210/220, sma_slow 45/50/55, sma_fast 2/3/4, ts_mom 8/10/11, vol_lookback 21/34, trailing_vol 21/34), rejected (ema_crossover 21/63, vol-gate), no-op (fundamentals at 2%, veto_horizon 10, min_volume 10/12M, macro thresholds, require_positive_composite, cost 2/4bps within noise). The iter20 champion is the converged robust optimum. Only BIG structural efforts remain (tfm_alpha cache regen, ICF, defensive tilt).","next_action":"Start the tfm_alpha structural effort (most self-contained; logret cache partially exists, script adaptable, harness modifiable): (1) adapt generate_spy_forecasts.py for kind=logret, (2) regenerate logret cache for ~380 missing SPY symbols on GPU, (3) add harness code path to load logret panel + compute return-alpha signal, (4) test+tune tfm_alpha_weight. CAVEAT: research warns TSFM return forecasts disappoint zero-shot -- uncertain reward."}}
