{"run":20,"commit":"f8916d4","metric":0.219862,"metrics":{"best_year_sharpe":2.201274,"cagr":0.514632,"calmar":1.218709,"information_ratio":0.956262,"max_drawdown":-0.422276,"mean_year_sharpe":0.99684,"n_years":11,"perturb_mean_worst_year":-0.134062,"perturb_robust_std":0.108425,"perturb_sharpe_std":0.087516,"perturb_worst_year_std":0.348586,"robust_score":0.708031,"sharpe":1.073994,"sortino":1.625702,"std_year_sharpe":0.577618,"veto_pct":0.091747,"year_2015_sharpe":0.613434,"year_2016_sharpe":1.459918,"year_2017_sharpe":0.263347,"year_2018_sharpe":0.568237,"year_2019_sharpe":0.99206,"year_2020_sharpe":2.201274,"year_2021_sharpe":0.791898,"year_2022_sharpe":0.219862,"year_2023_sharpe":1.48162,"year_2024_sharpe":1.48958,"year_2025_sharpe":0.884008,"year_2022_cagr":0.058035,"year_2018_cagr":0.215621,"year_2025_cagr":0.504446},"status":"discard","description":"Iter19: trailing_vol_window 21->13. Too reactive: worst_year equal +0.22 but stdY 0.40->0.58, robust_score 0.75->0.71, 2017 0.85->0.26. More peak-dependent. Discard; trailing_vol_window=21 (iter18) is the sweet spot.","timestamp":1782737557855,"segment":0,"confidence":null,"asi":{"hypothesis":"trailing_vol_window 21->13 (push veto reactivity further; shorter trailing baseline)","result":"TOO REACTIVE / MORE PEAK-DEPENDENT: worst_year EQUAL +0.22 (2022). Return up: sharpe 1.01->1.07, cagr 0.47->0.51, calmar 1.15->1.22, sortino 1.50->1.63, 2020 1.46->2.20 (peak), 2023 1.02->1.48. BUT stdY 0.40->0.58 (dispersion UP 45%), robust_score 0.75->0.71 (DOWN), 2017 0.85->0.26 (sharp drop), 2025 1.05->0.88. perturb_worst_std 0.36->0.35 (stable)","decision":"DISCARD -- primary equal, but dispersion rose sharply and 2017 collapsed (0.85->0.26). The return gain is driven by a 2020 peak (one year), making the strategy more peak-dependent = opposite of robustness priority. iter18 (trailing_vol_window=21) has lower dispersion and higher robust_score","conclusion":"trailing_vol_window sweet spot is 21: 53 too slow (floor -0.031, iter13), 13 too reactive (dispersion up, 2017 suffers), 21 optimal (positive floor +0.22 + low stdY 0.40). Lever EXHAUSTED at 21","next_action":"Run final full overfitting checklist on iter18 (the all-years-positive best, trailing_vol_window=21) to validate T1/T4 on this config. Then try veto_horizon 21->10 (untested, different lever) or conclude the robust champion."}}
{"run":21,"commit":"f8916d4","metric":0.219862,"metrics":{"best_year_sharpe":1.759263,"cagr":0.475964,"calmar":1.163546,"information_ratio":0.892838,"max_drawdown":-0.409063,"mean_year_sharpe":0.955975,"n_years":11,"perturb_mean_worst_year":-0.121434,"perturb_robust_std":0.122705,"perturb_sharpe_std":0.109608,"perturb_worst_year_std":0.360743,"robust_score":0.719296,"sharpe":1.018761,"sortino":1.515517,"std_year_sharpe":0.473358,"veto_pct":0.082673,"year_2015_sharpe":0.552722,"year_2016_sharpe":1.759263,"year_2017_sharpe":0.427266,"year_2018_sharpe":0.561581,"year_2019_sharpe":0.99206,"year_2020_sharpe":1.459757,"year_2021_sharpe":0.791898,"year_2022_sharpe":0.219862,"year_2023_sharpe":1.018955,"year_2024_sharpe":1.535581,"year_2025_sharpe":1.196782,"year_2022_cagr":0.058035,"year_2018_cagr":0.211215,"year_2025_cagr":0.82101},"status":"discard","description":"Iter20: veto_horizon 21->10. Within-noise wash (worst_year equal +0.22) but stdY 0.40->0.47, 2017 0.85->0.43, robust_score down. Discard; veto_horizon=21 optimal. Veto params fully tuned.","timestamp":1782737697869,"segment":0,"confidence":null,"asi":{"hypothesis":"veto_horizon 21->10 (shorter forecast horizon; pred_vol over 10 sessions instead of 21)","result":"WITHIN-NOISE WASH: worst_year EQUAL +0.22, sharpe 1.01->1.02, cagr 0.47->0.48 (essentially equal). BUT stdY 0.40->0.47 (dispersion UP), 2017 0.85->0.43 (dropped), robust_score 0.75->0.72, perturb_sharpe_std 0.085->0.110. 2016 1.36->1.76, 2025 1.05->1.20 improved but net more dispersion","decision":"DISCARD -- primary equal, headline within noise, robustness direction slightly negative (stdY up, 2017 down, robust_score down). veto_horizon=21 is the robust choice","conclusion":"Veto params FULLY TUNED: veto_threshold=0.80 (iter13), trailing_vol_window=21 (iter18, the big win), veto_horizon=21 (iter20). The veto lever set is exhausted. iter18 is the robust champion: worst_year=+0.22 (all 11 years positive), sharpe=1.01, robust=0.75, stdY=0.40, maxdd=-0.41","next_action":"Run FINAL definitive full overfitting checklist on iter18 (all-years-positive champion) to validate T1/T4/T6 on this config. This is the validation the user asked for on the optimized strategy."}}
{"run":22,"commit":"0cefb69","metric":0.312428,"metrics":{"best_year_sharpe":1.412669,"cagr":0.443117,"calmar":1.061918,"information_ratio":0.840352,"max_drawdown":-0.41728,"mean_year_sharpe":0.933661,"n_years":11,"perturb_mean_worst_year":0.040283,"perturb_robust_std":0.105882,"perturb_sharpe_std":0.119766,"perturb_worst_year_std":0.277221,"robust_score":0.781571,"sharpe":0.965408,"sortino":1.396904,"std_year_sharpe":0.304182,"veto_pct":0.084791,"year_2015_sharpe":0.80839,"year_2016_sharpe":1.412669,"year_2017_sharpe":1.120889,"year_2018_sharpe":0.940109,"year_2019_sharpe":0.722006,"year_2020_sharpe":1.395068,"year_2021_sharpe":0.702311,"year_2022_sharpe":0.312428,"year_2023_sharpe":0.924816,"year_2024_sharpe":1.104113,"year_2025_sharpe":0.827477,"year_2022_cagr":0.09896,"year_2018_cagr":0.408419,"year_2025_cagr":0.45618},"status":"keep","description":"Iter21: ts_mom 9->10 on iter18 base. Robust win: worst_year +0.22->+0.31, stdY 0.40->0.30, robust 0.75->0.78, perturb_worst_std DROPPED 0.36->0.28 (more stable). All years positive, perturbed floor +0.04. KEEP.","timestamp":1782738532260,"segment":0,"confidence":null,"asi":{"hypothesis":"ts_mom 9->10 re-tested on iter18 base (trailing_vol_window=21); checklist T4 flagged floor +0.31 candidate","result":"ROBUST WIN: worst_year +0.22 -> +0.31 (2022 floor; 2018 +0.56->+0.94, 2015 0.55->0.81, 2017 0.85->1.12). stdY 0.40->0.30 (dispersion down), robust_score 0.75->0.78. CRUCIALLY perturb_worst_std DROPPED 0.36->0.28 (MORE stable, not overfit), perturb_mean_worst_year -0.12 -> +0.04 (perturbed floor now POSITIVE), perturb_robust_std 0.10->0.11. Cost: sharpe 1.01->0.97, cagr 0.47->0.44, best_year 1.63->1.41 (good years 2024 1.63->1.10 down)","decision":"KEEP -- primary improved (+0.09), dispersion down, robust_score up, AND perturbation instability DROPPED. The opposite of overfitting. Return sacrifice is small (sharpe 0.97, cagr 0.44 still strong). Longer momentum (10mo) = smoother trends = more consistent across years, especially weak ones","contrast_with_iter15":"iter15 was ts_mom=10 at trailing_vol_window=53 (veto less protective) -> within-noise floor gain + real return loss -> discarded. Here at trailing_vol_window=21 (veto more protective) the interaction is robustly positive. The veto set change ENABLED ts_mom=10","next_action":"Iter22: test ts_mom 10->11 (push momentum lookback further now that 10 robustly improved). Watch perturb_worst_std (now 0.28, comfortable). If 11 helps keep; else ts_mom=10 optimal. Then final checklist on the new champion."}}
{"run":23,"commit":"0cefb69","metric":0.425031,"metrics":{"best_year_sharpe":1.412644,"cagr":0.418678,"calmar":1.003349,"information_ratio":0.796031,"max_drawdown":-0.41728,"mean_year_sharpe":0.866381,"n_years":11,"perturb_mean_worst_year":-0.020842,"perturb_robust_std":0.100017,"perturb_sharpe_std":0.067538,"perturb_worst_year_std":0.338642,"robust_score":0.690909,"sharpe":0.92536,"sortino":1.329823,"std_year_sharpe":0.350943,"veto_pct":0.085612,"year_2015_sharpe":0.425031,"year_2016_sharpe":1.36182,"year_2017_sharpe":0.810762,"year_2018_sharpe":0.703725,"year_2019_sharpe":0.641734,"year_2020_sharpe":1.412644,"year_2021_sharpe":0.550981,"year_2022_sharpe":0.444631,"year_2023_sharpe":1.257211,"year_2024_sharpe":1.170779,"year_2025_sharpe":0.75087,"year_2022_cagr":0.160439,"year_2018_cagr":0.279304,"year_2025_cagr":0.38681},"status":"discard","description":"Iter22: ts_mom 10->11. worst_year +0.31->+0.43 is a floor-shift artifact (2015 became floor, deteriorated 0.81->0.43); robust_score 0.78->0.69, perturb_worst_std 0.28->0.34, perturbed floor -0.02. Overfit to point estimate. Discard; ts_mom=10 optimal.","timestamp":1782738701064,"segment":0,"confidence":null,"asi":{"hypothesis":"ts_mom 10->11 (push momentum lookback further; ts_mom=10 robustly improved so test 11)","result":"PRIMARY UP BUT ROBUSTNESS DOWN: worst_year +0.31 -> +0.43 (headline up) BUT the floor SHIFTED from 2022 to 2015 (2015 actually DETERIORATED 0.81->0.43, while 2022 rose 0.31->0.44). robust_score 0.78->0.69 (DOWN 0.09), stdY 0.30->0.35 (dispersion UP), perturb_worst_std 0.28->0.34 (UP), perturb_mean_worst_year +0.04 -> -0.02 (perturbed floor NEGATIVE again), meanY 0.93->0.87, sharpe 0.97->0.93, cagr 0.44->0.42. 2015/2018/2019/2021 all worse","decision":"DISCARD -- the worst_year 'improvement' is a floor-SHIFT ARTIFACT (min moved to a less-bad year that itself got worse), not a real robustness gain. True robustness deteriorated on every composite: robust_score, stdY, perturb_worst_std, perturb_mean_worst_year, meanY. This is optimizing the worst-year point estimate at the expense of year-consistency = exactly the overfit-to-benchmark the user warned against","conclusion":"ts_mom=10 (iter21) is the ROBUST OPTIMUM: highest robust_score 0.78, lowest perturb_worst_std 0.28, positive perturbed floor +0.04. ts_mom lever EXHAUSTED (9->iter18 +0.22, 10->iter21 +0.31 best, 11->iter22 overfit). Do not push ts_mom beyond 10","next_action":"Run FINAL validation checklist on iter21 (the robust champion: worst_year +0.31, robust 0.78, stdY 0.30, perturb_worst_std 0.28). Update prompt.md with iter21 as current champion. Then the robust champion is established."}}
{"run":24,"commit":"f2f8a2e","metric":-1.409295,"metrics":{"best_year_sharpe":2.089054,"cagr":0.259878,"calmar":0.398285,"information_ratio":0.459522,"max_drawdown":-0.652493,"mean_year_sharpe":0.515362,"n_years":11,"perturb_mean_worst_year":-1.181683,"perturb_robust_std":0.072885,"perturb_sharpe_std":0.083128,"perturb_worst_year_std":0.253276,"robust_score":-0.047531,"sharpe":0.634903,"sortino":0.92243,"std_year_sharpe":1.125786,"veto_pct":0.083789,"year_2015_sharpe":-0.338766,"year_2016_sharpe":1.412669,"year_2017_sharpe":1.069593,"year_2018_sharpe":-0.449307,"year_2019_sharpe":0.392191,"year_2020_sharpe":2.089054,"year_2021_sharpe":1.747134,"year_2022_sharpe":-1.409295,"year_2023_sharpe":1.871442,"year_2024_sharpe":-0.571929,"year_2025_sharpe":-0.143799,"year_2022_cagr":-0.586333,"year_2018_cagr":-0.14906,"year_2025_cagr":-0.037256},"status":"discard","description":"Iter23: IC weights grouped_ic. DISASTER: worst_year +0.31->-1.41 (worse than baseline), stdY 0.30->1.13 (4x dispersion), 6 years negative. IC weights overfit per-fold. Discard; fixed grouped_equal confirmed optimal.","timestamp":1782739692595,"segment":0,"confidence":null,"asi":{"hypothesis":"IC-weighted factors (use_indicator_ic_weights=true, grouped_ic) -- adaptive per-fold weights might improve OOS; champion uses fixed grouped_equal","result":"DISASTER: worst_year +0.31 -> -1.41 (2022 crashed, WORSE than baseline -1.05), sharpe 0.97->0.63, cagr 0.44->0.26, maxdd -0.42->-0.65, stdY 0.30->1.13 (dispersion QUADRUPLED), robust_score 0.78->-0.05, 6 years negative (2015 -0.34, 2018 -0.45, 2022 -1.41, 2024 -0.57, 2025 -0.14). 2020 2.09 and 2023 1.87 spiked but most years crashed","decision":"DISCARD -- IC weights overfit per-fold (huge dispersion, crashes in most years, spikes in a few). Confirms the champion's fixed grouped_equal weights are far more robust. The README's note that IC weights are unstable holds on top-500 too","conclusion":"IC weights (grouped_ic / use_ic=true) are a DEAD lever -- the worst result of the entire 24-experiment run. Fixed grouped_equal weights confirmed optimal. The champion iter21 stands","next_action":"Iter24: train_years 5->7 (last low-risk marginal test; with fixed weights it only shifts walk-forward split eligibility). Then the loop has converged -- report final robust champion iter21."}}
{"run":25,"commit":"f2f8a2e","metric":0.312428,"metrics":{"best_year_sharpe":1.412669,"cagr":0.443117,"calmar":1.061918,"information_ratio":0.840352,"max_drawdown":-0.41728,"mean_year_sharpe":0.933661,"n_years":11,"perturb_mean_worst_year":0.040283,"perturb_robust_std":0.105882,"perturb_sharpe_std":0.119766,"perturb_worst_year_std":0.277221,"robust_score":0.781571,"sharpe":0.965408,"sortino":1.396904,"std_year_sharpe":0.304182,"veto_pct":0.084791,"year_2015_sharpe":0.80839,"year_2016_sharpe":1.412669,"year_2017_sharpe":1.120889,"year_2018_sharpe":0.940109,"year_2019_sharpe":0.722006,"year_2020_sharpe":1.395068,"year_2021_sharpe":0.702311,"year_2022_sharpe":0.312428,"year_2023_sharpe":0.924816,"year_2024_sharpe":1.104113,"year_2025_sharpe":0.827477,"year_2022_cagr":0.09896,"year_2018_cagr":0.408419,"year_2025_cagr":0.45618},"status":"discard","description":"Iter24: train_years 5->7. ZERO EFFECT (bit-identical to iter21) -- dead lever with fixed weights. Discard. OPTIMIZATION CONVERGED: 25 experiments, iter21 robust champion.","timestamp":1782739863560,"segment":0,"confidence":29.494544433161206,"asi":{"hypothesis":"train_years 5->7 (longer training window; with fixed weights it only shifts split eligibility)","result":"ZERO EFFECT -- every metric BIT-IDENTICAL to iter21 (worst_year +0.312, sharpe 0.9654, cagr 0.4431, all year sharpes identical)","decision":"DISCARD -- no-op. With fixed grouped_equal weights (use_ic=false), train_years only affects min_train_rebalances eligibility, which is met for both 5y and 7y windows (data back to 1989, monthly rebalances). Dead lever","conclusion":"OPTIMIZATION FULLY CONVERGED. 25 experiments (8 keeps, 17 discards). iter21 is the robust champion: worst_year +0.31 (all 11 years positive), sharpe 0.97, cagr 0.44, robust 0.78, stdY 0.30, perturb_worst_std 0.28, maxdd -0.42. Every major lever tuned to its robust sweet spot or proven dead/no-op/overfit. Remaining ideas (rebalance_frequency, signal_timeframe) are high-risk structural redesigns that diverge from the task and risk overfitting -- deferred unless user directs.","final_state":"Robust champion iter21 (commit 0cefb69). Baseline worst_year -1.05 -> +0.31. Checklist: 0 neg-OOS folds (was 3), OOS min +0.16 (was -1.27), bear markets positive, perturb_worst_std 0.40->0.28 (instability DROPPED = not overfit), T6 leak PASS. NOT overfit, NOT cheating on benchmarks."}}
{"run":26,"commit":"f2f8a2e","metric":0.275544,"metrics":{"best_year_sharpe":1.833928,"cagr":0.493284,"calmar":1.18214,"information_ratio":0.922898,"max_drawdown":-0.41728,"mean_year_sharpe":1.010184,"n_years":11,"perturb_mean_worst_year":0.025428,"perturb_robust_std":0.117904,"perturb_sharpe_std":0.092501,"perturb_worst_year_std":0.191725,"robust_score":0.735097,"sharpe":1.039883,"sortino":1.48951,"std_year_sharpe":0.550172,"veto_pct":0.085693,"year_2015_sharpe":0.320963,"year_2016_sharpe":1.833928,"year_2017_sharpe":1.619625,"year_2018_sharpe":0.996775,"year_2019_sharpe":0.275544,"year_2020_sharpe":1.717895,"year_2021_sharpe":0.7571,"year_2022_sharpe":0.287092,"year_2023_sharpe":1.132875,"year_2024_sharpe":0.810645,"year_2025_sharpe":1.359578,"year_2022_cagr":0.087445,"year_2018_cagr":0.445324,"year_2025_cagr":1.046931},"status":"discard","description":"Iter25: ts_mom_skip 0->1 (10-1 momentum). Primary regressed 0.312->0.276 (floor shifted to 2019, collapsed 0.72->0.28); stdY 0.30->0.55, robust 0.78->0.74. BUT perturb_worst_std improved 0.28->0.19 and sharpe/cagr/calmar up. More stable signal, not floor-optimal at 10-1. Discard per primary discipline.","timestamp":1782740121949,"segment":0,"confidence":24.51592974390287,"asi":{"hypothesis":"ts_mom_skip_months 0->1 (academic 10-1 momentum: exclude the most recent reversal-contaminated month from the signal; core default is skip=1, champion overrode to 0)","result":"MIXED -- PRIMARY REGRESSED. worst_year 0.312 -> 0.276 (DOWN 0.036); floor SHIFTED from 2022 (0.31->0.29, ~equal) to 2019 which COLLAPSED 0.72->0.28 (and 2015 0.81->0.32). stdY 0.30 -> 0.55 (dispersion nearly DOUBLED, more peak-dependent). robust_score 0.78 -> 0.74 (DOWN). BUT average return UP: sharpe 0.97->1.04, cagr 0.44->0.49, calmar 1.06->1.18, sortino 1.40->1.49, meanY 0.93->1.01. AND perturbation stability IMPROVED: perturb_worst_std 0.28 -> 0.19 (big drop), perturb_mean_worst_year +0.04 -> +0.03 (positive perturbed floor maintained). Good years (2016 1.41->1.83, 2017 1.12->1.62, 2020 1.40->1.72, 2025 0.83->1.36) got much better; weak years (2015, 2019) got worse","decision":"DISCARD -- primary metric (worst_year) regressed 0.312->0.276 and robust_score dropped 0.78->0.74 and stdY rose 0.30->0.55. Per iter22 lesson (don't trade floor robustness for average return) and strict primary discipline, discard even though perturb_worst_std improved and sharpe/cagr/calmar up. The skip=1 signal is genuinely MORE perturbation-stable and higher average return, but it is NOT floor-optimal at the 10-1 combination -- it made good years greater and weak years weaker (more peak-dependent)","conclusion":"skip=1 is a real, deployable, more-stable signal construction (perturb_worst_std 0.28->0.19 is a genuine robustness gain), but the 10-1 combination regresses the worst-year floor by collapsing 2019/2015. The floor regression may be specific to lookback=10. The CANONICAL academic momentum is 12-1 (lookback=12, skip=1) -- worth one test: the longer lookback may recover the floor while keeping the stability gains","deployable":"YES -- ts_mom_skip_months is wired in both harness (line 96) and core (indicators.py:101 time_series_momentum with shift(skip_months)); core default is skip=1","next_action":"Iter26: test canonical 12-1 momentum (lookback=12, skip=1) -- the academic Jegadeesh-Titman/Carhart standard and the core's own default. skip=1 already proved more perturbation-stable; the 12-month lookback (vs 10) may recover the 2019/2015 floor. Principled (canonical construction), deployable, low overfitting risk."}}
{"run":27,"commit":"f2f8a2e","metric":-0.679772,"metrics":{"best_year_sharpe":1.621667,"cagr":0.353392,"calmar":0.790888,"information_ratio":0.674366,"max_drawdown":-0.446829,"mean_year_sharpe":0.758835,"n_years":11,"perturb_mean_worst_year":-0.1925,"perturb_robust_std":0.097982,"perturb_sharpe_std":0.073807,"perturb_worst_year_std":0.329285,"robust_score":0.493848,"sharpe":0.812606,"sortino":1.156356,"std_year_sharpe":0.529973,"veto_pct":0.086696,"year_2015_sharpe":0.467009,"year_2016_sharpe":1.621667,"year_2017_sharpe":0.801049,"year_2018_sharpe":0.799012,"year_2019_sharpe":0.871949,"year_2020_sharpe":1.090718,"year_2021_sharpe":0.800634,"year_2022_sharpe":-0.679772,"year_2023_sharpe":1.000957,"year_2024_sharpe":0.819083,"year_2025_sharpe":0.754873,"year_2022_cagr":-0.245527,"year_2018_cagr":0.338003,"year_2025_cagr":0.388448},"status":"discard","description":"Iter26: 12-1 canonical momentum (lookback=12, skip=1). 2022 crashed to -0.68; perturb_worst_std 0.28->0.33, perturbed floor -0.19. The 12-mo lookback dilutes regime-shift responsiveness. ts_mom 2D grid exhausted: 10-0 (iter21) is the robust peak. Discard.","timestamp":1782740243936,"segment":0,"confidence":24.51592974390287,"asi":{"hypothesis":"Canonical 12-1 momentum (lookback=12, skip=1) -- the Jegadeesh-Titman/Carhart academic standard and the core's own default (config.py: ts_mom_lookback=12, skip=1). skip=1 proved more perturbation-stable at 10-1 (iter25); the 12-month lookback may recover the 2019/2015 floor that collapsed at 10-1","result":"DISASTER -- 2022 CRASHED to -0.68 (negative). worst_year 0.312 -> -0.68 (DOWN 0.99). 2022 cagr -0.25, maxdd -0.32. perturb_worst_std 0.28 -> 0.33 (UP, worse), perturb_mean_worst_year +0.04 -> -0.19 (perturbed floor NEGATIVE). robust_score 0.78 -> 0.49. sharpe 0.97 -> 0.81, cagr 0.44 -> 0.35, calmar 1.06 -> 0.79. 2019 recovered (0.28->0.87) but 2022 collapsed (0.29->-0.68) -- the lookback length trades WHICH year is the floor, and 12 picks 2022 (the worst possible year to crash)","decision":"DISCARD -- primary catastrophically worse (0.31 -> -0.68), perturb_worst_std rose, perturbed floor negative. The 12-month lookback dilutes the regime-shift responsiveness that the 10-month lookback + trailing_vol_window=21 veto provides. 12-1 is the academic standard for broad cross-sectional momentum but is WRONG for this concentrated 2-stock regime-protected construction","conclusion":"ts_mom 2D grid now FULLY sampled: 10-0 (iter21) = +0.31 BEST; 10-1 (iter25) = +0.28; 12-1 (iter26) = -0.68; 11-0 (iter22) = +0.43 point but floor-shift artifact. 10-0 is the robust peak. BOTH ts_mom_lookback and ts_mom_skip EXHAUSTED. iter21 champion (10-0) confirmed robust optimum","deployable":"YES -- both params wired in harness + core","next_action":"ts_mom fully exhausted. Check remaining untuned deployable params (veto_soft_threshold, price_veto_threshold, vol_confidence_weight, require_positive_composite) for CORE wiring before testing -- only test deployable ones (wired in core, not harness-only) to avoid cheating. Prefer robustness-oriented levers over return-chasing ones (tfm_alpha_weight, sup thresholds = overfitting risk)."}}
