{"run":96,"commit":"e75c79a","metric":0.535721,"metrics":{"best_year_sharpe":2.865987,"cagr":0.786926,"calmar":1.693749,"information_ratio":1.392133,"max_drawdown":-0.464606,"mean_year_sharpe":1.294864,"n_years":11,"perturb_mean_sharpe":1.459952,"perturb_mean_worst_year":0.280604,"perturb_robust_std":0.032458,"perturb_sharpe_std":0.038774,"perturb_worst_year_std":0.185999,"robust_score":0.952986,"sharpe":1.461096,"sortino":2.099529,"std_year_sharpe":0.683756,"veto_pct":0.032609,"year_2015_sharpe":0.535721,"year_2016_sharpe":1.831588,"year_2017_sharpe":0.680454,"year_2018_sharpe":0.997742,"year_2019_sharpe":1.066204,"year_2020_sharpe":2.192741,"year_2021_sharpe":1.285697,"year_2022_sharpe":0.694636,"year_2023_sharpe":1.076645,"year_2024_sharpe":2.865987,"year_2025_sharpe":1.016089,"year_2022_cagr":0.287706,"year_2018_cagr":0.390427,"year_2025_cagr":0.601673},"status":"keep","description":"Iter67 (SPY): weight_tilt=0.14 + conf_tilt_vol=true. KEEP -- 14th primary improvement! worst_year 0.5314->0.5357 (+0.004). The 0.14 is the PEAK (last keep before the robustness stop: robust 0.953>0.95, vs 0.15's 0.947). 2022 +0.015, 2015 +0.004 (floor). 2025=1.016 (new canary, above floor). weight_tilt sweep CONVERGED at 0.14. vol-adjusted+weight_tilt EXHAUSTED.","timestamp":1782807066135,"segment":1,"confidence":6.345343028770155,"asi":{"caveats":"1. The robustness (0.953) is JUST above 0.95 (marginal). The 0.15 (iter63) triggered the stop (0.947). So the 0.14 is the PEAK (the last keep before the robustness stop). 2. The 2025 (1.016) is the new canary (dropping, but above the floor 0.536). The vol-adjusted hurts it (high-vol -> tilt more). 3. The weight_tilt sweep is CONVERGED at 0.14 (0.13=0.531, 0.14=0.536, 0.15=stop). 4. The improvement (+0.004) is within noise (perturb 0.186). BUT the stops are not triggered (robust 0.953>0.95, 2017 0.680>0.60).","decision":"KEEP -- 14th primary improvement. The 0.14 is the PEAK (the last keep before the robustness stop). The floor improved (+0.004). The stops are NOT triggered (robust 0.953>0.95, 2017 0.680>0.60). The guard passes (+0.006 < 0.10).","finding":"The weight_tilt sweep (with conf_tilt_vol) is CONVERGED at 0.14: 0.11(0.523) -> 0.13(0.531) -> 0.14(0.536, robust 0.953, PEAK) -> 0.15(0.540, robust 0.947, STOP). The 0.14 is the last keep before the robustness stop (0.953, just above 0.95). The 2025 (1.016) is the new canary (high-vol underperformer, dropping but above the floor). The vol-adjusted + weight_tilt is EXHAUSTED.","hypothesis":"Iter67: weight_tilt=0.14 + conf_tilt_vol=true (the intermediate between 0.13 and 0.15). The 0.13 (iter62, robust 0.959) is safe; the 0.15 (iter63, robust 0.947) triggered the stop. The 0.14 might give a higher floor (~0.536) with robust ~0.953 (above 0.95).","infra_note":"No new infra. Changed weight_tilt 0.13->0.14.","next_action":"The weight_tilt sweep is CONVERGED at 0.14 (floor 0.5357, robust 0.953). The vol-adjusted + weight_tilt is EXHAUSTED. The 2025 (high-vol underperformer) is the new canary -- the vol-adjusted can't separate it from the 2022 (high-vol outperformer). The dir-adjusted was rejected (hurts the 2015). The floor 0.5357 may be near the structural limit for the vol-adjusted conf_tilt. To lift further, need a signal that separates the 2022 from the 2025 (both high-vol) -- or a new architecture. Consider declaring convergence or a high-effort direction (Phase 5).","result":"PRIMARY IMPROVEMENT: worst_year 0.53138->0.53572 (+0.004). 2015=0.5357 (UP +0.004, the floor). 2022=0.6946 (UP +0.015). 2017=0.680 (DOWN -0.008, above 0.60). 2025=1.016 (DOWN -0.021, above the floor). robust 0.959->0.953 (DOWN -0.006, above 0.95, barely). perturb 0.180->0.186 (UP +0.006, within 0.10 guard). Stops NOT triggered. The 0.14 is the PEAK."}}
{"run":97,"commit":"e75c79a","metric":0.535721,"metrics":{"best_year_sharpe":2.865987,"cagr":0.7869,"calmar":1.693693,"information_ratio":1.390868,"max_drawdown":-0.464606,"mean_year_sharpe":1.29454,"n_years":11,"perturb_mean_sharpe":1.459771,"perturb_mean_worst_year":0.279786,"perturb_robust_std":0.032841,"perturb_sharpe_std":0.039873,"perturb_worst_year_std":0.186114,"robust_score":0.952556,"sharpe":1.459939,"sortino":2.09673,"std_year_sharpe":0.683968,"veto_pct":0.032609,"year_2015_sharpe":0.535721,"year_2016_sharpe":1.831588,"year_2017_sharpe":0.680454,"year_2018_sharpe":0.997785,"year_2019_sharpe":1.066204,"year_2020_sharpe":2.193292,"year_2021_sharpe":1.285697,"year_2022_sharpe":0.694316,"year_2023_sharpe":1.074152,"year_2024_sharpe":2.865987,"year_2025_sharpe":1.014742,"year_2022_cagr":0.287565,"year_2018_cagr":0.390451,"year_2025_cagr":0.602869},"status":"discard","description":"Iter68 (SPY): conf_tilt_vol_cap 2.0->2.5. DISCARD -- BIT-IDENTICAL no-op (worst_year 0.535721 unchanged). The vol_factor never reaches the 2.0 cap in any month (market vol rarely >2x median), so raising the cap is inert. The vol-adjusted effect comes from the vol_factor shape below the cap, not cap saturation. iter67 champion holds.","timestamp":1782826424247,"segment":1,"confidence":6.345343028770155,"asi":{"finding":"conf_tilt_vol_cap is INERT (no-op). The vol_factor (vol/median_vol) NEVER reaches the 2.0 cap in any month -> raising to 2.5 is bit-identical. The market vol rarely exceeds 2x its 21-day rolling median. The cap was a non-binding safeguard, not a lever. The vol-adjusted mechanism's effect comes entirely from the vol_factor SHAPE below the cap (e.g. 2022 high-vol -> ~1.8x, 2017 low-vol -> ~0.6x), not from cap saturation.","hypothesis":"Iter68: conf_tilt_vol_cap 2.0->2.5. Higher cap amplifies the vol-spike tilt (the 2015 mid-year vol spike might exceed 2x median -> capped at 2.0, losing signal). Raising to 2.5 lets the spike tilt fully -> lift the 2015 floor.","next_action":"vol_cap INERT (closed). The vol-adjusted conf_tilt is CONVERGED at iter67 (weight_tilt=0.14, cap=2.0 default, floor 0.5357). Next: audit PIT SPY-universe coverage (user request), update prompt.md + ideas.md. Then the only remaining structural frontier is separating the 2022 (high-vol outperformer) from the 2025 (high-vol underperformer) -- both high-vol, vol-adjusted can't separate them. Need a non-vol signal or new architecture.","result":"BIT-IDENTICAL no-op: worst_year 0.535721 -> 0.535721 (exactly equal). robust 0.9530->0.9526 (within noise). The vol_factor never hits the 2.0 cap -> 2.5 changes nothing."}}
{"run":98,"commit":"af9288f","metric":0.538367,"metrics":{"best_year_sharpe":2.862963,"cagr":0.787537,"calmar":1.695063,"information_ratio":1.393031,"max_drawdown":-0.464606,"mean_year_sharpe":1.29564,"n_years":11,"perturb_mean_sharpe":1.460915,"perturb_mean_worst_year":0.280314,"perturb_robust_std":0.032368,"perturb_sharpe_std":0.038261,"perturb_worst_year_std":0.181898,"robust_score":0.954354,"sharpe":1.461982,"sortino":2.10092,"std_year_sharpe":0.682572,"veto_pct":0.032609,"year_2015_sharpe":0.538367,"year_2016_sharpe":1.832562,"year_2017_sharpe":0.677671,"year_2018_sharpe":0.99722,"year_2019_sharpe":1.066299,"year_2020_sharpe":2.190701,"year_2021_sharpe":1.288546,"year_2022_sharpe":0.695792,"year_2023_sharpe":1.085801,"year_2024_sharpe":2.862963,"year_2025_sharpe":1.01612,"year_2022_cagr":0.288233,"year_2018_cagr":0.390136,"year_2025_cagr":0.6017},"status":"keep","description":"Iter69 (SPY): conf_tilt_pow=6.0 on iter67 base. KEEP -- 15th primary improvement! worst_year 0.5357->0.5384 (+0.0026). STRICTLY DOMINATES iter67: floor up + robust up (0.954) + perturb MORE stable (0.182). The pow optimum SHIFTS to 6.0 at weight_tilt=0.14+vol-adjusted (was 5.0 at weight_tilt=0.05). Steeper pow protects the 2015 moderate-conf months (the drag). Coherent improvement = real signal.","timestamp":1782827501552,"segment":1,"confidence":6.174649128712994,"asi":{"finding":"conf_tilt_pow=6.0 STRICTLY DOMINATES pow=5.0 on the iter67 base (weight_tilt=0.14 + vol-adjusted). The pow sweep converged at 5.0 on the iter48 base (weight_tilt=0.05, no vol-adjusted), but at weight_tilt=0.14 + vol-adjusted the optimum SHIFTS to 6.0. The steeper pow drops the tilt faster in moderate-conf months -> the 2015's moderate-conf months (the drag) get less tilt -> 2015 floor lifted +0.0026. High-conf months (2022) stay at full cap. The coherent improvement (floor up + robust up + perturb down) indicates a real signal, not noise.","hypothesis":"Iter69: conf_tilt_pow=6.0 on the iter67 base. The pow sweep converged at 5.0 on the iter48 base (weight_tilt=0.05, no vol-adjusted). At weight_tilt=0.14 + vol-adjusted, the optimum may shift. A steeper pow protects moderate-conf months more -> might lift the 2015 floor (if the 2015's moderate-conf months are the drag).","next_action":"pow=6.0 is a clean win. Test pow=7.0 next (does the shift continue?). The pow optimum on the iter67 base is now 6.0; bracket it with 7.0. If 7.0 also dominates, the sweep continues; if 7.0 regresses, 6.0 is the new peak.","result":"PRIMARY IMPROVEMENT (strict domination): worst_year 0.53572->0.53837 (+0.0026). 2015=0.5384 (UP +0.0026, the floor). 2022=0.6958 (UP +0.001). 2017=0.6777 (DOWN -0.003). 2025=1.0161 (unchanged). robust 0.9530->0.9544 (UP +0.0014, MORE robust). perturb_worst_std 0.1860->0.1819 (DOWN -0.004, MORE stable). All three coherently improved -> real signal. Guard passes (+0.002 < 0.10)."}}
{"run":99,"commit":"a259ff5","metric":0.540062,"metrics":{"best_year_sharpe":2.860638,"cagr":0.788053,"calmar":1.696175,"information_ratio":1.393758,"max_drawdown":-0.464606,"mean_year_sharpe":1.296256,"n_years":11,"perturb_mean_sharpe":1.461665,"perturb_mean_worst_year":0.280154,"perturb_robust_std":0.032307,"perturb_sharpe_std":0.03789,"perturb_worst_year_std":0.178393,"robust_score":0.955338,"sharpe":1.462698,"sortino":2.102275,"std_year_sharpe":0.681837,"veto_pct":0.032609,"year_2015_sharpe":0.540062,"year_2016_sharpe":1.833323,"year_2017_sharpe":0.675303,"year_2018_sharpe":0.997014,"year_2019_sharpe":1.066209,"year_2020_sharpe":2.189894,"year_2021_sharpe":1.29127,"year_2022_sharpe":0.696518,"year_2023_sharpe":1.092457,"year_2024_sharpe":2.860638,"year_2025_sharpe":1.016127,"year_2022_cagr":0.288565,"year_2018_cagr":0.390021,"year_2025_cagr":0.601707},"status":"keep","description":"Iter70 (SPY): conf_tilt_pow=7.0. KEEP -- 16th primary improvement! worst_year 0.5384->0.5401 (+0.0017). STRICTLY DOMINATES iter69: floor up + robust up (0.955) + perturb MORE stable (0.178). The pow optimum KEEPS shifting upward at weight_tilt=0.14 (5->6 +0.0026, 6->7 +0.0017, each strictly dominates). Steeper pow increasingly protects the 2015 moderate-conf months.","timestamp":1782827645328,"segment":1,"confidence":6.003262004175367,"asi":{"finding":"conf_tilt_pow=7.0 STRICTLY DOMINATES pow=6.0. The pow optimum KEEPS shifting upward at weight_tilt=0.14 + vol-adjusted. Pattern: pow 5->6 (+0.0026), 6->7 (+0.0017) -- diminishing but each step strictly dominates (floor up + robust up + perturb down). The steeper pow increasingly protects the 2015's moderate-conf months (the floor drag) while high-conf months (2022) stay at full cap. The pow sweep that converged at 5.0 on the iter48 base RE-OPENED on the iter67 base.","hypothesis":"Iter70: conf_tilt_pow=7.0 (bracket the new pow optimum). pow=6.0 dominated pow=5.0 on the iter67 base. Test if the shift continues to 7.0.","next_action":"pow=7.0 dominates. Test pow=8.0 next (does the shift continue?). The pow optimum is still moving upward; bracket it. If 8.0 also dominates, continue to 9.0. If 8.0 regresses, 7.0 is the new peak.","result":"PRIMARY IMPROVEMENT (strict domination): worst_year 0.53837->0.54006 (+0.0017). 2015=0.5401 (UP +0.0017, the floor). 2022=0.6965 (UP +0.001). 2017=0.6753 (DOWN -0.002). 2025=1.0161 (unchanged). robust 0.9544->0.9553 (UP +0.001). perturb_worst_std 0.1819->0.1784 (DOWN -0.0035, MORE stable). Coherent improvement = real signal. Guard passes."}}
{"run":100,"commit":"66ab7ab","metric":0.541187,"metrics":{"best_year_sharpe":2.858865,"cagr":0.788477,"calmar":1.697087,"information_ratio":1.394344,"max_drawdown":-0.464606,"mean_year_sharpe":1.296751,"n_years":11,"perturb_mean_sharpe":1.461665,"perturb_mean_worst_year":0.280081,"perturb_robust_std":0.032254,"perturb_sharpe_std":0.037618,"perturb_worst_year_std":0.175438,"robust_score":0.956071,"sharpe":1.463277,"sortino":2.103364,"std_year_sharpe":0.68136,"veto_pct":0.032609,"year_2015_sharpe":0.541187,"year_2016_sharpe":1.833921,"year_2017_sharpe":0.673292,"year_2018_sharpe":0.996933,"year_2019_sharpe":1.0661,"year_2020_sharpe":2.189575,"year_2021_sharpe":1.29387,"year_2022_sharpe":0.696983,"year_2023_sharpe":1.097408,"year_2024_sharpe":2.858865,"year_2025_sharpe":1.016129,"year_2022_cagr":0.288779,"year_2018_cagr":0.389975,"year_2025_cagr":0.601708},"status":"keep","description":"Iter71 (SPY): conf_tilt_pow=8.0. KEEP -- 17th primary improvement! worst_year 0.5401->0.5412 (+0.0011). STRICTLY DOMINATES iter70: floor up + robust up (0.956) + perturb MORE stable (0.175). Pattern 5->6->7->8 (+0.0026,+0.0017,+0.0011) each strictly dominates. Steeper pow concentrates tilt in very-high-conf months only, increasingly protecting the 2015 moderate-conf months.","timestamp":1782827779029,"segment":1,"confidence":5.9461449187015685,"asi":{"finding":"conf_tilt_pow=8.0 STRICTLY DOMINATES pow=7.0. The pow sweep continues upward: 5->6 (+0.0026), 6->7 (+0.0017), 7->8 (+0.0011) -- diminishing but each step strictly dominates (floor up + robust up + perturb down). The steeper pow increasingly concentrates the tilt in VERY-high-conf months only, protecting the 2015's moderate-conf months (the floor drag). As pow -> inf, the tilt becomes a step function (full tilt only when gap>>median, ~0 otherwise) -> the 2015 moderate-conf months get ~0 tilt -> 2015 floor keeps lifting. The improvement is diminishing but coherent (not noise).","hypothesis":"Iter71: conf_tilt_pow=8.0 (continue bracketing the upward-shifting pow optimum). pow=7.0 dominated pow=6.0. Test if the shift continues to 8.0.","next_action":"pow=8.0 dominates. Test pow=9.0 and pow=10.0. The improvement is diminishing (+0.0011). The sweep will converge when a step stops dominating (floor drops or robust drops). The theoretical limit: as pow->inf, tilt becomes a step function (full tilt only in very-high-conf months). The 2015 floor will converge when the 2015's moderate-conf months are fully protected (~0 tilt) and only the 2015's very-high-conf months (top-1 outperforms) carry tilt.","result":"PRIMARY IMPROVEMENT (strict domination): worst_year 0.54006->0.54119 (+0.0011). 2015=0.5412 (UP +0.0011, the floor). 2022=0.6970 (UP +0.0005). 2017=0.6733 (DOWN -0.002). 2025=1.0161 (unchanged). robust 0.9553->0.9561 (UP +0.0007). perturb_worst_std 0.1784->0.1754 (DOWN -0.003, MORE stable). Coherent. Guard passes."}}
{"run":101,"commit":"b624dd5","metric":0.542481,"metrics":{"best_year_sharpe":2.856496,"cagr":0.789113,"calmar":1.698456,"information_ratio":1.395232,"max_drawdown":-0.464606,"mean_year_sharpe":1.297514,"n_years":11,"perturb_mean_sharpe":1.463115,"perturb_mean_worst_year":0.280081,"perturb_robust_std":0.032154,"perturb_sharpe_std":0.037269,"perturb_worst_year_std":0.170917,"robust_score":0.957099,"sharpe":1.464162,"sortino":2.105079,"std_year_sharpe":0.680829,"veto_pct":0.032609,"year_2015_sharpe":0.542481,"year_2016_sharpe":1.834776,"year_2017_sharpe":0.670137,"year_2018_sharpe":0.996888,"year_2019_sharpe":1.066955,"year_2020_sharpe":2.189399,"year_2021_sharpe":1.29873,"year_2022_sharpe":0.697484,"year_2023_sharpe":1.104175,"year_2024_sharpe":2.856496,"year_2025_sharpe":1.01613,"year_2022_cagr":0.28901,"year_2018_cagr":0.38995,"year_2025_cagr":0.601709},"status":"keep","description":"Iter72 (SPY): conf_tilt_pow=10.0. KEEP -- 18th primary improvement! worst_year 0.5412->0.5425 (+0.0013). STRICTLY DOMINATES iter71: floor up + robust up (0.957) + perturb MORE stable (0.171). Jump 8->10 gave +0.0013 (NOT diminishing). As pow->inf tilt approaches a step function (full tilt only when gap>median) -> 2015 moderate-conf months maximally protected. Approaching the step-function asymptote.","timestamp":1782827914830,"segment":1,"confidence":5.892308405367196,"asi":{"finding":"conf_tilt_pow=10.0 STRICTLY DOMINATES pow=8.0. The jump 8->10 gave +0.0013 (NOT diminishing -- the improvement is holding steady around +0.001-0.0013/step in the pow 7-10 range). As pow->inf, conf=(gap/median)^pow -> step function: full tilt (capped) when gap>median, ZERO tilt when gap<median. The 2015's moderate-conf months (gap<median) get zero tilt -> 2015 floor maximally protected. The 2015's high-conf months (gap>median) still get full tilt. The pow sweep is approaching the step-function asymptote.","hypothesis":"Iter72: conf_tilt_pow=10.0 (jump to find the convergence faster). The improvement was diminishing (+0.0011 at pow=8); test if pow=10 still dominates or converges.","next_action":"pow=10 dominates (+0.0013, not diminishing). Jump to pow=20 and pow=50 to find the step-function asymptote. If pow=20 still dominates, the limit is the binary gate (tilt only when gap>median). If it regresses, the peak is between 10 and 20.","result":"PRIMARY IMPROVEMENT (strict domination): worst_year 0.54119->0.54248 (+0.0013). 2015=0.5425 (UP +0.0013, the floor). 2022=0.6975 (UP +0.0005). 2017=0.6701 (DOWN -0.003). 2025=1.0161 (unchanged). robust 0.9561->0.9571 (UP +0.001). perturb_worst_std 0.1754->0.1709 (DOWN -0.0045, MORE stable). Coherent. Guard passes."}}
{"run":102,"commit":"5571af8","metric":0.543713,"metrics":{"best_year_sharpe":2.853517,"cagr":0.790686,"calmar":1.701843,"information_ratio":1.397789,"max_drawdown":-0.464606,"mean_year_sharpe":1.299949,"n_years":11,"perturb_mean_sharpe":1.46513,"perturb_mean_worst_year":0.280569,"perturb_robust_std":0.031829,"perturb_sharpe_std":0.037009,"perturb_worst_year_std":0.162693,"robust_score":0.959767,"sharpe":1.466718,"sortino":2.110614,"std_year_sharpe":0.680364,"veto_pct":0.032609,"year_2015_sharpe":0.543713,"year_2016_sharpe":1.836232,"year_2017_sharpe":0.663646,"year_2018_sharpe":0.996879,"year_2019_sharpe":1.065867,"year_2020_sharpe":2.189367,"year_2021_sharpe":1.317457,"year_2022_sharpe":0.697864,"year_2023_sharpe":1.118774,"year_2024_sharpe":2.853517,"year_2025_sharpe":1.01613,"year_2022_cagr":0.289186,"year_2018_cagr":0.389945,"year_2025_cagr":0.601709},"status":"keep","description":"Iter73 (SPY): conf_tilt_pow=20.0. KEEP -- 19th primary improvement! worst_year 0.5425->0.5437 (+0.0012). STRICTLY DOMINATES iter72: floor up + robust up +0.0027 (0.960) + perturb MORE stable -0.0082 (0.163). Notable robustness+stability jump -- the step-function (high pow) is more stable (less sensitive to exact gap). 2017 dropping (0.664) but above floor (0.544). Floor monotonic in pow -> step-function asymptote is the max.","timestamp":1782828054997,"segment":1,"confidence":5.860205782606195,"asi":{"finding":"conf_tilt_pow=20.0 STRICTLY DOMINATES pow=10.0 with a NOTABLE robustness+stability jump. floor +0.0012 (holding steady ~+0.0012/step), but robust +0.0027 (0.957->0.960) and perturb -0.0082 (0.171->0.163). The step-function (high pow) is MORE stable -- less sensitive to the exact gap value (binary-ish: full tilt when gap>median, ~0 when gap<median). 2017 dropping (0.664, low-conf gets less tilt) but well above the floor (0.544). The floor lift is monotonic in pow -> the step-function asymptote (binary gate) is the maximum.","hypothesis":"Iter73: conf_tilt_pow=20.0 (jump toward the step-function asymptote). pow=10 dominated pow=8. Test if pow=20 still dominates.","next_action":"pow=20 dominates (notable robustness+stability jump). Test pow=50 next. If pow=50 ~= pow=20 (converged), implement the BINARY GATE directly (tilt only when gap>=median, else 0) -- that's the pow->inf asymptote and the cleanest implementation. If pow=50 > pow=20, still monotonic -> continue.","result":"PRIMARY IMPROVEMENT (strict domination): worst_year 0.54248->0.54371 (+0.0012). 2015=0.5437 (UP +0.0012, the floor). 2022=0.6979 (UP +0.0004). 2017=0.6636 (DOWN -0.0066, above floor). 2023=1.1188 (UP +0.0146). 2021=1.3175 (UP +0.0188). 2025=1.0161 (unchanged). robust 0.9571->0.9598 (UP +0.0027, notable). perturb_worst_std 0.1709->0.1627 (DOWN -0.0082, notable). Coherent. Guard passes."}}
