{"run":34,"commit":"11ad309","metric":0.336849,"metrics":{"best_year_sharpe":2.656458,"cagr":0.684251,"calmar":1.584096,"information_ratio":1.294927,"max_drawdown":-0.43195,"mean_year_sharpe":1.219964,"n_years":11,"perturb_mean_sharpe":1.371814,"perturb_mean_worst_year":0.167334,"perturb_robust_std":0.084099,"perturb_sharpe_std":0.071612,"perturb_worst_year_std":0.133417,"robust_score":0.895357,"sharpe":1.375498,"sortino":1.988734,"std_year_sharpe":0.649214,"veto_pct":0.013995,"year_2015_sharpe":0.515489,"year_2016_sharpe":1.694393,"year_2017_sharpe":0.667002,"year_2018_sharpe":0.982991,"year_2019_sharpe":1.249032,"year_2020_sharpe":1.959599,"year_2021_sharpe":1.061336,"year_2022_sharpe":0.336849,"year_2023_sharpe":1.399435,"year_2024_sharpe":2.656458,"year_2025_sharpe":0.897026,"year_2022_cagr":0.112785,"year_2018_cagr":0.366704,"year_2025_cagr":0.467508},"status":"keep","description":"Iter5 (SPY): quantile P20 veto (threshold 0.30). BREAKTHROUGH 10x lift: worst_year 0.034->0.337 (2022 0.03->0.34, 2018 0.13->0.98). sharpe 1.38, cagr 0.68, robust 0.90. perturb_worst_std DROPPED 0.19->0.13, perturbed floor +0.17. veto_pct 20.7%->1.4% (P20 targets true downside-liquidity, fixes mean-veto over-vetoing). New directions Phase 3 validated. KEEP.","timestamp":1782749687922,"segment":1,"confidence":null,"asi":{"hypothesis":"Iter5 (SPY): quantile P20 veto (New directions.txt Phase 3). Replace the mean-ratio veto with a DOWNSIDE-quantile veto: veto if P20 (downside) forecast volume / trailing volume < threshold. The mean veto over-vetoed (20.7%) good 2022 names -> fragile +0.03 floor. P20 encodes tail-liquidity risk -> fewer, smarter vetoes. Calibration: P20 ~= 0.43x mean, so threshold 0.30 ~= mean 0.70 in veto rate. Implemented: added use_quantile_veto/quantile_col path to overfit_harness.py (loads quantile panel, sums q{col}_h* over horizon); generated the quantile forecast cache (ctx256_hor21_volume_q.parquet, 581 symbols, 100% coverage) via generate_spy_forecasts.py --quantiles on GPU.","result":"BREAKTHROUGH 10x LIFT: worst_year 0.034 -> 0.337 (2022 floor 0.03->0.34, 2018 0.13->0.98). ALL secondaries up: sharpe 1.11->1.38, cagr 0.47->0.68, robust 0.69->0.90, calmar 1.22->1.58, sortino 1.64->1.99, meanY 0.98->1.22, 2024 2.24->2.66, 2020 0.97->1.96, 2016 1.06->1.69. STABILITY IMPROVED: perturb_worst_std 0.19->0.13 (DROPPED), perturb_mean_worst_year -0.31 -> +0.17 (perturbed floor POSITIVE). veto_pct 20.7%->1.4% (10x fewer vetoes -- P20 targets only true downside-liquidity risk). ALL 11 years positive.","decision":"KEEP -- primary improved 10x (0.034->0.337), robust_score up (0.69->0.90), AND perturb_worst_std DROPPED (0.19->0.13) with perturbed floor going POSITIVE (+0.17). This is the definition of a real, non-overfit improvement (primary up + stability up). The overfitting guard is satisfied. This is New directions.txt Phase 3 validated: the quantile P20 veto encodes tail-liquidity risk and fixes the mean-veto over-vetoing root cause.","key_insight":"The mean veto was the ROOT CAUSE of the fragile SPY floor (over-vetoing 20.7% of good 2022 names). The P20 downside-quantile veto (1.4% veto) keeps good 2022 names and targets only true tail-liquidity risk. The 4 prior param nudges (threshold/trailing/holdings) all crashed 2022 because they couldn't fix the over-vetoing -- only a SMARTER VETO MECHANISM could. This is the biggest SPY win and confirms the New directions.txt roadmap.","caveat":"veto_pct is only 1.4% -- need to verify the P20 veto is adding value vs no-veto-at-all (test no-veto as a control). Also need to run the full 6-test overfitting checklist on this finalist. Also test nearby P20 thresholds (0.25, 0.35) to find the sweet spot.","next_action":"Iter6 (SPY): test P20 threshold 0.25 (slightly more vetoing than 0.30's 1.4%) to find the P20 sweet spot. Then run the full overfitting checklist on the best P20 config. Then explore Phase 4 (volatility gate) as a second risk gate on top of P20."}}
{"run":35,"commit":"11ad309","metric":0.282208,"metrics":{"best_year_sharpe":2.23466,"cagr":0.626081,"calmar":1.459276,"information_ratio":1.179897,"max_drawdown":-0.429035,"mean_year_sharpe":1.098857,"n_years":11,"perturb_mean_sharpe":1.277328,"perturb_mean_worst_year":0.063234,"perturb_robust_std":0.083838,"perturb_sharpe_std":0.074855,"perturb_worst_year_std":0.123555,"robust_score":0.791146,"sharpe":1.275436,"sortino":1.82136,"std_year_sharpe":0.615423,"veto_pct":0,"year_2015_sharpe":0.282208,"year_2016_sharpe":1.694393,"year_2017_sharpe":0.624952,"year_2018_sharpe":1.135272,"year_2019_sharpe":0.616495,"year_2020_sharpe":1.908593,"year_2021_sharpe":0.99954,"year_2022_sharpe":0.336849,"year_2023_sharpe":1.399435,"year_2024_sharpe":2.23466,"year_2025_sharpe":0.855035,"year_2022_cagr":0.112785,"year_2018_cagr":0.455555,"year_2025_cagr":0.423069},"status":"discard","description":"Iter6 (SPY): NO-VETO control (threshold 0.0, 0% veto). worst_year 0.282 (floor=2015 0.28) vs P20 champion 0.337. VALIDATES P20 veto adds value: 2022 floor same (0.34) but P20 lifts 2015 (0.28->0.52), robust 0.79->0.90, perturb_floor +0.06->+0.17. P20 is smarter vetoes, not just fewer. Discard; champion confirmed.","timestamp":1782749824030,"segment":1,"confidence":5.543200161051225,"asi":{"hypothesis":"Iter6 (SPY): NO-VETO CONTROL (use_quantile_veto=true, threshold 0.0 -> 0% veto). Critical validation: is the P20 veto (1.4%) adding downside protection, or is the win just 'fewer vetoes than the mean 20.7%'? If no-veto ~= P20, the P20 veto isn't adding value. If no-veto is WORSE, P20 is adding real downside protection.","result":"NO-VETO IS WORSE THAN P20: worst_year 0.282 (floor=2015 0.28) vs P20 champion 0.337 (floor=2022 0.34). 2022 IDENTICAL (0.34 both) -- the 2022 floor comes from removing the mean veto, not from P20. BUT P20 lifts 2015 (0.28->0.52) and 2019 (0.62->1.25), improving robust 0.79->0.90 and perturb_floor +0.06 -> +0.17. sharpe 1.28 vs 1.38, cagr 0.63 vs 0.68. veto_pct 0% vs 1.4%.","decision":"DISCARD -- no-veto (0.282) is worse than the P20 champion (0.337). This VALIDATES the P20 veto: it is NOT just 'fewer vetoes' -- the 1.4% P20 vetoes target true downside-liquidity risk (lifting 2015/2019) that no-veto misses. The 2022 floor comes from removing the mean over-vetoing; the 2015/2019/robustness gains come from the P20 downside gate. Champion (P20 0.30) confirmed as a real improvement over both mean-veto AND no-veto.","key_insight":"The SPY floor has TWO components: (1) 2022 floor (0.34) = removing the mean over-vetoing (no-veto also gets 0.34 on 2022); (2) 2015/2019/robustness = the P20 downside-liquidity gate (no-veto loses these). The P20 veto is the principled downside-risk gate New directions.txt predicted. It adds value beyond no-veto.","next_action":"Iter7 (SPY): P20 threshold 0.35 (more vetoing than 0.30's 1.4%) to find the P20 sweet spot. If 0.35 lifts the floor further, more downside protection helps. If it drops, 0.30 is near the sweet spot. Then test 0.25. Then run the full 6-test overfitting checklist on the best P20 config."}}
{"run":36,"commit":"11ad309","metric":0.336849,"metrics":{"best_year_sharpe":2.652609,"cagr":0.738481,"calmar":1.709642,"information_ratio":1.395515,"max_drawdown":-0.43195,"mean_year_sharpe":1.308246,"n_years":11,"perturb_mean_sharpe":1.459,"perturb_mean_worst_year":0.151046,"perturb_robust_std":0.078519,"perturb_sharpe_std":0.068243,"perturb_worst_year_std":0.135732,"robust_score":0.983511,"sharpe":1.466147,"sortino":2.139807,"std_year_sharpe":0.64947,"veto_pct":0.029879,"year_2015_sharpe":0.489051,"year_2016_sharpe":1.694393,"year_2017_sharpe":0.667002,"year_2018_sharpe":0.982991,"year_2019_sharpe":1.150752,"year_2020_sharpe":1.904345,"year_2021_sharpe":1.340779,"year_2022_sharpe":0.336849,"year_2023_sharpe":1.676437,"year_2024_sharpe":2.652609,"year_2025_sharpe":1.495496,"year_2022_cagr":0.112785,"year_2018_cagr":0.366704,"year_2025_cagr":1.008178},"status":"discard","description":"Iter7 (SPY): P20 threshold 0.35 (3.0% veto). Primary unchanged (0.337, 2022 floor pinned 0.34). Secondaries up but return-chasing: perturb_worst_std 0.13->0.14, perturb_floor +0.17->+0.15 (both wrong direction). 0.30 stays floor-robust champion. 2022 floor pinned by P20 veto; lifting it needs Phase 4 (vol gate). Discard.","timestamp":1782749967097,"segment":1,"confidence":11.08640032210244,"asi":{"hypothesis":"Iter7 (SPY): P20 threshold 0.35 (more downside-vetoing than 0.30's 1.4%) to find the P20 sweet spot.","result":"PRIMARY UNCHANGED: worst_year 0.337 == 0.337 (2022 floor 0.34 pinned regardless of P20 threshold in 0.30-0.35). Secondaries improved: sharpe 1.38->1.47, cagr 0.68->0.74, robust 0.90->0.98, calmar 1.58->1.71, sortino 1.99->2.14, meanY 1.22->1.31, 2021 1.06->1.34, 2023 1.40->1.68, 2025 0.90->1.50. BUT perturb_worst_std 0.13->0.14 (UP, wrong direction) and perturb_mean_worst_year +0.17 -> +0.15 (DOWN, wrong direction). veto_pct 1.4%->3.0%.","decision":"DISCARD -- primary unchanged (0.337==0.337) and floor robustness slightly WORSE (perturb_worst_std up, perturb_floor down). The secondary gains are average-return chasing (robust_score up purely from higher meanY, stdY flat) not floor robustness. Per iter22 lesson + primary discipline (unchanged=discard), 0.30 stays the floor-robust champion.","key_insight":"The 2022 floor is PINNED at 0.34 by the P20 veto -- P20 threshold tuning in 0.30-0.35 cannot lift it further (2022 unchanged). The P20 threshold only moves the OTHER years (2015, 2021, 2023, 2025) and average return. To lift the worst_year PRIMARY above 0.34 needs a DIFFERENT lever: Phase 4 (volatility gate as a second risk gate) or factor/signal changes. The P20 veto has done its job (floor 0.03 -> 0.34 by fixing mean over-vetoing).","next_action":"Iter8 (SPY): P20 threshold 0.25 (bracket the sweet spot -- confirm 0.30 is floor-optimal). Then run the full 6-test overfitting checklist on the P20 champion (0.30). Then explore Phase 4 (volatility gate) to lift the 2022 floor above 0.34."}}
{"run":37,"commit":"11ad309","metric":0.333121,"metrics":{"best_year_sharpe":2.484761,"cagr":0.640228,"calmar":1.492249,"information_ratio":1.203464,"max_drawdown":-0.429035,"mean_year_sharpe":1.121469,"n_years":11,"perturb_mean_sharpe":1.29715,"perturb_mean_worst_year":0.109701,"perturb_robust_std":0.08841,"perturb_sharpe_std":0.069883,"perturb_worst_year_std":0.126097,"robust_score":0.79874,"sharpe":1.296277,"sortino":1.856012,"std_year_sharpe":0.645457,"veto_pct":0.005738,"year_2015_sharpe":0.333121,"year_2016_sharpe":1.694393,"year_2017_sharpe":0.624952,"year_2018_sharpe":1.135272,"year_2019_sharpe":0.616495,"year_2020_sharpe":1.832786,"year_2021_sharpe":0.99954,"year_2022_sharpe":0.336849,"year_2023_sharpe":1.399435,"year_2024_sharpe":2.484761,"year_2025_sharpe":0.87855,"year_2022_cagr":0.112785,"year_2018_cagr":0.455555,"year_2025_cagr":0.441012},"status":"discard","description":"Iter8 (SPY): P20 threshold 0.25 (0.6% veto). Worse than 0.30: 0.333 vs 0.337, 2015 0.52->0.33, 2019 1.25->0.62 (under-vetoing loses downside protection). P20 sweet spot confirmed at 0.30. 2022 floor pinned at 0.34. Discard.","timestamp":1782750765830,"segment":1,"confidence":81.24624463519294,"asi":{"hypothesis":"Iter8 (SPY): P20 threshold 0.25 (less vetoing than 0.30's 1.4%) to bracket the P20 sweet spot.","result":"WORSE than 0.30: worst_year 0.333 vs 0.337 (floor=2015 0.33 vs 2022 0.34). 2015 dropped 0.52->0.33, 2019 1.25->0.62 (the years the P20 veto was protecting). sharpe 1.30 vs 1.38, robust 0.80 vs 0.90, cagr 0.64 vs 0.68. perturb_worst_std 0.126 vs 0.133 (slightly better), perturb_floor +0.11 vs +0.17 (worse). veto_pct 0.6%.","decision":"DISCARD -- 0.25 under-vetoes, losing the downside protection that lifted 2015/2019. P20 sweet spot confirmed: 0.30 (1.4% veto) is floor-optimal (0.25 under-vetoes, 0.35 chases return).","conclusion":"P20 threshold BRACKETED: 0.25 (0.6%) -> 0.333; 0.30 (1.4%) -> 0.337 BEST; 0.35 (3.0%) -> 0.337 (return-chasing). 0.30 is the floor-robust sweet spot. The 2022 floor is pinned at 0.34 by the P20 veto. Lifting it above 0.34 needs a different lever.","next_action":"Test ts_mom 11 on the P20 base (quick lever -- the checklist T4 showed ts_mom=10 robust, ts_mom=8 crashes; 11 untested on P20 base). If 11 lifts 2022 above 0.34 without overfitting, keep. Watch perturb_worst_std (guard) -- on IWV 11 was a floor-shift artifact."}}
{"run":38,"commit":"11ad309","metric":0.26683,"metrics":{"best_year_sharpe":2.719146,"cagr":0.676294,"calmar":1.565676,"information_ratio":1.278849,"max_drawdown":-0.43195,"mean_year_sharpe":1.183653,"n_years":11,"perturb_mean_sharpe":1.335,"perturb_mean_worst_year":0.168441,"perturb_robust_std":0.039568,"perturb_sharpe_std":0.044597,"perturb_worst_year_std":0.18164,"robust_score":0.838776,"sharpe":1.359154,"sortino":1.915174,"std_year_sharpe":0.689754,"veto_pct":0.013771,"year_2015_sharpe":0.433063,"year_2016_sharpe":1.840246,"year_2017_sharpe":0.720962,"year_2018_sharpe":0.830982,"year_2019_sharpe":1.086689,"year_2020_sharpe":1.908593,"year_2021_sharpe":0.974436,"year_2022_sharpe":0.26683,"year_2023_sharpe":1.303858,"year_2024_sharpe":2.719146,"year_2025_sharpe":0.911654,"year_2022_cagr":0.084913,"year_2018_cagr":0.306622,"year_2025_cagr":0.490827},"status":"discard","description":"Iter9 (SPY): ts_mom 11 on P20 base. Floor dropped (0.337->0.267, 2022 0.34->0.27), perturb_worst_std rose (0.13->0.18). Same overfit pattern as IWV. ts_mom=10 confirmed optimal. 2022 floor pinned at 0.34. Discard.","timestamp":1782750898751,"segment":1,"confidence":10.378317257448302,"asi":{"hypothesis":"Iter9 (SPY): ts_mom_lookback 10->11 on the P20 base. Quick lever to lift the pinned 2022 floor (checklist T4 showed ts_mom=10 robust, ts_mom=8 crashes; 11 untested on P20 base). On IWV 11 was a floor-shift artifact.","result":"FLOOR DROPPED + INSTABILITY ROSE: worst_year 0.337 -> 0.267 (2022 0.34->0.27, 2018 0.98->0.83, 2015 0.52->0.43). perturb_worst_std 0.13 -> 0.18 (UP, worse). robust 0.90 -> 0.84. 2016/2024 up (1.69->1.84, 2.66->2.72) but weak years all worse. Same overfit pattern as IWV iter22 (ts_mom 11 trades floor for peak).","decision":"DISCARD -- primary regressed (0.337->0.267) AND perturb_worst_std rose (0.13->0.18). ts_mom=10 confirmed optimal on the P20 base too (10 robust, 11 overfit, 8 crashes per checklist). ts_mom EXHAUSTED on SPY.","conclusion":"The 2022 floor is PINNED at 0.34 by the P20 veto -- ts_mom, veto_threshold, trailing_vol_window, max_holdings all cannot lift it above 0.34 (they either keep it at 0.34 or crash it). The P20 champion (0.337, all checklist tests PASS) is the robust optimum for this strategy structure. Lifting 2022 above 0.34 needs a STRUCTURAL change: Phase 4 (volatility gate as a second risk gate) or a different signal.","next_action":"Fix prompt.md with the P20 champion + checklist PASS. Then assess Phase 4 (volatility gate): check if a logret forecast cache exists for a vol-gate. If feasible, implement as a second risk gate targeting 2022 high-vol names. Else, the SPY optimization has converged at a strong robust optimum (0.337, 10x baseline, all tests PASS)."}}
{"run":39,"commit":"0ec051c","metric":0.109622,"metrics":{"best_year_sharpe":2.019578,"cagr":0.684493,"calmar":1.477105,"information_ratio":1.321773,"max_drawdown":-0.463401,"mean_year_sharpe":1.205538,"n_years":11,"perturb_mean_sharpe":1.37005,"perturb_mean_worst_year":0.072195,"perturb_robust_std":0.068215,"perturb_sharpe_std":0.054907,"perturb_worst_year_std":0.092072,"robust_score":0.918342,"sharpe":1.399525,"sortino":2.003378,"std_year_sharpe":0.574392,"veto_pct":0.085683,"year_2015_sharpe":0.593003,"year_2016_sharpe":1.563624,"year_2017_sharpe":0.842369,"year_2018_sharpe":0.668716,"year_2019_sharpe":1.664133,"year_2020_sharpe":2.019578,"year_2021_sharpe":1.061336,"year_2022_sharpe":0.109622,"year_2023_sharpe":1.365923,"year_2024_sharpe":1.934192,"year_2025_sharpe":1.438418,"year_2022_cagr":0.026071,"year_2018_cagr":0.236635,"year_2025_cagr":0.906666},"status":"discard","description":"Iter10 (SPY): vol-gate zscore 1.5 (Phase 4). HURT 2022 floor (0.34->0.11) -- vol-gate vetoes high-vol momentum names which ARE the 2022 winners (vol expands in bear markets). Wrong tool for momentum; liquidity != volatility. Discard; testing gentler 2.5.","timestamp":1782751163533,"segment":1,"confidence":5.543200161051225,"asi":{"hypothesis":"Iter10 (SPY): vol-gate zscore 1.5 (New directions Phase 4). A second risk gate: veto names whose 21-day realized vol > 1.5x their 252-day avg vol (regime-shift risk). OR'd with the P20 volume veto. Targets high-vol names in 2022 the volume veto misses.","result":"HURT THE 2022 FLOOR: worst_year 0.337 -> 0.110 (2022 0.34 -> 0.11). vol-gate added ~7% vetoes (veto_pct 1.4%->8.6%). 2018 0.98->0.67, 2024 2.66->1.93 (peak cut), maxdd -0.43->-0.46. BUT 2015 0.52->0.59, 2017 0.67->0.84, 2019 1.25->1.66 improved; perturb_worst_std 0.13->0.09 (more stable), robust 0.90->0.92.","decision":"DISCARD -- 2022 floor dropped 0.34->0.11. The vol-gate is the WRONG tool for a momentum strategy: in 2022 (bear market) the good momentum names ARE high-vol (vol expands for momentum names), so vetoing high-vol systematically vetoes the 2022 WINNERS. Same over-vetoing root cause as the mean volume veto. The P20 volume veto works because it targets LIQUIDITY (downside volume), not volatility.","key_insight":"Phase 4 (vol-gate) is FUNDAMENTALLY misaligned with a momentum strategy: volatility is correlated with the momentum signal itself (bear-market momentum names are high-vol), so a vol-gate vetoes the winners it should keep. The P20 volume veto succeeds because liquidity != volatility. Testing zscore 2.5 (gentler) to confirm -- if it also hurts 2022, the vol-gate direction is dead for this strategy.","next_action":"Iter11 (SPY): vol-gate zscore 2.5 (much gentler -- veto only extreme vol spikes >2.5x avg). If 2022 stays ~0.34 and other years improve, keep. If 2022 drops again, the vol-gate is confirmed wrong -> discard the direction and conclude the SPY optimization at the P20 champion (0.337, all tests PASS)."}}
{"run":40,"commit":"0ec051c","metric":0.282208,"metrics":{"best_year_sharpe":2.23466,"cagr":0.626081,"calmar":1.459276,"information_ratio":1.179897,"max_drawdown":-0.429035,"mean_year_sharpe":1.098857,"n_years":11,"perturb_mean_sharpe":1.277328,"perturb_mean_worst_year":0.063234,"perturb_robust_std":0.083838,"perturb_sharpe_std":0.074855,"perturb_worst_year_std":0.123555,"robust_score":0.791146,"sharpe":1.275436,"sortino":1.82136,"std_year_sharpe":0.615423,"veto_pct":0.00014,"year_2015_sharpe":0.282208,"year_2016_sharpe":1.694393,"year_2017_sharpe":0.624952,"year_2018_sharpe":1.135272,"year_2019_sharpe":0.616495,"year_2020_sharpe":1.908593,"year_2021_sharpe":0.99954,"year_2022_sharpe":0.336849,"year_2023_sharpe":1.399435,"year_2024_sharpe":2.23466,"year_2025_sharpe":0.855035,"year_2022_cagr":0.112785,"year_2018_cagr":0.455555,"year_2025_cagr":0.423069},"status":"discard","description":"Iter11 (SPY): P10 veto (col 0) threshold 0.20. Miscalibrated -- 0% veto = no-veto = 0.282 (lost P20 downside protection). P10<P20 so need HIGHER threshold to match veto rate. Discard; recalibrating P10 to 0.28.","timestamp":1782751336124,"segment":1,"confidence":5.738977205979879,"asi":{"hypothesis":"Iter11 (SPY): P10 quantile veto (col 0, deeper downside 10th percentile) at threshold 0.20. A stricter downside-liquidity gate than P20. Calibrated 0.20 ~= P20's 0.30 in veto rate (P10 < P20 so lower threshold needed).","result":"MISCALIBRATED -- 0% veto (veto_pct 0.0%). P10 at 0.20 vetoes almost nothing (P10_ratio < 0.20 is rare) -> identical to no-veto control (worst_year 0.282, floor=2015 0.28). 2022=0.34 (same as P20, from removing mean veto) but 2015 0.52->0.28, 2019 1.25->0.62 (lost the P20 downside protection). robust 0.90->0.79.","decision":"DISCARD -- 0% veto = no-veto = 0.282 (worse than P20 champion 0.337). Threshold 0.20 too low for P10; need higher (~0.25) to match P20's 1.4% veto rate.","key_insight":"P10 calibration: P10 < P20 so P10_ratio < P20_ratio. To veto the SAME 1.4% as P20@0.30, P10 threshold must be HIGHER than 0.30 (not lower). I used 0.20 (too low -> 0% veto). Need P10@~0.25-0.30 to calibrate. The 2022 floor (0.34) is independent of the quantile choice (comes from removing the mean veto); the quantile choice affects 2015/2019 (the downside-protected years).","next_action":"Iter12 (SPY): P10 at threshold 0.28 (calibrated to ~match P20's 1.4% veto rate, since P10<P20 need threshold near/above P20's 0.30). If P10@0.28 beats P20's 0.337, the deeper downside gate helps. If not, P20 is the sweet spot and the SPY optimization converges at the P20 champion."}}
