{"run":91,"commit":"d3f3f4a","metric":0.531382,"metrics":{"best_year_sharpe":2.854328,"cagr":0.784355,"calmar":1.698781,"information_ratio":1.394805,"max_drawdown":-0.461716,"mean_year_sharpe":1.298462,"n_years":11,"perturb_mean_sharpe":1.460777,"perturb_mean_worst_year":0.279833,"perturb_robust_std":0.031249,"perturb_sharpe_std":0.037929,"perturb_worst_year_std":0.180074,"robust_score":0.958836,"sharpe":1.463962,"sortino":2.10452,"std_year_sharpe":0.679253,"veto_pct":0.032609,"year_2015_sharpe":0.531382,"year_2016_sharpe":1.832862,"year_2017_sharpe":0.688533,"year_2018_sharpe":0.995558,"year_2019_sharpe":1.074885,"year_2020_sharpe":2.182705,"year_2021_sharpe":1.290219,"year_2022_sharpe":0.679427,"year_2023_sharpe":1.116337,"year_2024_sharpe":2.854328,"year_2025_sharpe":1.036852,"year_2022_cagr":0.277661,"year_2018_cagr":0.387851,"year_2025_cagr":0.618506},"status":"keep","description":"Iter62 (SPY): weight_tilt=0.13 + conf_tilt_vol=true. KEEP -- 13th primary improvement! worst_year 0.5231->0.5314 (+0.008). vol-adjusted UNLOCKED 0.13: stops NOT triggered (robust 0.959>0.95, 2017 0.689>0.60) vs iter57's 0.13 which triggered them (0.947, 0.605). 2022 +0.032, 2017 -0.016 (vol-adjusted limited the drop). The vol-adjusted decouples the 2022 lift from the 2017 drop.","timestamp":1782806153758,"segment":1,"confidence":6.649808828640947,"asi":{"caveats":"1. The vol-adjusted UNLOCKED weight_tilt=0.13. Before (iter57, no vol-adjusted), the 0.13 triggered the robustness stop (0.947<0.95) and the 2017 dropped to 0.605 (<0.60). Now (with vol-adjusted), the 0.13 keeps the robustness above 0.95 (0.959) and the 2017 above 0.60 (0.689). 2. The robustness is dropping (0.971->0.959) but stays above 0.95. The 2017 is dropping (0.705->0.689) but stays above 0.60. 3. The perturb rose +0.013 (within guard). 4. The floor-chasing can continue (the stops are not triggered).","decision":"KEEP -- 13th primary improvement. The vol-adjusted UNLOCKED weight_tilt=0.13 (the stops are NOT triggered, vs iter57's 0.13 which triggered them). The floor improved (+0.008). The guard passes (+0.013 < 0.10).","finding":"The vol-adjusted DELAYED the stops. The 2017 (low-vol) is protected by the vol_factor (< 1 in low-vol), so the higher weight_tilt drops the 2017 LESS (-0.016 vs iter57's -0.027 without vol-adjusted). The robustness stays above 0.95 (0.959 vs iter57's 0.947). The 2017 stays above 0.60 (0.689 vs iter57's 0.605). The vol-adjusted decouples the 2022 lift (high-vol) from the 2017 drop (low-vol), allowing a higher weight_tilt before the stops trigger.","hypothesis":"Iter62: weight_tilt=0.13 + conf_tilt_vol=true. The 2017 is now protected (low-vol, 0.705). The 0.13 triggered the robustness stop BEFORE (iter57) -- but now the 2017 is protected, so the robustness might stay above 0.95.","infra_note":"No new infra (conf_tilt_vol already wired in iter61). Changed weight_tilt 0.11->0.13.","next_action":"Test weight_tilt=0.15 + conf_tilt_vol=true. The robustness is 0.959 at 0.13 (approaching 0.95). The 0.15 might drop it to ~0.95 (the stop) or below. The 2017 is 0.689 at 0.13 (approaching 0.60). The 0.15 might drop it to ~0.67 (above 0.60). If the stops are NOT triggered (robust>=0.95, 2017>=0.60), KEEP. If triggered, DISCARD (0.13 is the peak). The vol-adjusted + weight_tilt sweep is the active frontier.","result":"PRIMARY IMPROVEMENT: worst_year 0.52315->0.53138 (+0.008). 2022=0.6794 (UP +0.032, higher weight_tilt + high-vol). 2017=0.6885 (DOWN -0.016, vol-adjusted limited the drop, above 0.60). 2015=0.5314 (UP +0.008, the floor, higher weight_tilt + moderate-vol). 2020 UP (+0.022). 2023/2025 down. robust 0.971->0.959 (DOWN -0.012, above 0.95). 2017 0.705->0.689 (above 0.60). perturb 0.167->0.180 (UP +0.013, within 0.10 guard). Stops NOT triggered. STRICTLY IMPROVES iter61 on the floor."}}
{"run":92,"commit":"d3f3f4a","metric":0.540207,"metrics":{"best_year_sharpe":2.877135,"cagr":0.789648,"calmar":1.688813,"information_ratio":1.389518,"max_drawdown":-0.467576,"mean_year_sharpe":1.291379,"n_years":11,"perturb_mean_sharpe":1.459057,"perturb_mean_worst_year":0.279634,"perturb_robust_std":0.033934,"perturb_sharpe_std":0.039661,"perturb_worst_year_std":0.18979,"robust_score":0.947233,"sharpe":1.458245,"sortino":2.10452,"std_year_sharpe":0.688291,"veto_pct":0.032609,"year_2015_sharpe":0.540207,"year_2016_sharpe":1.830226,"year_2017_sharpe":0.672481,"year_2018_sharpe":1.000095,"year_2019_sharpe":1.057164,"year_2020_sharpe":2.202175,"year_2021_sharpe":1.281126,"year_2022_sharpe":0.709363,"year_2023_sharpe":1.038885,"year_2024_sharpe":2.877135,"year_2025_sharpe":0.99631,"year_2022_cagr":0.297809,"year_2018_cagr":0.39314,"year_2025_cagr":0.585759},"status":"discard","description":"Iter63 (SPY): weight_tilt=0.15 + conf_tilt_vol=true. DISCARD -- robustness STOP triggered (0.947<0.95). Floor improved +0.009 but the floor-chasing went too far. NEW canary: 2025 dropped to 0.996 (high-vol underperformer, vol-adjusted hurts it). iter62 (0.13, robust 0.959) is the peak. vol-adjusted+weight_tilt CONVERGED at 0.13.","timestamp":1782806298539,"segment":1,"confidence":6.5970252186656575,"asi":{"caveats":"1. A NEW canary emerged: 2025 dropped to 0.996 (high-vol, top-1 underperforms). The vol-adjusted tilts MORE in high-vol -> hurts the 2025 (high-vol underperformer). The vol-adjusted protects the 2017 (low-vol) but NOT the 2025 (high-vol). 2. The robustness stop triggered at 0.15 (0.947<0.95). The iter62 (0.13, robust 0.959) is the peak. 3. The 2025 (0.996) is above the floor (0.540) by 0.456 -- not an immediate concern, but it's the new canary. 4. The vol-adjusted + weight_tilt sweep is CONVERGED at 0.13.","decision":"DISCARD -- the robustness STOP is triggered (0.947<0.95). iter62 (0.13, robust 0.959) is the peak. The vol-adjusted + weight_tilt sweep is CONVERGED at 0.13.","finding":"The vol-adjusted + weight_tilt sweep CONVERGED at 0.13 (robust 0.959, floor 0.5314). The 0.15 triggered the robustness stop (0.947<0.95). A NEW canary emerged: the 2025 (high-vol, top-1 underperforms) dropped to 0.996. The vol-adjusted protects the 2017 (low-vol) but hurts the 2025 (high-vol) -- the vol-adjusted can't separate the 2022 (high-vol, outperforms) from the 2025 (high-vol, underperforms). This is a new confound (high-vol outperformers vs high-vol underperformers).","hypothesis":"Iter63: weight_tilt=0.15 + conf_tilt_vol=true (push further). The robustness is 0.959 at 0.13 (approaching 0.95). The 0.15 might trigger the stop.","infra_note":"No new infra. Changed weight_tilt 0.13->0.15.","next_action":"The vol-adjusted + weight_tilt sweep CONVERGED at 0.13 (floor 0.5314). Test conf_tilt_vol_window=10 (more responsive vol signal) with weight_tilt=0.13. The 2022 (early, vol rising) might get a higher vol_factor (more responsive) -> 2022 lifts more. The 2017 (low-vol) stays protected. If the floor (2015) lifts (the 2015 mid-year vol spike captured by the shorter window), KEEP. Also: the 2025 is the new canary (high-vol underperformer) -- a vol_window change won't fix it (both 2022 and 2025 are high-vol).","result":"Floor improved 0.53138->0.54021 (+0.009) BUT robust 0.959->0.947 (BELOW 0.95 STOP). 2017=0.672 (above 0.60, vol-adjusted protected it). 2025=0.996 (NEW canary, high-vol underperformer, dropping). 2022=0.709 (+0.030). 2015=0.540 (+0.009, floor). perturb 0.180->0.190 (+0.010, within guard). The robustness stop TRIGGERED. DISCARD."}}
{"run":93,"commit":"d3f3f4a","metric":0.521009,"metrics":{"best_year_sharpe":2.841699,"cagr":0.779941,"calmar":1.695811,"information_ratio":1.385723,"max_drawdown":-0.459922,"mean_year_sharpe":1.286214,"n_years":11,"perturb_mean_sharpe":1.46494,"perturb_mean_worst_year":0.272621,"perturb_robust_std":0.029757,"perturb_sharpe_std":0.03693,"perturb_worst_year_std":0.18047,"robust_score":0.943516,"sharpe":1.457268,"sortino":2.10026,"std_year_sharpe":0.685396,"veto_pct":0.032609,"year_2015_sharpe":0.521009,"year_2016_sharpe":1.86812,"year_2017_sharpe":0.64716,"year_2018_sharpe":0.995927,"year_2019_sharpe":1.064386,"year_2020_sharpe":2.180028,"year_2021_sharpe":1.260017,"year_2022_sharpe":0.683309,"year_2023_sharpe":1.022853,"year_2024_sharpe":2.841699,"year_2025_sharpe":1.063848,"year_2022_cagr":0.277208,"year_2018_cagr":0.387851,"year_2025_cagr":0.642912},"status":"discard","description":"Iter64 (SPY): conf_tilt_vol_window=10. DISCARD -- too noisy. worst_year 0.5314->0.5210 (-0.010). The shorter window made the vol_factor noisier -> 2015/2017 dropped, robust 0.944<0.95. vol_window=21 (default) is the sweet spot. iter62 champion holds.","timestamp":1782806428468,"segment":1,"confidence":6.395204422730778,"asi":{"caveats":"1. The vol_window=10 is too noisy -- the vol_factor varies more -> the 2015 and 2017 dropped. 2. The vol_window=21 (default) is the sweet spot (iter61/iter62). 3. The 2025 recovered slightly (+0.027) with the 10 -- the noisier vol_factor might have protected some 2025 months. 4. The vol_window sweep is a 1-D sweep (overfitting risk).","decision":"DISCARD -- the vol_window=10 is too noisy (floor dropped, robustness below 0.95). iter62 (vol_window=21) remains the champion.","finding":"The vol_window=10 (more responsive) is WORSE than the 21 (default). The shorter window makes the vol_factor noisier -> the 2015 dropped (-0.010) and the 2017 dropped (-0.041). The 2022 was basically unchanged (+0.004). The vol_window=21 is the sweet spot (responsive enough to separate 2022/2017, not too noisy).","hypothesis":"Iter64: conf_tilt_vol_window=10 (more responsive vol signal). The 2022 (early vol rise) might get a higher vol_factor -> 2022 lifts more. The 2015 (mid-year vol spike) might lift.","infra_note":"No new infra (conf_tilt_vol_window already read in iter61). Changed conf_tilt_vol_window 21->10.","next_action":"Test conf_tilt_vol_window=63 (smoother, to bracket the vol_window). The 63 might protect the 2025 (the new canary, high-vol underperformer) -- the smoother vol_factor reduces the 2025 tilt. If the 63 protects the 2025 and the floor stays, KEEP. If too smooth (2022 doesn't lift), DISCARD. The vol_window=21 is likely the sweet spot (10 too noisy, 63 too smooth).","result":"Floor DROPPED 0.53138->0.52101 (-0.010). 2015=0.521 (-0.010). 2017=0.647 (-0.041, noisier vol_factor hurt it). 2022=0.683 (+0.004, unchanged). 2025=1.064 (+0.027, recovered slightly). robust 0.959->0.944 (BELOW 0.95 STOP). The vol_window=10 is too noisy. DISCARD."}}
{"run":94,"commit":"d3f3f4a","metric":0.523059,"metrics":{"best_year_sharpe":2.862596,"cagr":0.780596,"calmar":1.705322,"information_ratio":1.382529,"max_drawdown":-0.457741,"mean_year_sharpe":1.28507,"n_years":11,"perturb_mean_sharpe":1.463953,"perturb_mean_worst_year":0.284456,"perturb_robust_std":0.030235,"perturb_sharpe_std":0.038878,"perturb_worst_year_std":0.168123,"robust_score":0.948583,"sharpe":1.452968,"sortino":2.10452,"std_year_sharpe":0.672974,"veto_pct":0.032609,"year_2015_sharpe":0.523059,"year_2016_sharpe":1.735454,"year_2017_sharpe":0.710552,"year_2018_sharpe":0.996258,"year_2019_sharpe":1.143235,"year_2020_sharpe":2.157102,"year_2021_sharpe":1.251607,"year_2022_sharpe":0.648638,"year_2023_sharpe":1.01893,"year_2024_sharpe":2.862596,"year_2025_sharpe":1.088338,"year_2022_cagr":0.258593,"year_2018_cagr":0.388776,"year_2025_cagr":0.666823},"status":"discard","description":"Iter65 (SPY): conf_tilt_vol_window=63. DISCARD -- too smooth. worst_year 0.5314->0.5231 (-0.008). 2022 dropped (-0.031, vol rise captured late). 2017/2025 protected (+0.022/+0.052). vol_window sweep CONVERGED: 10 noisy, 21 sweet spot, 63 too smooth. iter62 champion holds. New confound: 2022/2025 both high-vol.","timestamp":1782806575838,"segment":1,"confidence":6.342405406266933,"asi":{"caveats":"1. The vol_window=63 is too smooth -- the 2022 vol rise is captured LATE -> 2022 dropped (-0.031). 2. The 63 DID protect the 2017 (+0.022) and 2025 (+0.052, the new canary) -- the smoother vol_factor reduces the tilt in high-vol underperformers. 3. The vol_window=21 is the sweet spot: captures the 2022 vol rise on time (2022 lifts) while protecting the 2017 (low-vol). 4. The vol_window sweep is CONVERGED (10 too noisy, 21 sweet spot, 63 too smooth).","decision":"DISCARD -- the vol_window=63 is too smooth (2022 dropped, floor dropped). iter62 (vol_window=21) remains the champion. The vol_window sweep is CONVERGED at 21.","finding":"The vol_window sweep is CONVERGED: 10 (too noisy, floor 0.521) -> 21 (sweet spot, floor 0.5314) -> 63 (too smooth, 2022 drops, floor 0.523). The 21 captures the 2022 vol rise on time (2022 lifts) while protecting the 2017 (low-vol). The 63 protects the 2025 (new canary) but hurts the 2022 (the smoother window captures the vol rise late). The 2022 (high-vol outperformer) and 2025 (high-vol underperformer) are a NEW confound -- the vol-adjusted can't separate them (both high-vol get more tilt).","hypothesis":"Iter65: conf_tilt_vol_window=63 (smoother vol signal). Might protect the 2025 canary (smoother vol -> less tilt in high-vol underperformers).","infra_note":"No new infra. Changed conf_tilt_vol_window 21->63.","next_action":"The vol-adjusted (vol_window=21) + weight_tilt (0.13) is the CONVERGED optimum (floor 0.5314, robust 0.959). The vol_window sweep is converged. The 2022 (high-vol outperformer) and 2025 (high-vol underperformer) are a NEW confound -- the vol-adjusted can't separate them. To lift the floor above 0.5314, need a signal that separates the 2022 from the 2025 (both high-vol) -- or a new mechanism. Update prompt.md with the iter62 champion. The floor 0.5314 may be near the structural limit for the vol-adjusted conf_tilt.","result":"Floor DROPPED 0.53138->0.52306 (-0.008). 2022=0.649 (-0.031, smoother window captured vol rise late). 2017=0.711 (+0.022, protected more). 2025=1.088 (+0.052, the new canary protected). 2015=0.523 (-0.008, floor). robust 0.959->0.949 (BELOW 0.95 STOP). The 63 is too smooth. DISCARD."}}
{"run":95,"commit":"d3f3f4a","metric":0.522375,"metrics":{"best_year_sharpe":2.788058,"cagr":0.781499,"calmar":1.690325,"information_ratio":1.40065,"max_drawdown":-0.462337,"mean_year_sharpe":1.309545,"n_years":11,"perturb_mean_sharpe":1.44309,"perturb_mean_worst_year":0.260353,"perturb_robust_std":0.038399,"perturb_sharpe_std":0.037585,"perturb_worst_year_std":0.164107,"robust_score":0.977593,"sharpe":1.467792,"sortino":2.111388,"std_year_sharpe":0.663903,"veto_pct":0.032609,"year_2015_sharpe":0.522375,"year_2016_sharpe":1.866607,"year_2017_sharpe":0.698894,"year_2018_sharpe":0.966822,"year_2019_sharpe":1.074009,"year_2020_sharpe":2.146366,"year_2021_sharpe":1.232631,"year_2022_sharpe":0.682613,"year_2023_sharpe":1.398926,"year_2024_sharpe":2.788058,"year_2025_sharpe":1.027696,"year_2022_cagr":0.275215,"year_2018_cagr":0.398003,"year_2025_cagr":0.610631},"status":"discard","description":"Iter66 (SPY): conf_tilt_dir=true (dir-adjusted, weight_tilt=0.13). DISCARD -- floor regressed -0.009. The dir-adjusted is MORE ROBUST (robust 0.978, perturb 0.164) and lifted 2023 (+0.283) but HURTS the 2015 floor (outperformer in positive-return -> dir_factor<1 -> less tilt -> dropped). The vol-adjusted (iter62) is the CORRECT regime signal (helps outperformers in high-vol). dir-adjusted REJECTED. iter62 champion holds.","timestamp":1782806862974,"segment":1,"confidence":6.290471071767309,"asi":{"caveats":"1. The dir-adjusted is MORE ROBUST (robust 0.978, perturb 0.164) -- a useful finding. But it HURTS the 2015 floor (-0.009). 2. The dir-adjusted HELPS underperformers (2023 +0.283: positive-return, top-1 underperforms -> less tilt -> lifted) and HURTS outperformers (2015: positive-return, top-1 outperforms -> less tilt -> dropped). 3. The 2015 (the floor) is an outperformer in positive-return months -> the dir-adjusted hurts it. 4. The vol-adjusted (iter62) is the CORRECT regime signal -- it helps outperformers in high-vol (2022) and protects underperformers in low-vol (2017). The dir-adjusted is the wrong direction (hurts outperformers in positive-return). 5. The 2025 was NOT protected (-0.009) -- the 2025 might have negative-return months too.","decision":"DISCARD -- the floor regressed (-0.009). The dir-adjusted hurts the 2015 floor (outperformer in positive-return). iter62 (vol-adjusted, no dir) remains the champion.","finding":"The dir-adjusted is the WRONG direction. It helps underperformers (2023, +0.283) but hurts outperformers (2015, the floor, -0.009) in positive-return months. The 2015 (the floor) is an outperformer -> the dir-adjusted reduces its tilt (dir_factor < 1 in positive-return) -> 2015 drops. The vol-adjusted (iter62) is the CORRECT regime signal: it helps outperformers in high-vol (2022) and protects underperformers in low-vol (2017). The dir-adjusted is the opposite (hurts outperformers in positive-return). REJECTED. BUT: the dir-adjusted is more robust (robust 0.978, perturb 0.164) -- a useful finding for a future robustness-focused variant.","hypothesis":"Iter66: conf_tilt_dir=true (dir-adjusted, weight_tilt=0.13). Scale the tilt by the market-DIRECTION regime (more tilt in bear/negative-return like 2022, less in bull/positive like 2025/2017). Protects the 2025 canary.","infra_note":"conf_tilt_dir added (8 edits: _size_weights conf_tilt_dir+dir_factor_map params + dir_factor multiplication, apply_veto_and_select passthrough, main() dir_factor_map computation from bench 21-day return + print + two calls). No-op when false. Reverting restores iter62.","next_action":"The dir-adjusted is REJECTED (hurts the 2015 floor). The vol-adjusted (iter62) is the champion. The vol-adjusted + weight_tilt is CONVERGED (0.13, floor 0.5314). The 2022/2025 (both high-vol) confound remains -- the vol-adjusted can't separate them, and the dir-adjusted hurts the 2015. Update prompt.md with the iter62 champion. The floor 0.5314 may be near the structural limit for the vol-adjusted conf_tilt. Consider declaring convergence or a high-effort direction.","result":"Floor DROPPED 0.53138->0.52238 (-0.009). 2015=0.522 (-0.009, the floor, outperformer hurt by dir_factor<1). 2023=1.399 (+0.283, underperformer helped). 2017=0.699 (+0.010). 2022=0.683 (+0.003). 2025=1.028 (-0.009, NOT protected). robust 0.959->0.978 (UP +0.019, IMPROVED). perturb 0.180->0.164 (DOWN -0.016, MORE stable). The dir-adjusted is more robust but hurts the 2015 floor. DISCARD."}}
