{"run":86,"commit":"f6e790d","metric":0.525993,"metrics":{"best_year_sharpe":2.880481,"cagr":0.77759,"calmar":1.705117,"information_ratio":1.389422,"max_drawdown":-0.456033,"mean_year_sharpe":1.288677,"n_years":11,"perturb_mean_sharpe":1.458452,"perturb_mean_worst_year":0.277711,"perturb_robust_std":0.030384,"perturb_sharpe_std":0.03357,"perturb_worst_year_std":0.158406,"robust_score":0.947384,"sharpe":1.458954,"sortino":2.091597,"std_year_sharpe":0.682587,"veto_pct":0.032609,"year_2015_sharpe":0.525993,"year_2016_sharpe":1.779231,"year_2017_sharpe":0.605076,"year_2018_sharpe":0.969637,"year_2019_sharpe":1.12389,"year_2020_sharpe":2.097385,"year_2021_sharpe":1.257042,"year_2022_sharpe":0.593922,"year_2023_sharpe":1.232864,"year_2024_sharpe":2.880481,"year_2025_sharpe":1.109931,"year_2022_cagr":0.226793,"year_2018_cagr":0.386955,"year_2025_cagr":0.680074},"status":"discard","description":"Iter57 (SPY): weight_tilt=0.13. DISCARD -- robustness STOP triggered (0.947<0.95). Floor improved +0.007 but the floor-chasing went too far. 2017=0.605 (barely above 0.60 stop). iter56 (0.11, robust 0.960) is the peak. conf_tilt+weight_tilt direction EXHAUSTED. Summary rule: don't chase point-estimate gains that drop robust_score.","timestamp":1782803540883,"segment":1,"confidence":6.877479546840216,"asi":{"caveats":"1. The robustness STOP is triggered (0.947 < 0.95). The floor-chasing has gone too far. 2. The 2017 (0.605) is barely above the 0.60 stop -- the next step (0.15) would crash 2017 below the floor. 3. The official guard (perturb 0.158 < 0.246) still passes, but the robustness stop is a STRONGER overfitting signal (the average is dropping fast, the dispersion is rising). 4. The summary's rule explicitly warns against this pattern.","decision":"DISCARD -- the robustness STOP is triggered (0.947 < 0.95). The floor-chasing has gone too far. iter56 (0.11, robust 0.960) is the peak.","finding":"The weight_tilt sweep is CONVERGED at 0.11 (robustness 0.960, just above the 0.95 stop). The floor-chasing tradeoff: weight_tilt lifts the floor (+0.006/step) but drops the robustness (-0.013/step) and the 2017 (-0.028/step). At 0.13, the robustness crosses 0.95 (the stop). At 0.15, the 2017 would crash below the floor. The conf_tilt (pow=5.0) + weight_tilt=0.11 is the converged optimum (floor 0.5190, robust 0.960).","hypothesis":"Iter57: weight_tilt=0.13 (final push). Stop conditions: robust<0.95 or 2017<0.60 -> stop.","infra_note":"No new infra. Changed weight_tilt 0.11->0.13.","next_action":"The conf_tilt + weight_tilt direction is EXHAUSTED (robustness stop at 0.13, floor 0.5190 at 0.11). Update ideas.md with the weight_tilt sweep findings. Then explore a DIFFERENT mechanism to lift the floor WITHOUT dropping the robustness -- need a signal that separates the 2022 high-conf (top-1 outperforms) from the 2017 high-conf (top-1 underperforms). The composite gap is high in both. No obvious signal (sector-specific or return-chasing, both rejected). The floor 0.5190 may be near the structural limit for the conf_tilt mechanism.","result":"Floor improved 0.51901->0.52599 (+0.007) BUT robust_score 0.960->0.947 (BELOW 0.95 STOP). 2017=0.605 (barely above 0.60 stop). 2022=0.594 (+0.022). 2015=0.526 (+0.007, floor). perturb 0.154->0.158 (+0.005, within official guard). The robustness stop TRIGGERED. DISCARD."}}
{"run":87,"commit":"f6e790d","metric":0.453626,"metrics":{"best_year_sharpe":2.825359,"cagr":0.771074,"calmar":1.716996,"information_ratio":1.408426,"max_drawdown":-0.449083,"mean_year_sharpe":1.308046,"n_years":11,"perturb_mean_sharpe":1.466215,"perturb_mean_worst_year":0.237248,"perturb_robust_std":0.043733,"perturb_sharpe_std":0.037958,"perturb_worst_year_std":0.120155,"robust_score":0.968962,"sharpe":1.478366,"sortino":2.125678,"std_year_sharpe":0.678168,"veto_pct":0.032609,"year_2015_sharpe":0.531241,"year_2016_sharpe":1.875033,"year_2017_sharpe":0.661826,"year_2018_sharpe":0.987789,"year_2019_sharpe":1.110774,"year_2020_sharpe":2.038306,"year_2021_sharpe":1.295727,"year_2022_sharpe":0.453626,"year_2023_sharpe":1.372643,"year_2024_sharpe":2.825359,"year_2025_sharpe":1.236179,"year_2022_cagr":0.160342,"year_2018_cagr":0.370242,"year_2025_cagr":0.796534},"status":"discard","description":"Iter58 (SPY): conf_tilt_percentile=75. DISCARD -- 2022 CRASHED (0.572->0.454, -0.118). The 2022 is moderate-conf (below 75th percentile), not very-high. The 75th tilts less in the 2022 -> crashes it. 2015 lifted (very-high-conf), 2017 recovered. The median (50th) is OPTIMAL (tilts fully in both 2015 and 2022). conf_tilot_percentile EXHAUSTED. iter56 champion holds.","timestamp":1782804295590,"segment":1,"confidence":6.966778219841145,"asi":{"caveats":"1. The 2022 high-conf is MODERATE-confidence (between median and 75th percentile), NOT very-high. The 2015 is very-high (above 75th). 2. The median (50th) is the OPTIMAL threshold -- tilts fully in both 2015 and 2022 (both above median). 3. The 2022 and 2017 are BOTH moderate-conf -- the conf_tilt CANNOT separate them (both get full tilt at the median). This is the fundamental tradeoff that limits the floor-chasing.","decision":"DISCARD -- the 75th percentile crashed the 2022 (moderate-conf, less tilt). The median is optimal. iter56 (median, 0.11) remains the champion.","finding":"The conf_tilt_percentile is EXHAUSTED (median/50th optimal). The 2015 is very-high-conf (above 75th), the 2022 is moderate-conf (between median and 75th). The 75th tilts fully only in the 2015 -> crashes the 2022 (which needs the tilt). The median tilts fully in both -> optimal. The 2022 and 2017 are BOTH moderate-conf -> the conf_tilt cannot separate them (both get full tilt) -> this is the fundamental limit of the floor-chasing (the 2017 drops as the weight_tilt rises, eventually crashing the robustness).","hypothesis":"Iter58: conf_tilt_percentile=75 (higher threshold for full tilt). Tilt fully only in the top-25% gap months (very-high-conf, e.g. 2022 energy) and less in moderate-conf (2017) -> protect 2017, allow a higher weight_tilt.","infra_note":"conf_tilt_percentile added (2-line change: read param, use np.percentile instead of np.median). No-op when 50 (median). Reverting to 50 restores iter56.","next_action":"The conf_tilt direction is FULLY EXHAUSTED (pow, weight_tilt, percentile, cap all tested). The floor is 0.5190 (iter56). The fundamental limit: the 2022 and 2017 are both moderate-conf, and no signal separates them (the 2022 top-1 outperforms, the 2017 top-1 underperforms, but the composite gap is similar). To lift the floor above 0.5190, need a DIFFERENT signal that separates the 2022 moderate-conf (top-1 outperforms) from the 2017 moderate-conf (top-1 underperforms) -- sector-specific or return-chasing, both rejected. The floor 0.5190 may be the structural limit for the conf_tilt mechanism. Consider: declare convergence, or explore a high-effort direction (Phase 5, new architecture).","result":"DISASTER: worst_year 0.51901->0.45363 (-0.065). 2022 CRASHED (0.5715->0.4536, -0.118 -- the 2022 moderate-conf got less tilt at the 75th percentile). 2015 LIFTED (0.5190->0.5312, +0.012 -- very-high-conf, full tilt). 2017 RECOVERED (0.6317->0.6618, +0.030 -- moderate-conf, less tilt). Floor shifted to 2022 (0.454). robust 0.960->0.969 (slightly up). The 75th percentile is WRONG for the 2022."}}
{"run":88,"commit":"f6e790d","metric":0.53418,"metrics":{"best_year_sharpe":2.868967,"cagr":0.774854,"calmar":1.680334,"information_ratio":1.381757,"max_drawdown":-0.461131,"mean_year_sharpe":1.279367,"n_years":11,"perturb_mean_sharpe":1.458693,"perturb_mean_worst_year":0.270356,"perturb_robust_std":0.033406,"perturb_sharpe_std":0.03626,"perturb_worst_year_std":0.149842,"robust_score":0.936307,"sharpe":1.452409,"sortino":2.07618,"std_year_sharpe":0.675455,"veto_pct":0.032609,"year_2015_sharpe":0.53418,"year_2016_sharpe":1.807664,"year_2017_sharpe":0.587211,"year_2018_sharpe":0.973308,"year_2019_sharpe":1.132695,"year_2020_sharpe":2.098806,"year_2021_sharpe":1.247656,"year_2022_sharpe":0.571516,"year_2023_sharpe":1.157012,"year_2024_sharpe":2.868967,"year_2025_sharpe":1.094023,"year_2022_cagr":0.215156,"year_2018_cagr":0.383772,"year_2025_cagr":0.668526},"status":"discard","description":"Iter59 (SPY): conf_tilt_bonus=0.05 (2-tier, very-high-conf bonus). DISCARD -- stops triggered (robust 0.936<0.95, 2017 0.587<0.60). PARTIAL success: 2015 lifted +0.015, 2022 UNCHANGED (separation worked!), but 2017 dropped -0.044 (also very-high-conf, top-1 underperforms). Bad trade (2017 drops 3x faster). 2015/2017 both very-high-conf -- no signal separates them. FUNDAMENTAL LIMIT. iter56 champion holds.","timestamp":1782804789265,"segment":1,"confidence":6.8552692016874985,"asi":{"caveats":"1. The 2-tier bonus is a PARTIAL success: it lifted the 2015 (+0.015) and left the 2022 UNCHANGED (the 2015/2022 separation WORKED). But it hurt the 2017 (-0.044) -- the 2017 ALSO has very-high-conf months where the top-1 underperforms. 2. The bonus hurts the 2017 3x faster than it lifts the 2015 (+0.015 vs -0.044) -- a bad trade. 3. The 2015 and 2017 are BOTH very-high-conf -- no signal separates the 2015 (outperforms) from the 2017 (underperforms). This is the FUNDAMENTAL LIMIT. 4. A smaller bonus (0.02) might lift the 2015 (+0.006) with the robustness staying above 0.95 (~0.952) -- but it's a 1-D sweep (overfitting risk) and the bad-trade ratio (3x) means the 2017 still drops faster.","decision":"DISCARD -- the stops are triggered (robust 0.936<0.95, 2017 0.587<0.60). The 2-tier bonus hurts the 2017 3x faster than it lifts the 2015. iter56 (0.5190, robust 0.960) remains the champion.","finding":"The 2-tier bonus SEPARATES the 2015 (very-high-conf) from the 2022 (moderate-conf) -- the 2015 lifted (+0.015) and the 2022 was UNCHANGED (the bonus only affects gap>p75). BUT the 2017 is ALSO very-high-conf -- the bonus hurt it (-0.044, the 2017 very-high-conf top-1 underperforms). The 2015 and 2017 are both very-high-conf, and no signal separates them (the 2015 top-1 outperforms, the 2017 top-1 underperforms). This is the FUNDAMENTAL LIMIT of the conf_tilt mechanism: the 2015/2017 (very-high) and 2022/2017 (moderate) pairs are confounded -- no confidence signal separates the outperformers from the underperformers.","hypothesis":"Iter59: conf_tilt_bonus=0.05 (2-tier: extra bonus tilt for very-high-conf, gap>p75). Lift the 2015 (very-high, top-1 outperforms) WITHOUT touching the 2022 (moderate). Predicted: 2015 lifts, 2022 unchanged, floor -> 2022 (0.572).","infra_note":"2-tier bonus added (7 edits: _size_weights p75_gap+conf_tilt_bonus params + bonus block, apply_veto_and_select passthrough, main() p75_gap precompute + read + print + two calls). No-op when bonus=0. Reverting to bonus=0 restores iter56.","next_action":"The conf_tilt direction is FULLY EXHAUSTED (pow, weight_tilt, percentile, cap, 2-tier bonus). The floor is 0.5190 (iter56). The FUNDAMENTAL LIMIT: the 2015/2017 (both very-high-conf) and 2022/2017 (both moderate-conf) pairs are confounded -- no confidence signal separates the outperformers (2015, 2022) from the underperformers (2017, 2023, 2025). To lift the floor above 0.5190, need a NON-confidence signal (sector-specific, return-chasing -- both rejected) or a new architecture. The floor 0.5190 is the structural limit for the conf_tilt mechanism. Consider declaring convergence or a high-effort direction (Phase 5).","result":"Floor improved 0.51901->0.53418 (+0.015, HIGHEST yet). 2015=0.534 (UP +0.015, bonus lifted very-high-conf). 2022=0.5715 (UNCHANGED -- bonus didn't touch moderate-conf, as designed!). 2017=0.587 (DOWN -0.044, below 0.60 stop -- 2017 also has very-high-conf months, top-1 underperforms). robust 0.960->0.936 (BELOW 0.95 stop). perturb 0.154->0.150 (slightly more stable). The 2-tier SEPARATES 2015 from 2022 but NOT from 2017. Bad trade (2017 drops 3x faster)."}}
{"run":89,"commit":"f6e790d","metric":0.53418,"metrics":{"best_year_sharpe":2.868967,"cagr":0.773909,"calmar":1.713296,"information_ratio":1.392813,"max_drawdown":-0.451708,"mean_year_sharpe":1.293817,"n_years":11,"perturb_mean_sharpe":1.460826,"perturb_mean_worst_year":0.272635,"perturb_robust_std":0.032395,"perturb_sharpe_std":0.034204,"perturb_worst_year_std":0.151789,"robust_score":0.952399,"sharpe":1.462381,"sortino":2.095908,"std_year_sharpe":0.682837,"veto_pct":0.032609,"year_2015_sharpe":0.53418,"year_2016_sharpe":1.807664,"year_2017_sharpe":0.594948,"year_2018_sharpe":0.973308,"year_2019_sharpe":1.100886,"year_2020_sharpe":2.08474,"year_2021_sharpe":1.270943,"year_2022_sharpe":0.571516,"year_2023_sharpe":1.30549,"year_2024_sharpe":2.868967,"year_2025_sharpe":1.119351,"year_2022_cagr":0.215156,"year_2018_cagr":0.3749,"year_2025_cagr":0.684805},"status":"discard","description":"Iter60 (SPY): conf_tilt_bonus=0.05 at p90 (2-tier, higher threshold). DISCARD -- 2017 stop triggered (0.595<0.60). Slightly better trade than p75 (robust 0.952 vs 0.936, 2017 0.595 vs 0.587) but the 2017 is still above p90 (both 2015/2017 extremely-high-conf). No percentile separates them. FUNDAMENTAL LIMIT confirmed. iter56 champion holds. conf_tilt+2-tier EXHAUSTED.","timestamp":1782805280755,"segment":1,"confidence":6.747273536612507,"asi":{"caveats":"1. The p90 is a SLIGHTLY better trade than p75 (robust 0.952 vs 0.936, 2017 0.595 vs 0.587) -- fewer 2017 very-high-conf months triggered the bonus. 2. But the 2017 is STILL above p90 (both 2015 and 2017 are extremely-high-conf) -- the p90 didn't separate them. 3. The 2017 canary (0.595) is below 0.60, approaching the floor (0.534). The next bonus step would crash 2017 below the floor. 4. The robustness (0.952) is just above 0.95 -- the floor-chasing is at the edge.","decision":"DISCARD -- the 2017 stop is triggered (0.595<0.60). The p90 didn't separate the 2015 from the 2017 (both extremely-high-conf). iter56 (0.5190, robust 0.960, 2017 0.632) remains the champion.","finding":"The 2-tier bonus at p90 is a slightly better trade than p75 (the 2017 hurt less: -0.037 vs -0.044). But the 2017 is STILL above p90 (both 2015 and 2017 are extremely-high-conf). No percentile separates the 2015 (extremely-high, outperforms) from the 2017 (extremely-high, underperforms). The FUNDAMENTAL LIMIT is confirmed: the 2015/2017 (both very/extremely-high-conf) and 2022/2017 (both moderate-conf) pairs are confounded -- no confidence signal separates the outperformers from the underperformers. The 2-tier bonus direction is EXHAUSTED.","hypothesis":"Iter60: conf_tilt_bonus=0.05 at p90 (higher threshold). The 2017 might be below p90 (protected) while the 2015 is above (lifted).","infra_note":"2-tier bonus re-added with configurable percentile (conf_tilt_bonus_pct, default 75). Tested p90. No-op when bonus=0. Reverting restores iter56.","next_action":"The conf_tilt + 2-tier direction is FULLY EXHAUSTED (pow, weight_tilt, percentile, cap, 2-tier bonus at p75/p90). The floor is 0.5190 (iter56). The FUNDAMENTAL LIMIT: no confidence signal separates the outperformers (2015, 2022) from the underperformers (2017, 2023, 2025). The 2017 is the canary (drops as the tilt rises). To lift the floor above 0.5190, need a NON-confidence signal (sector-specific, return-chasing -- both rejected) or a new architecture. Update prompt.md with the iter56 champion. The floor 0.5190 is the structural limit for the conf_tilt mechanism. Consider declaring convergence or a high-effort direction (Phase 5).","result":"Floor improved 0.51901->0.53418 (+0.015, SAME as p75). 2015=0.534 (lifted, same). 2022=0.572 (unchanged). 2017=0.595 (DOWN -0.037, less than p75's -0.044, but below 0.60 stop). robust 0.960->0.952 (DOWN -0.008, less than p75's -0.024, above 0.95). The p90 is a slightly better trade but the 2017 stop is still triggered."}}
{"run":90,"commit":"2f495a0","metric":0.523147,"metrics":{"best_year_sharpe":2.829443,"cagr":0.779652,"calmar":1.709087,"information_ratio":1.400264,"max_drawdown":-0.456181,"mean_year_sharpe":1.305948,"n_years":11,"perturb_mean_sharpe":1.46217,"perturb_mean_worst_year":0.277155,"perturb_robust_std":0.029912,"perturb_sharpe_std":0.036426,"perturb_worst_year_std":0.16738,"robust_score":0.970686,"sharpe":1.469682,"sortino":2.113772,"std_year_sharpe":0.670525,"veto_pct":0.032609,"year_2015_sharpe":0.523147,"year_2016_sharpe":1.835132,"year_2017_sharpe":0.704999,"year_2018_sharpe":0.991703,"year_2019_sharpe":1.091134,"year_2020_sharpe":2.160771,"year_2021_sharpe":1.299085,"year_2022_sharpe":0.647512,"year_2023_sharpe":1.201219,"year_2024_sharpe":2.829443,"year_2025_sharpe":1.081281,"year_2022_cagr":0.257742,"year_2018_cagr":0.38311,"year_2025_cagr":0.655016},"status":"keep","description":"Iter61 (SPY): conf_tilt_vol=true (vol-adjusted conf_tilt, weight_tilt=0.11). KEEP -- 12th primary improvement! BREAKTHROUGH: the vol-adjusted is the FIRST mechanism to separate the 2022 (high-vol) from the 2017 (low-vol). 2022 lifted +0.076, 2017 RECOVERED +0.073 (canary protected). robust IMPROVED +0.010. STRICTLY DOMINATES iter56. The market-vol regime succeeds where confidence signals and 210-SMA failed.","timestamp":1782805792811,"segment":1,"confidence":6.793797609871605,"asi":{"caveats":"1. The vol-adjusted is a REGIME signal (market vol) -- more responsive than the 210-SMA (rejected for lag). It separates the 2022 (high-vol) from the 2017 (low-vol) where confidence signals (composite gap) and the 210-SMA failed. 2. The 2022 lifted (+0.076) and the 2017 recovered (+0.073) -- the vol-adjusted DECOUPLES them. 3. The floor (2015, moderate-vol) only lifted +0.004 (the 2015 vol is moderate, vol_factor~1). 4. The perturb rose +0.014 (within guard) -- the vol-adjusted adds some perturbation sensitivity (the vol_factor varies). 5. The 2017 (0.705) is now well above the 0.60 stop -- the robustness stop is DELAYED -> can push the weight_tilt higher.","decision":"KEEP -- 12th primary improvement. BREAKTHROUGH: the vol-adjusted is the FIRST mechanism to separate the 2022 (high-vol) from the 2017 (low-vol). STRICTLY DOMINATES iter56: higher floor (+0.004) + higher robust (+0.010) + 2017 recovered (+0.073). The guard passes (+0.014 < 0.10).","finding":"The market-vol regime signal SUCCEEDS where confidence signals and the 210-SMA failed. The vol-adjusted conf_tilt scales the tilt by the market-vol regime (vol / median_vol, capped at 2.0). In high-vol/bear (2022), tilt MORE -> the 2022 top-1 outperforms -> 2022 lifted (+0.076). In low-vol/bull (2017), tilt LESS -> the 2017 top-1 underperforms -> 2017 protected/recovered (+0.073). The vol is responsive enough to separate the 2022 (early-2022 high-vol) from the 2017 (low-vol) -- unlike the 210-SMA (lag, missed early-2022). The 2015 (moderate-vol) only lifted +0.004 (the floor). The robustness IMPROVED (+0.010) because the 2017 is protected. This DECOUPLES the 2022 lift from the 2017 drop -- the fundamental limit of the conf_tilt (2017/2022 both moderate-conf) is BROKEN by the vol regime.","hypothesis":"Iter61: conf_tilt_vol=true (vol-adjusted conf_tilt, weight_tilt=0.11). Scale the tilt by the market-vol regime (more tilt in high-vol/bear like 2022, less in low-vol/bull like 2017). Protects the 2017 canary and may allow a higher weight_tilt.","infra_note":"conf_tilt_vol added (8 edits: _size_weights conf_tilt_vol+vol_factor_map params + vol_factor multiplication, apply_veto_and_select passthrough, main() vol_factor_map computation from bench 21-day realized vol + print + two calls). No-op when false (vol_factor=1.0). Reverting restores iter56.","next_action":"Test weight_tilt=0.13 + conf_tilt_vol=true. The 2017 is now protected (low-vol, 0.705, well above the 0.60 stop). The 0.13 triggered the robustness stop BEFORE (iter57, robust 0.947) -- but now the 2017 is protected, so the robustness might stay above 0.95. If so, the floor lifts further (the 0.13 weight_tilt, with the 2022 high-vol lifted and the 2017 protected). The vol-adjusted UNLOCKS a higher weight_tilt (like the conf_tilt did at iter48).","result":"PRIMARY IMPROVEMENT: worst_year 0.51901->0.52315 (+0.004). 2022=0.6475 (UP +0.076, high-vol tilt more). 2017=0.7050 (UP +0.073, low-vol tilt less, RECOVERED). 2015=0.5231 (UP +0.004, moderate-vol, the floor). 2020 UP (+0.076, high-vol). 2023/2025 down. robust 0.960->0.971 (UP +0.010, IMPROVED). perturb 0.154->0.167 (UP +0.014, within 0.10 guard). 2017 above 0.60 stop (RECOVERED). STRICTLY DOMINATES iter56."}}
