{"run":11,"commit":"f27c77d","metric":-0.636366,"metrics":{"best_year_sharpe":1.959067,"cagr":0.502665,"calmar":0.993159,"information_ratio":0.951459,"max_drawdown":-0.506128,"mean_year_sharpe":1.021664,"n_years":11,"perturb_mean_worst_year":-0.387062,"perturb_robust_std":0.158003,"perturb_sharpe_std":0.135416,"perturb_worst_year_std":0.422675,"robust_score":0.637559,"sharpe":1.068698,"sortino":1.576183,"std_year_sharpe":0.768212,"veto_pct":0.076771,"year_2015_sharpe":0.492401,"year_2016_sharpe":1.687951,"year_2017_sharpe":1.527379,"year_2018_sharpe":-0.636366,"year_2019_sharpe":1.002936,"year_2020_sharpe":1.706493,"year_2021_sharpe":0.494492,"year_2022_sharpe":0.219862,"year_2023_sharpe":1.723363,"year_2024_sharpe":1.959067,"year_2025_sharpe":1.060731,"year_2022_cagr":0.058035,"year_2018_cagr":-0.223149,"year_2025_cagr":0.657538},"status":"discard","description":"Iter10: sma_fast 3->4. TEXTBOOK OVERFIT -- sharpe/2024/2020 up but 2018 collapsed -0.031->-0.636 and perturb_worst_std exploded 0.27->0.42 (exceeds guard). Discard; sma_fast=3 robust.","timestamp":1782734001389,"segment":0,"confidence":null,"asi":{"hypothesis":"sma_fast 3->4 may Pareto-improve on top of the vol_scaled base (T4 at N=1 showed slight sharpe gain)","result":"TEXTBOOK OVERFIT: sharpe 1.05->1.07, 2024 1.76->1.96, 2020 1.59->1.71, 2023 1.58->1.72 (good years up) BUT worst_year -0.031->-0.636 (2018 COLLAPSED) AND perturb_worst_std 0.27->0.42 (EXPLODED, exceeds guard 0.37), perturb_sharpe_std 0.065->0.135, stdY 0.62->0.77","decision":"DISCARD -- the overfitting guard earns its keep here. Headline sharpe up but the floor collapsed and instability doubled. This is chasing 2024/2020 at the cost of 2018 + stability. sma_fast=4 is overfit; sma_fast=3 is robust","overfitting_guard":"perturb_worst_std 0.42 > guard 0.37 -- would trigger checks_failed too. Exactly the pattern the checklist is designed to reject","next_action":"Iter11: earnings_yield 3->2 (T4 showed neutral at N=1; lower risk of overfit than sma_fast). Do NOT raise sma_fast. Keep sma_fast=3."}}
{"run":12,"commit":"f27c77d","metric":-0.031412,"metrics":{"best_year_sharpe":1.75869,"cagr":0.494846,"calmar":0.97771,"information_ratio":0.932286,"max_drawdown":-0.506128,"mean_year_sharpe":1.017921,"n_years":11,"perturb_mean_worst_year":-0.637067,"perturb_robust_std":0.066777,"perturb_sharpe_std":0.063101,"perturb_worst_year_std":0.268973,"robust_score":0.70965,"sharpe":1.04912,"sortino":1.535015,"std_year_sharpe":0.616543,"veto_pct":0.076871,"year_2015_sharpe":0.492401,"year_2016_sharpe":1.687951,"year_2017_sharpe":1.477235,"year_2018_sharpe":-0.031412,"year_2019_sharpe":0.988666,"year_2020_sharpe":1.585868,"year_2021_sharpe":0.417227,"year_2022_sharpe":0.219862,"year_2023_sharpe":1.539917,"year_2024_sharpe":1.75869,"year_2025_sharpe":1.060731,"year_2022_cagr":0.058035,"year_2018_cagr":-0.047805,"year_2025_cagr":0.657538},"status":"discard","description":"Iter11: earnings_yield 3->2. Neutral no-op (all metrics within +/-0.002 of iter8). earnings_yield weight too small vs asset_growth to matter. Discard; keep ey=3.","timestamp":1782734121978,"segment":0,"confidence":null,"asi":{"hypothesis":"earnings_yield 3->2 may Pareto-improve (T4 neutral at N=1)","result":"NEUTRAL NO-OP: worst_year -0.031 (equal), sharpe 1.0516->1.0491 (-0.002), robust 0.7116->0.7097 (-0.002), all metrics within +/-0.002 of iter8. 2023 1.58->1.54 (tiny)","decision":"DISCARD -- no Pareto improvement, essentially identical","root_cause":"earnings_yield weight (3) is tiny vs asset_growth (20) within the 0.02 fundamental group, so halving it barely shifts the composite. earnings_yield lever is WEAK/DEAD at this group weight","next_action":"Run FULL overfitting checklist on current best (iter8 config) to validate T1/T4 now pass vs baseline FAIL. Then try sma_trend 201->190 and possibly a contrarian factor. Do NOT pursue earnings_yield further."}}
{"run":13,"commit":"f27c77d","metric":-0.031412,"metrics":{"best_year_sharpe":1.716745,"cagr":0.515383,"calmar":1.018286,"information_ratio":0.959461,"max_drawdown":-0.506128,"mean_year_sharpe":1.00206,"n_years":11,"perturb_mean_worst_year":-0.290115,"perturb_robust_std":0.153961,"perturb_sharpe_std":0.098878,"perturb_worst_year_std":0.469882,"robust_score":0.688465,"sharpe":1.074757,"sortino":1.592682,"std_year_sharpe":0.62719,"veto_pct":0.076978,"year_2015_sharpe":0.492401,"year_2016_sharpe":1.687951,"year_2017_sharpe":1.302134,"year_2018_sharpe":-0.031412,"year_2019_sharpe":1.198276,"year_2020_sharpe":1.585868,"year_2021_sharpe":0.231436,"year_2022_sharpe":0.217145,"year_2023_sharpe":1.582819,"year_2024_sharpe":1.716745,"year_2025_sharpe":1.0393,"year_2022_cagr":0.056273,"year_2018_cagr":-0.047805,"year_2025_cagr":0.646345},"status":"discard","description":"Iter12: sma_fast 3->2. Overfit guard catches it: single-run sharpe 1.07 but perturb_worst_std EXPLODED 0.27->0.47 (exceeds guard 0.37). Single-run T4 missed it; perturbation test rejects. Discard; sma_fast=3 robust.","timestamp":1782735473379,"segment":0,"confidence":null,"asi":{"hypothesis":"sma_fast 3->2 (checklist T4 single-run flagged as Pareto: sharpe 1.05->1.07, floor same)","result":"OVERFIT GUARD CATCHES IT: single-run sharpe 1.05->1.07, cagr 0.50->0.52, calmar 0.98->1.02, sortino 1.54->1.59, 2019 0.99->1.20 BUT perturb_worst_std EXPLODED 0.27->0.47 (EXCEEDS guard 0.37), perturb_robust_std 0.069->0.154, perturb_sharpe_std 0.065->0.099. 2017 1.48->1.30, 2021 0.42->0.23","decision":"DISCARD -- the worst-year became fragile under perturbation. The single-run T4 sensitivity missed this; the perturbation test (the real overfitting signal) rejects it. sma_fast=2 lifts the average via 2019 but doubles worst-year instability","key_lesson":"Single-run parameter sensitivity (checklist T4) is necessary but NOT sufficient -- it flagged sma_fast=2 as a candidate. The perturbation test (T1/measure.sh) is the real overfitting judge. Always confirm T4 candidates with perturbation before keeping","next_action":"Iter13: veto_threshold 0.775->0.80 (another T4 Pareto candidate; checklist showed sharpe 1.05->1.07, floor same WITH vol_scaled). Test WITH perturbation -- if perturb_worst_std stays <0.37, keep; else discard like sma_fast=2."}}
{"run":14,"commit":"9e42f06","metric":-0.031412,"metrics":{"best_year_sharpe":1.75869,"cagr":0.510619,"calmar":1.008875,"information_ratio":0.957247,"max_drawdown":-0.506128,"mean_year_sharpe":1.030746,"n_years":11,"perturb_mean_worst_year":-0.637067,"perturb_robust_std":0.083189,"perturb_sharpe_std":0.078042,"perturb_worst_year_std":0.268973,"robust_score":0.724179,"sharpe":1.070509,"sortino":1.558474,"std_year_sharpe":0.613135,"veto_pct":0.097163,"year_2015_sharpe":0.550429,"year_2016_sharpe":1.705882,"year_2017_sharpe":1.385408,"year_2018_sharpe":-0.031412,"year_2019_sharpe":0.988666,"year_2020_sharpe":1.585868,"year_2021_sharpe":0.417227,"year_2022_sharpe":0.219862,"year_2023_sharpe":1.577233,"year_2024_sharpe":1.75869,"year_2025_sharpe":1.180355,"year_2022_cagr":0.058035,"year_2018_cagr":-0.047805,"year_2025_cagr":0.785775},"status":"keep","description":"Iter13: veto_threshold 0.775->0.80. Clean Pareto win + STABLE: worst_year equal -0.031, sharpe 1.07, cagr 0.51, robust 0.72, 2025 1.18. perturb_worst_std stayed 0.27 (no explosion). Robust gain, kept.","timestamp":1782735600959,"segment":0,"confidence":null,"asi":{"hypothesis":"veto_threshold 0.775->0.80 (T4 Pareto candidate WITH vol_scaled; extra liquidity vetoes may improve robustness)","result":"CLEAN PARETO WIN + STABLE: worst_year EQUAL -0.031, sharpe 1.05->1.07, cagr 0.50->0.51, calmar 0.98->1.01, sortino 1.54->1.56, meanY 1.02->1.03, robust 0.71->0.72, stdY 0.62->0.61, 2015 0.49->0.55, 2025 1.06->1.18, 2016 1.69->1.71. veto_pct 7.7%->9.7%","decision":"KEEP -- perturb_worst_std STABLE at 0.27 (no explosion, unlike sma_fast=2's 0.47). perturb_robust_std 0.069->0.083 (tiny). The extra vetoes removed marginal-liquidity names and improved robustness. This is a ROBUST gain, not overfit","contrast":"sma_fast=2 (iter12) improved single-run sharpe but EXPLODED perturb_worst_std 0.27->0.47 (overfit, discarded). veto=0.80 improves single-run sharpe AND keeps perturb_worst_std 0.27 (robust, kept). The perturbation test is the decisive judge","next_action":"Iter14: sma_slow 50->45 (third T4 Pareto candidate; checklist showed sharpe 1.05->1.06, floor same). Test WITH perturbation. Then re-run full checklist on this new best (veto=0.80) to confirm T1/T4 improved further."}}
{"run":15,"commit":"9e42f06","metric":-0.031412,"metrics":{"best_year_sharpe":1.779793,"cagr":0.511489,"calmar":0.983171,"information_ratio":0.956442,"max_drawdown":-0.520244,"mean_year_sharpe":1.035434,"n_years":11,"perturb_mean_worst_year":-0.340374,"perturb_robust_std":0.120189,"perturb_sharpe_std":0.077944,"perturb_worst_year_std":0.423664,"robust_score":0.72071,"sharpe":1.068706,"sortino":1.551996,"std_year_sharpe":0.629449,"veto_pct":0.097404,"year_2015_sharpe":0.533328,"year_2016_sharpe":1.705882,"year_2017_sharpe":1.324694,"year_2018_sharpe":-0.031412,"year_2019_sharpe":0.988666,"year_2020_sharpe":1.585868,"year_2021_sharpe":0.417227,"year_2022_sharpe":0.219862,"year_2023_sharpe":1.779793,"year_2024_sharpe":1.75869,"year_2025_sharpe":1.107179,"year_2022_cagr":0.058035,"year_2018_cagr":-0.047805,"year_2025_cagr":0.724702},"status":"discard","description":"Iter14: sma_slow 50->45. Overfit: single-run sharpe equal but perturb_worst_std EXPLODED 0.27->0.42 (exceeds guard), 2023 lifted at cost of worst-year fragility. Discard; sma_slow=50 robust. SMA params done.","timestamp":1782735724821,"segment":0,"confidence":null,"asi":{"hypothesis":"sma_slow 50->45 (third T4 Pareto candidate; checklist showed sharpe 1.05->1.06, floor same at veto=0.775)","result":"OVERFIT: single-run sharpe 1.0705->1.0687 (essentially equal/slightly worse), 2023 1.58->1.78 (lifted) BUT perturb_worst_std EXPLODED 0.27->0.42 (EXCEEDS guard 0.37), perturb_robust_std 0.083->0.120, maxdd -0.51->-0.52, 2025 1.18->1.11, 2017 1.39->1.32","decision":"DISCARD -- worst-year destabilized under perturbation. sma_slow=45 lifts 2023 at the cost of worst-year fragility","pattern_confirmed":"All SMA tweaks that lift specific years (sma_fast=2 iter12, sma_slow=45 iter14) EXPLODE perturb_worst_std = overfit. Only veto=0.80 (iter13) was a robust Pareto win among T4 candidates. SMA params are well-tuned at 3/50/201; do not tweak them further","next_action":"Iter15: ts_mom 9->10 (checklist at veto=0.775 showed floor -0.031->-0.018 = a PRIMARY improvement candidate, though sharpe dropped 1.05->0.96). Test on current best (veto=0.80) WITH perturbation -- if floor lifts to ~-0.018 AND perturb_worst_std stays <0.37, this is the first primary gain since iter8."}}
{"run":16,"commit":"9e42f06","metric":-0.018106,"metrics":{"best_year_sharpe":1.667496,"cagr":0.460079,"calmar":0.889977,"information_ratio":0.875034,"max_drawdown":-0.516956,"mean_year_sharpe":0.949122,"n_years":11,"perturb_mean_worst_year":-0.099555,"perturb_robust_std":0.134784,"perturb_sharpe_std":0.143651,"perturb_worst_year_std":0.272981,"robust_score":0.681249,"sharpe":0.993519,"sortino":1.419653,"std_year_sharpe":0.535747,"veto_pct":0.097145,"year_2015_sharpe":0.833884,"year_2016_sharpe":1.667496,"year_2017_sharpe":1.612041,"year_2018_sharpe":-0.018106,"year_2019_sharpe":0.701023,"year_2020_sharpe":1.331472,"year_2021_sharpe":0.316853,"year_2022_sharpe":0.312428,"year_2023_sharpe":1.289819,"year_2024_sharpe":1.222894,"year_2025_sharpe":1.170537,"year_2022_cagr":0.09896,"year_2018_cagr":-0.028736,"year_2025_cagr":0.815639},"status":"discard","description":"Iter15: ts_mom 9->10. Genuine robustness-vs-return tradeoff (floor -0.018, stdY 0.54, perturb stable 0.27) but primary gain within noise (0.013 vs std 0.27) while sharpe/robust_score dropped real (~1 std). Discard; ts_mom=9 better risk-adjusted+robust.","timestamp":1782735888017,"segment":0,"confidence":null,"asi":{"hypothesis":"ts_mom 9->10 (checklist showed floor -0.031->-0.018 = primary improvement candidate)","result":"GENUINE TRADEOFF, NOT OVERFIT: worst_year -0.031->-0.018 (2018), stdY 0.61->0.54, 2015 0.55->0.83, 2017 1.39->1.61, 2022 0.22->0.31 (real robustness gains). perturb_worst_std STABLE 0.27 (not overfit). BUT sharpe 1.07->0.99, cagr 0.51->0.46, sortino 1.56->1.42, calmar 1.01->0.89, robust_score 0.72->0.68 (all REAL drops ~1 std). 2024 1.76->1.22, 2023 1.58->1.29, 2020 1.59->1.33 (good years cut)","decision":"DISCARD -- the primary 'gain' (0.013) is WITHIN perturbation noise (std 0.27; delta<<noise) so not a real floor lift, while the risk-adjusted return drops (sharpe/sortino/calmar/robust_score) are real (~1 std). I will not sacrifice real risk-adjusted return for a noise-level primary gain. iter13 (ts_mom=9) has HIGHER sharpe AND HIGHER robust_score with floor -0.031 (essentially flat)","tradeoff_characterization":"ts_mom=10 = longer momentum = smoother trends = better weak years / lower dispersion but lower peak years and lower risk-adjusted return. A legitimate robustness-leaning config but not a Pareto improvement over iter13","next_action":"Iter16: fund_group_weight 0.02->0.01 (de-emphasize fundamentals further; untested). Then asset_growth 20->30. If no further robust gains, finalize iter13 as the robust champion and update .auto/prompt.md + ideas.md."}}
{"run":17,"commit":"9e42f06","metric":-0.031412,"metrics":{"best_year_sharpe":1.9831,"cagr":0.51953,"calmar":1.061925,"information_ratio":0.972151,"max_drawdown":-0.489234,"mean_year_sharpe":1.045175,"n_years":11,"perturb_mean_worst_year":-0.637067,"perturb_robust_std":0.068564,"perturb_sharpe_std":0.072519,"perturb_worst_year_std":0.268973,"robust_score":0.71584,"sharpe":1.079494,"sortino":1.542665,"std_year_sharpe":0.65867,"veto_pct":0.097389,"year_2015_sharpe":0.550429,"year_2016_sharpe":1.705882,"year_2017_sharpe":1.385408,"year_2018_sharpe":-0.031412,"year_2019_sharpe":0.988666,"year_2020_sharpe":1.585868,"year_2021_sharpe":0.417227,"year_2022_sharpe":0.219862,"year_2023_sharpe":1.784451,"year_2024_sharpe":1.9831,"year_2025_sharpe":0.907443,"year_2022_cagr":0.058035,"year_2018_cagr":-0.047805,"year_2025_cagr":0.510788},"status":"discard","description":"Iter16: fund_group 0.02->0.01. Within-noise wash: sharpe/calmar/maxdd up but stdY/2025 worsened (more peak-dependent), poor years unchanged. Discard; fund_group=0.02 robust sweet spot.","timestamp":1782736034611,"segment":0,"confidence":null,"asi":{"hypothesis":"fund_group_weight 0.02->0.01 (de-emphasize fundamentals further; let technical momentum dominate more)","result":"WITHIN-NOISE WASH: worst_year EQUAL -0.031, poor years (2018/2021/2022) unchanged. GAINS: sharpe 1.07->1.08, cagr 0.51->0.52, calmar 1.01->1.06, maxdd -0.506->-0.489, perturb_robust_std 0.083->0.069, 2024 1.76->1.98, 2023 1.58->1.78. LOSSES: stdY 0.613->0.659 (dispersion UP), 2025 1.18->0.91 (mid year DOWN), best_year 1.76->1.98 (more peak-dependent), robust_score 0.724->0.716, sortino 1.56->1.54. perturb_worst_std STABLE 0.269","decision":"DISCARD -- primary equal, headline sharpe/robust_score changes within noise (delta ~0.009 vs std ~0.08). The dispersion direction is NEGATIVE (stdY up, 2025 down, more peak-dependent) which conflicts with the robustness priority. fund_group=0.02 is the robust sweet spot","finding":"Lowering fund_group below 0.02 makes the strategy more peak-dependent (good years stronger, mid years weaker) without helping poor years. 0.02 balances return and year-robustness","next_action":"Iter17: asset_growth 20->30 (untested; push the dominant fundamental higher to strengthen quality tilt). Then finalize: re-run full checklist on iter13 (veto=0.80, the ACTUAL current best) for validation and update prompt.md/ideas.md."}}
{"run":18,"commit":"9e42f06","metric":-0.031412,"metrics":{"best_year_sharpe":1.990369,"cagr":0.525855,"calmar":1.038977,"information_ratio":0.979297,"max_drawdown":-0.506128,"mean_year_sharpe":1.046815,"n_years":11,"perturb_mean_worst_year":-0.637067,"perturb_robust_std":0.106932,"perturb_sharpe_std":0.082612,"perturb_worst_year_std":0.268973,"robust_score":0.713086,"sharpe":1.087988,"sortino":1.588624,"std_year_sharpe":0.667457,"veto_pct":0.097291,"year_2015_sharpe":0.550429,"year_2016_sharpe":1.705882,"year_2017_sharpe":1.385408,"year_2018_sharpe":-0.031412,"year_2019_sharpe":0.988666,"year_2020_sharpe":1.585868,"year_2021_sharpe":0.417227,"year_2022_sharpe":0.219862,"year_2023_sharpe":1.990369,"year_2024_sharpe":1.847598,"year_2025_sharpe":0.85507,"year_2022_cagr":0.058035,"year_2018_cagr":-0.047805,"year_2025_cagr":0.473456},"status":"discard","description":"Iter17: gross_profitability quality tilt. Floor NOT lifted (-0.031 structural to technical momentum). Good years up but dispersion up, 2025 down, robust_score down. Discard; iter13 is the robust optimum.","timestamp":1782736234276,"segment":0,"confidence":null,"asi":{"hypothesis":"Enable gross_profitability (quality tilt, weight 5.0) to lift the 2018 floor (2018 was a quality-favoring year)","result":"FLOOR NOT LIFTED: worst_year EQUAL -0.031 (2018 unchanged). Improved good years: 2023 1.58->1.99, 2024 1.76->1.85, sharpe 1.07->1.09, cagr 0.51->0.53, calmar 1.01->1.04, sortino 1.56->1.59, meanY 1.03->1.05. BUT stdY 0.613->0.667 (dispersion UP), 2025 1.18->0.86 (DOWN), robust_score 0.724->0.713 (DOWN), perturb_robust_std 0.083->0.107. Poor years (2018/2021/2022) unchanged. perturb_worst_std STABLE 0.269 (not overfit)","decision":"DISCARD -- same pattern as fund_group=0.01 (iter16): more return, less year-robustness, poor years unchanged. The quality tilt made good years stronger and 2025 weaker (more peak-dependent) without helping the floor","key_conclusion":"The 2018 floor (-0.031, essentially flat) is STRUCTURAL -- driven by technical momentum factors (97% weight). Fundamental/quality tilts (3% weight) cannot move it; technical tweaks that move it (sma_fast=4 iter10, sma_slow=45 iter14) OVERFIT (explode perturb_worst_std 0.27->0.42+). The robust optimum is iter13: max_holdings=2, fund_group=0.02, ts_mom=9, sma 3/50/201, veto=0.80, vol_scaled, vol_lookback=21. Floor -1.05->-0.031, sharpe 0.77->1.07, robust 0.27->0.72, perturb_std 0.40->0.27 -- massive robust gain, NOT overfit (instability dropped)","next_action":"Re-run full overfitting checklist on iter13 (veto=0.80, the ACTUAL current best -- earlier checklist was iter8/veto=0.775) for final validation. Update prompt.md/ideas.md. Then continue low-probability levers (rebalance_frequency, train_years) or conclude the robust champion."}}
{"run":19,"commit":"f8916d4","metric":0.219862,"metrics":{"best_year_sharpe":1.630348,"cagr":0.469569,"calmar":1.147912,"information_ratio":0.882736,"max_drawdown":-0.409063,"mean_year_sharpe":0.953687,"n_years":11,"perturb_mean_worst_year":-0.121434,"perturb_robust_std":0.099683,"perturb_sharpe_std":0.084678,"perturb_worst_year_std":0.360743,"robust_score":0.75226,"sharpe":1.00935,"sortino":1.500181,"std_year_sharpe":0.402853,"veto_pct":0.085076,"year_2015_sharpe":0.552722,"year_2016_sharpe":1.361366,"year_2017_sharpe":0.850821,"year_2018_sharpe":0.561581,"year_2019_sharpe":0.99206,"year_2020_sharpe":1.459757,"year_2021_sharpe":0.791898,"year_2022_sharpe":0.219862,"year_2023_sharpe":1.018955,"year_2024_sharpe":1.630348,"year_2025_sharpe":1.051184,"year_2022_cagr":0.058035,"year_2018_cagr":0.211215,"year_2025_cagr":0.665299},"status":"keep","description":"Iter18: trailing_vol_window 53->21. MAJOR MILESTONE: worst_year -0.031->+0.220 (POSITIVE floor, all 11 years profitable). stdY 0.61->0.40, maxdd -0.51->0.41, calmar 1.15, robust 0.75. Cost sharpe 1.07->1.01. perturb_worst_std 0.36 within guard. KEEP.","timestamp":1782737375467,"segment":0,"confidence":null,"asi":{"hypothesis":"trailing_vol_window 53->21 (shorter trailing-volume baseline makes the veto ratio more reactive to recent volume, reshaping the vetoed set)","result":"MAJOR ROBUSTNESS MILESTONE: worst_year -0.031 -> +0.220 (PRIMARY above 0 for the first time). 2018 -0.031 -> +0.56; now ALL 11 years POSITIVE, worst is 2022 +0.22. stdY 0.61->0.40 (dispersion -34%), maxdd -0.51->-0.41, calmar 1.01->1.15, robust_score 0.72->0.75, 2021 0.42->0.79. Cost: sharpe 1.07->1.01, cagr 0.51->0.47 (good years 2016 1.71->1.36, 2017 1.39->0.85, 2023 1.58->1.02 came down). veto_pct 9.7%->8.5%","decision":"KEEP -- the floor is now POSITIVE (every year profitable), a massive robustness gain directly matching the user's goal. The primary improved by 0.25 (real, ~1x perturbation std). perturb_worst_std rose 0.27->0.36 but stayed WITHIN the 0.37 guard (delta 0.09 < 0.10 threshold). Return sacrifice (sharpe -0.06, cagr -0.04) is moderate and acceptable for positive-floor robustness","mechanism":"A 21-session trailing volume baseline (vs 53) makes pred_vol/trailing_vol more sensitive to recent volume regime; stocks with fading recent volume get vetoed more, which appears to avoid the 2018 names that crashed. The veto becomes a more responsive liquidity-regime gate","next_action":"Iter19: push the reactivity -- trailing_vol_window 21->13 (or veto_horizon 21->10). WATCH perturb_worst_std (now 0.36, near 0.37 guard) -- if it exceeds 0.37, discard. Then re-run full checklist on this new best (all-years-positive) to confirm T1/T4."}}
