{"run":28,"commit":"f2f8a2e","metric":0.312428,"metrics":{"best_year_sharpe":1.412669,"cagr":0.443117,"calmar":1.061918,"information_ratio":0.840352,"max_drawdown":-0.41728,"mean_year_sharpe":0.933661,"n_years":11,"perturb_mean_worst_year":-0.166448,"perturb_robust_std":0.069425,"perturb_sharpe_std":0.068288,"perturb_worst_year_std":0.191147,"robust_score":0.781571,"sharpe":0.965408,"sortino":1.396904,"std_year_sharpe":0.304182,"veto_pct":0.084129,"year_2015_sharpe":0.81,"year_2016_sharpe":1.412669,"year_2017_sharpe":1.120889,"year_2018_sharpe":0.940109,"year_2019_sharpe":0.722006,"year_2020_sharpe":1.395068,"year_2021_sharpe":0.702311,"year_2022_sharpe":0.312428,"year_2023_sharpe":0.924816,"year_2024_sharpe":1.104113,"year_2025_sharpe":0.827477,"year_2022_cagr":0.09896,"year_2018_cagr":0.408419,"year_2025_cagr":0.45618},"status":"discard","description":"Iter27: base_filter_requires_trend False->True. Point estimate BIT-IDENTICAL to iter21 (trend gate redundant -- momentum winners already trend). Perturb std dropped (0.28->0.19) but perturbed floor went NEGATIVE (+0.04->-0.17). Discard; gate OFF confirmed.","timestamp":1782740467709,"segment":0,"confidence":29.494544433161206,"asi":{"deployable":"YES -- base_filter_requires_trend wired in core (strategy.py:61,73 trend_ok gate: trend_filter>0 AND sma_crossover>0) and harness uses state.base_mask + score_composite so the gate is faithfully applied","hypothesis":"base_filter_requires_trend False->True: add a hard uptrend gate (price>201-day SMA AND 3-day>50-day SMA) at the universe level, excluding downtrending names. Classic trend-following robustness filter; core's own default is True. Targets bear-market floor protection (2018/2022)","result":"POINT ESTIMATE BIT-IDENTICAL to iter21 champion (worst_year 0.312428, ALL year sharpes identical, sharpe/cagr/maxdd/robust all identical). The trend gate is REDUNDANT for the deployed strategy -- a momentum strategy's top-2 picks are already in uptrends, so the gate removes zero actually-selected names. BUT perturbation behavior changed: perturb_worst_year_std 0.277 -> 0.191 (DROPPED, tighter cluster), perturb_sharpe_std 0.12 -> 0.07 (DROPPED), perturb_robust_std 0.11 -> 0.07 (DROPPED). HOWEVER perturb_mean_worst_year +0.04 -> -0.17 (perturbed floor went NEGATIVE -- the smaller perturbed eligible set clusters around a negative-floor outcome)","decision":"DISCARD -- primary unchanged (0.31 == 0.31, no improvement) per primary discipline, AND the perturbed floor deteriorated (+0.04 -> -0.17, negative). The trend gate is redundant for the point estimate but makes the perturbed worst-year floor negative. iter21 champion (gate OFF) stands. base_filter_requires_trend EXHAUSTED (OFF is correct: the momentum signal already encodes trend, an explicit gate only hurts perturbation diversity)","conclusion":"base_filter_requires_trend=False (champion) confirmed. An explicit trend gate is redundant on top of a momentum signal and harms perturbation robustness. Deployable levers now fully exhausted: ts_mom_lookback/skip (10-0 best), veto_threshold (0.80), trailing_vol_window (21), veto_horizon (21), vol_lookback (21), vol_scaled (true), fund_group (0.02), max_holdings (2), require_positive_composite (true, return-chasing not tested), base_filter_requires_trend (false). Remaining params are stubs (veto_soft, price_veto, vol_confidence, tfm_alpha, sup_* -- not wired in core, testing = cheating).","next_action":"User redirected: switch benchmark IWV -> SPY 500, apply champion params, compare. This is a generalization/validation test (does the IWV-tuned champion transfer to S&P 500?), NOT a new optimization. Investigating benchmark config + SPY data availability."}}
{"type":"config","name":"Maximize risk-adjusted return + robustness across weak years (SPY/S&P 500 rotation, FULL TimesFM veto)","metricName":"worst_year_sharpe","metricUnit":"","bestDirection":"higher"}
{"run":29,"commit":"417500b","metric":0.033963,"metrics":{"best_year_sharpe":2.23671,"cagr":0.465642,"calmar":1.218321,"information_ratio":0.985341,"max_drawdown":-0.3822,"mean_year_sharpe":0.982031,"n_years":11,"perturb_mean_sharpe":1.162457,"perturb_mean_worst_year":-0.310793,"perturb_robust_std":0.084505,"perturb_sharpe_std":0.070933,"perturb_worst_year_std":0.187658,"robust_score":0.692069,"sharpe":1.113487,"sortino":1.6394,"std_year_sharpe":0.579923,"veto_pct":0.207096,"year_2015_sharpe":0.684047,"year_2016_sharpe":1.058182,"year_2017_sharpe":0.889877,"year_2018_sharpe":0.134117,"year_2019_sharpe":1.513597,"year_2020_sharpe":0.971872,"year_2021_sharpe":0.938568,"year_2022_sharpe":0.033963,"year_2023_sharpe":1.326536,"year_2024_sharpe":2.23671,"year_2025_sharpe":1.014867,"year_2022_cagr":0.007292,"year_2018_cagr":0.036746,"year_2025_cagr":0.461867},"status":"keep","description":"BASELINE (SPY full-veto): champion iter21 params on S&P 500 with 100% TimesFM coverage. worst_year=0.034 (2022 floor), sharpe=1.11, cagr=0.47, robust=0.69, veto_pct=20.7%. Full veto is 2.5x more active than IWV; 2022 (0.03) and 2018 (0.13) are weak years to lift. Honest deployable baseline (no coverage cheating).","timestamp":1782747142635,"segment":1,"confidence":null,"asi":{"hypothesis":"BASELINE: champion iter21 params (IWV-tuned) on S&P 500 universe with FULL TimesFM volume veto (100% forecast coverage, 581 symbols). Establishes honest SPY baseline after switching target IWV->SPY per user request and regenerating all missing forecasts on GPU (torch+transformers installed, float32 inputs).","result":"worst_year_sharpe=0.034 (2022 floor, BARELY positive), sharpe=1.11, cagr=0.47, robust=0.69, maxdd=-0.38, calmar=1.22, sortino=1.64, meanY=0.98, stdY=0.58, perturb_worst_std=0.19, perturb_mean_worst_year=-0.31 (perturbed floor NEGATIVE), veto_pct=20.7% (vs 8.3% partial-veto -- full veto is 2.5x more active). Year sharpes: 2015=0.68 2016=1.06 2017=0.89 2018=0.13 2019=1.51 2020=0.97 2021=0.94 2022=0.03 2023=1.33 2024=2.24 2025=1.01. Weak years: 2022 (0.03, the floor) and 2018 (0.13).","decision":"KEEP as the new SPY baseline (first run of the switched target). This is the HONEST, faithful, deployable baseline -- full veto, 100% coverage, no cheating. Note the full veto (20.7%) gives a LOWER floor than the partial-veto SPY run (0.35 at 8.3% veto) because vetoing more large-caps reshapes selection and lowers the 2022 floor. But partial veto was NOT faithful (61% of names never vetoed = coverage cheating). The full-veto 0.034 is the true starting point.","conclusion":"SPY baseline floor is 0.034 (vs IWV champion 0.31). The IWV-tuned champion does NOT transfer cleanly to full-veto SPY -- there is real optimization headroom. 2022 (0.03) and 2018 (0.13) are the weak years to lift. The full veto is very active (20.7%) so veto_threshold and trailing_vol_window are the first levers to re-tune for SPY (they were tuned for IWV's 8.5% veto rate).","next_action":"Iter1 (SPY): veto_threshold 0.80->0.775 (the full veto at 0.80 is too aggressive on SPY at 20.7%; lowering toward the IWV-default 0.775 may reduce over-vetoing and lift the 2022 floor). Then re-tune trailing_vol_window for SPY. Update prompt.md/ideas.md with new TSFM research directions (Kronos, ICF, quantile P20 veto, vol gate) from New directions.txt."}}
{"run":30,"commit":"417500b","metric":-0.125283,"metrics":{"best_year_sharpe":2.292783,"cagr":0.561367,"calmar":1.468781,"information_ratio":1.17261,"max_drawdown":-0.3822,"mean_year_sharpe":1.101619,"n_years":11,"perturb_mean_sharpe":1.302166,"perturb_mean_worst_year":-0.366514,"perturb_robust_std":0.080938,"perturb_sharpe_std":0.06243,"perturb_worst_year_std":0.17351,"robust_score":0.804915,"sharpe":1.277951,"sortino":1.880586,"std_year_sharpe":0.593408,"veto_pct":0.16504,"year_2015_sharpe":0.684047,"year_2016_sharpe":1.195708,"year_2017_sharpe":0.937018,"year_2018_sharpe":0.693815,"year_2019_sharpe":1.253385,"year_2020_sharpe":0.971872,"year_2021_sharpe":0.999544,"year_2022_sharpe":-0.125283,"year_2023_sharpe":1.534482,"year_2024_sharpe":2.292783,"year_2025_sharpe":1.680439,"year_2022_cagr":-0.047222,"year_2018_cagr":0.251915,"year_2025_cagr":0.936605},"status":"discard","description":"Iter1 (SPY): veto_threshold 0.80->0.775. Primary regressed 0.034->-0.125 (2022 negative). But secondaries up (sharpe 1.28, robust 0.80, 2018 0.69). KEY INSIGHT: higher veto (0.80) PROTECTS the 2022 floor on SPY; lowering it crashes 2022. Direction to lift floor is HIGHER veto, not lower. Discard.","timestamp":1782747273486,"segment":1,"confidence":null,"asi":{"hypothesis":"Iter1 (SPY): veto_threshold 0.80->0.775. Hypothesis: the full veto at 0.80 is over-active on SPY (20.7% veto vs IWV 8.5%); lowering toward the IWV-default 0.775 may reduce over-vetoing and lift the 2022 floor.","result":"PRIMARY REGRESSED: worst_year 0.034 -> -0.125 (2022 went NEGATIVE, cagr -0.05). BUT secondaries IMPROVED broadly: sharpe 1.11->1.28, cagr 0.47->0.56, robust 0.69->0.80, calmar 1.22->1.47, sortino 1.64->1.88, 2018 0.13->0.69, 2025 1.01->1.68, 2023 1.33->1.53. veto_pct 20.7%->16.5% (less vetoing). perturb_worst_std 0.19->0.17 (stable), perturb_mean_worst_year -0.31->-0.37 (perturbed floor more negative).","decision":"DISCARD -- primary metric (worst_year) regressed 0.034 -> -0.125 (2022 crashed negative). Per primary discipline, discard even though secondaries improved broadly.","key_insight":"COUNTERINTUITIVE: on full-veto SPY, the HIGHER veto (0.80) PROTECTS the 2022 floor (0.03 vs -0.13 at 0.775). Lowering the threshold vetoes fewer names -> selects more aggressive momentum -> 2022 crashes. So the full veto at 0.80 is doing USEFUL work on the 2022 floor, not over-aggressive. The direction to lift the floor is likely EVEN HIGHER veto (0.82+), opposite of my hypothesis. The IWV lesson (0.80 was the sweet spot) flips on SPY: SPY's full-coverage veto behaves differently.","next_action":"Iter2 (SPY): veto_threshold 0.80->0.82 (MORE vetoing). Test if a higher threshold lifts the 2022 floor further (0.03 -> higher). The baseline 0.80 already beats 0.775 on the floor; push higher to find the SPY sweet spot. Watch perturb_worst_std (guard) and 2018 (the other weak year)."}}
{"run":31,"commit":"417500b","metric":-0.368115,"metrics":{"best_year_sharpe":1.93858,"cagr":0.392961,"calmar":1.028155,"information_ratio":0.832306,"max_drawdown":-0.3822,"mean_year_sharpe":0.850401,"n_years":11,"perturb_mean_sharpe":1.048843,"perturb_mean_worst_year":-0.668876,"perturb_robust_std":0.082421,"perturb_sharpe_std":0.069023,"perturb_worst_year_std":0.212917,"robust_score":0.546444,"sharpe":0.975388,"sortino":1.416289,"std_year_sharpe":0.607914,"veto_pct":0.246807,"year_2015_sharpe":0.565084,"year_2016_sharpe":1.066085,"year_2017_sharpe":0.890846,"year_2018_sharpe":0.138183,"year_2019_sharpe":1.350804,"year_2020_sharpe":0.971872,"year_2021_sharpe":0.392795,"year_2022_sharpe":-0.368115,"year_2023_sharpe":1.335661,"year_2024_sharpe":1.93858,"year_2025_sharpe":1.072621,"year_2022_cagr":-0.130503,"year_2018_cagr":0.039054,"year_2025_cagr":0.494817},"status":"discard","description":"Iter2 (SPY): veto_threshold 0.80->0.82. 2022 crashed to -0.37 (worse than 0.775's -0.13). Veto picture clear: 0.80 is a SHARP LOCAL PEAK (2022=+0.03); both 0.775 and 0.82 crash 2022. Threshold EXHAUSTED/pinned at 0.80. Need a different lever to lift the thin floor. Discard.","timestamp":1782747458777,"segment":1,"confidence":null,"asi":{"hypothesis":"Iter2 (SPY): veto_threshold 0.80->0.82 (MORE vetoing). Hypothesis: baseline 0.80 beats 0.775 on the 2022 floor; push higher to lift the floor further.","result":"DISASTER: worst_year 0.034 -> -0.368 (2022 CRASHED to -0.37, cagr -0.13). veto_pct 20.7%->24.7% (more vetoing). sharpe 1.11->0.98, robust 0.69->0.55, 2021 0.94->0.39, 2024 2.24->1.94. 2018 unchanged (0.13->0.14). perturb_worst_std 0.19->0.21 (up), perturb_mean_worst_year -0.31->-0.67 (worse).","decision":"DISCARD -- 2022 crashed to -0.37. Combined with iter1 (0.775 -> 2022 -0.13), the veto_threshold picture on SPY is now clear: 0.80 is a SHARP LOCAL PEAK (2022=+0.03); both 0.775 (-0.13) and 0.82 (-0.37) crash 2022. The threshold is PINNED at its optimum -- a fragile knife-edge.","key_insight":"VETO_THRESHOLD IS EXHAUSTED ON SPY: 0.80 is the sweet spot (sharp peak). The thin +0.03 floor at 0.80 cannot be lifted by moving the threshold. Need a DIFFERENT lever: (a) trailing_vol_window (changes the veto RATIO -> re-calibrates which names are vetoed WITHOUT moving the threshold off its peak), (b) max_holdings 2->3 (more diversification for large-caps), (c) quantile P20 veto (downside-liquidity gate, the TSFM direction).","next_action":"Iter3 (SPY): trailing_vol_window 21->34 (longer trailing baseline). On IWV 21 was the #2 lever (53->floor -0.031, 13->2017 collapses, 21 sweet spot). On SPY the veto is 2.5x more active; a longer window (34) smooths the ratio denominator, potentially reducing false vetoes in the 2022 regime shift and lifting the thin floor. Watch 2018 (the other weak year) and perturb_worst_std."}}
{"run":32,"commit":"417500b","metric":-0.108176,"metrics":{"best_year_sharpe":2.089003,"cagr":0.458521,"calmar":1.017129,"information_ratio":0.970486,"max_drawdown":-0.450799,"mean_year_sharpe":0.941062,"n_years":11,"perturb_mean_sharpe":1.102796,"perturb_mean_worst_year":-0.392668,"perturb_robust_std":0.088507,"perturb_sharpe_std":0.065583,"perturb_worst_year_std":0.169508,"robust_score":0.650235,"sharpe":1.103708,"sortino":1.581199,"std_year_sharpe":0.581655,"veto_pct":0.20874,"year_2015_sharpe":0.721354,"year_2016_sharpe":1.216699,"year_2017_sharpe":1.050395,"year_2018_sharpe":0.247401,"year_2019_sharpe":0.80555,"year_2020_sharpe":1.616407,"year_2021_sharpe":1.019383,"year_2022_sharpe":-0.108176,"year_2023_sharpe":0.540925,"year_2024_sharpe":2.089003,"year_2025_sharpe":1.152744,"year_2022_cagr":-0.040775,"year_2018_cagr":0.081119,"year_2025_cagr":0.630634},"status":"discard","description":"Iter3 (SPY): trailing_vol_window 21->34. 2022 negative (-0.11), 2023 collapsed (1.33->0.54), maxdd -0.45. The 2022 floor is FRAGILE -- every veto-param change crashes it. Baseline is a sharp optimum; veto params pinned. Need a structural lever. Discard.","timestamp":1782747562875,"segment":1,"confidence":null,"asi":{"hypothesis":"Iter3 (SPY): trailing_vol_window 21->34 (longer trailing baseline). Smooths the veto ratio denominator to reduce false vetoes in the 2022 regime shift, without moving the threshold off its 0.80 peak.","result":"PRIMARY REGRESSED: worst_year 0.034 -> -0.108 (2022 negative again, -0.11). 2023 COLLAPSED 1.33->0.54, maxdd worsened -0.38->-0.45. 2018 improved 0.13->0.25, 2020 0.97->1.62, 2021 0.94->1.02. veto_pct 20.7%->20.9% (similar). robust 0.69->0.65. perturb_worst_std 0.19->0.17 (stable).","decision":"DISCARD -- 2022 went negative AND 2023 collapsed. The 2022 floor is VERY FRAGILE on SPY: every veto-param change tried so far (threshold 0.775/0.82, trailing 34) crashes it. The baseline (veto=0.80, trailing=21) is a sharp fragile optimum.","key_insight":"VETO PARAMS ARE PINNED on SPY -- threshold at 0.80 (sharp peak), trailing_vol_window at 21 (34 crashes 2022+2023). The thin +0.03 floor cannot be lifted by veto tuning. Need a STRUCTURAL lever: (a) max_holdings 2->3 (diversification, the #1 IWV lever), (b) quantile P20 veto (fundamentally different veto mechanism), (c) signal/factor changes. The fragility (perturb_mean_worst_year -0.31 at baseline) confirms the floor needs structural support, not param nudging.","next_action":"Iter4 (SPY): max_holdings 2->3 (more diversification). On IWV 1->2 was the #1 lever (floor -1.05->-0.012) but 2->3 gave floor -0.36 (worse). SPY large-caps may tolerate 3 better (less single-name risk, deeper liquidity). This is the highest-potential structural lever to lift the thin fragile 2022 floor. Watch all years -- 3 holdings may lift the floor but could cut peak years (2024 2.24)."}}
{"run":33,"commit":"417500b","metric":-0.087645,"metrics":{"best_year_sharpe":1.848217,"cagr":0.377481,"calmar":1.068475,"information_ratio":0.9155,"max_drawdown":-0.353289,"mean_year_sharpe":0.959301,"n_years":11,"perturb_mean_sharpe":1.079583,"perturb_mean_worst_year":-0.236074,"perturb_robust_std":0.06569,"perturb_sharpe_std":0.051271,"perturb_worst_year_std":0.091643,"robust_score":0.64974,"sharpe":1.079245,"sortino":1.543879,"std_year_sharpe":0.619121,"veto_pct":0.207096,"year_2015_sharpe":0.510375,"year_2016_sharpe":1.011782,"year_2017_sharpe":0.899984,"year_2018_sharpe":-0.022816,"year_2019_sharpe":1.791567,"year_2020_sharpe":1.492763,"year_2021_sharpe":0.77614,"year_2022_sharpe":-0.087645,"year_2023_sharpe":1.341423,"year_2024_sharpe":1.848217,"year_2025_sharpe":0.990519,"year_2022_cagr":-0.012508,"year_2018_cagr":0.002124,"year_2025_cagr":0.382112},"status":"discard","description":"Iter4 (SPY): max_holdings 2->3. Two years negative (2022 -0.09, 2018 -0.02), peak cut (2024 2.24->1.85). BUT perturb_worst_std halved (0.19->0.09), maxdd improved. 3 holdings is more stable but not floor-optimal. 4 SPY iters all crashed 2022 -- baseline is a fragile knife-edge; root cause = full veto over-vetoing. Pivoting to quantile P20 veto. Discard.","timestamp":1782747714357,"segment":1,"confidence":null,"asi":{"hypothesis":"Iter4 (SPY): max_holdings 2->3 (more diversification). On IWV 1->2 was the #1 lever; SPY large-caps may tolerate 3 (deeper liquidity, less single-name risk).","result":"PRIMARY REGRESSED: worst_year 0.034 -> -0.088. TWO years negative: 2022=-0.09 AND 2018=-0.02 (baseline had 2018=+0.13). Peak cut: 2024 2.24->1.85, cagr 0.47->0.38, 2025 1.01->0.99. BUT stability IMPROVED dramatically: perturb_worst_std 0.19->0.09 (HALVED), maxdd -0.38->-0.35, 2019 1.51->1.79, 2020 0.97->1.49. robust 0.69->0.65. veto_pct 20.7% (same).","decision":"DISCARD -- two years negative (2022, 2018), primary regressed. 3 holdings cuts peaks AND the floor still goes negative. 2 is the floor-optimal count on SPY (same as IWV). The stability gain (perturb_worst_std halved) is real but the floor is the primary mandate.","key_insight":"FOUR SPY ITERS ALL CRASHED 2022: veto_threshold 0.775 (-0.13) / 0.82 (-0.37), trailing_vol_window 34 (-0.11), max_holdings 3 (-0.09). The baseline +0.03 is a FRAGILE KNIFE-EDGE. ROOT CAUSE: the full veto OVER-VETOTES (20.7%) good 2022 names, making selection fragile. Param nudges cannot lift the floor -- they just move WHICH year crashes. The PRINCIPLED FIX is the QUANTILE P20 VETO (New directions.txt Phase 3): veto on the DOWNSIDE (P20) volume forecast, not the mean. This vetoes FEWER, smarter names (true tail-liquidity risk) and should stop over-vetoing good 2022 performers -> lift the fragile floor.","next_action":"Implement quantile P20 veto: (1) generate quantile forecast cache (quantiles=True) for all 581 SPY symbols via generate_spy_forecasts.py adapted; (2) add a quantile-veto code path to overfit_harness.py (in scope); (3) test use_quantile_veto=true with P20. This is the highest-value principled lever directly targeting the over-vetoing root cause. First commit docs (prompt.md/ideas.md/README)."}}
