{"run":41,"commit":"0ec051c","metric":0.282208,"metrics":{"best_year_sharpe":2.23466,"cagr":0.626081,"calmar":1.459276,"information_ratio":1.179897,"max_drawdown":-0.429035,"mean_year_sharpe":1.098857,"n_years":11,"perturb_mean_sharpe":1.277328,"perturb_mean_worst_year":0.063234,"perturb_robust_std":0.083838,"perturb_sharpe_std":0.074855,"perturb_worst_year_std":0.123555,"robust_score":0.791146,"sharpe":1.275436,"sortino":1.82136,"std_year_sharpe":0.615423,"veto_pct":0.000175,"year_2015_sharpe":0.282208,"year_2016_sharpe":1.694393,"year_2017_sharpe":0.624952,"year_2018_sharpe":1.135272,"year_2019_sharpe":0.616495,"year_2020_sharpe":1.908593,"year_2021_sharpe":0.99954,"year_2022_sharpe":0.336849,"year_2023_sharpe":1.399435,"year_2024_sharpe":2.23466,"year_2025_sharpe":0.855035,"year_2022_cagr":0.112785,"year_2018_cagr":0.455555,"year_2025_cagr":0.423069},"status":"discard","description":"Iter12 (SPY): P10 @ 0.25. Still 0% veto (P10 too low to calibrate -> no-veto = 0.282). P10 not a productive gate. P20 (col 1) confirmed the quantile-veto sweet spot. Discard.","timestamp":1782751474169,"segment":1,"confidence":5.949089623475341,"asi":{"hypothesis":"Iter12 (SPY): P10 at threshold 0.25 (recalibrated between 0.20's 0% and P20's 1.4%) to test if a deeper downside gate matches P20.","result":"STILL 0% veto (veto_pct 0.0%). P10_ratio is rarely < 0.25 -- P10 is so low that any reasonable threshold gives 0% veto (no-veto = 0.282). Identical to iter11/no-veto control.","decision":"DISCARD -- P10 is not a productive gate: either 0% veto (no-veto, 0.282) or over-veto. Cannot calibrate to a useful 1.4% veto rate without extreme thresholds. P20 (col 1) is the quantile-veto sweet spot.","conclusion":"QUANTILE VETO CHOICE RESOLVED: P20 (col 1, threshold 0.30, 1.4% veto, worst_year 0.337) is the sweet spot. P10 (col 0) is uncalibratable (0% veto at reasonable thresholds). The 2022 floor (0.34) is independent of the quantile choice (comes from removing the mean veto); the quantile choice only affects the downside-protected years (2015/2019).","next_action":"Iter13 (SPY): P30 (col 2, threshold 0.30) -- a LESS conservative downside gate (P30 > P20 -> fewer vetoes at same threshold). Final quantile variant to bracket. If P30 under-vetoes (like P20@0.25 -> 0.333), P20@0.30 is confirmed optimal. Then the SPY optimization has CONVERGED at the P20 champion (0.337, all 6 tests PASS)."}}
{"run":42,"commit":"0ec051c","metric":0.333121,"metrics":{"best_year_sharpe":2.271141,"cagr":0.622688,"calmar":1.451368,"information_ratio":1.172336,"max_drawdown":-0.429035,"mean_year_sharpe":1.099911,"n_years":11,"perturb_mean_sharpe":1.279973,"perturb_mean_worst_year":0.119057,"perturb_robust_std":0.090271,"perturb_sharpe_std":0.076499,"perturb_worst_year_std":0.126533,"robust_score":0.796416,"sharpe":1.268795,"sortino":1.810019,"std_year_sharpe":0.60699,"veto_pct":0.004723,"year_2015_sharpe":0.333121,"year_2016_sharpe":1.694393,"year_2017_sharpe":0.624952,"year_2018_sharpe":1.135272,"year_2019_sharpe":0.616495,"year_2020_sharpe":1.832786,"year_2021_sharpe":0.99954,"year_2022_sharpe":0.336849,"year_2023_sharpe":1.399435,"year_2024_sharpe":2.271141,"year_2025_sharpe":0.855035,"year_2022_cagr":0.112785,"year_2018_cagr":0.455555,"year_2025_cagr":0.423069},"status":"discard","description":"Iter13 (SPY): P30 @ 0.30. Under-vetoes (0.5%) -> 0.333, loses 2015/2019 protection. Quantile choice bracketed: P10 uncalibratable, P20 (0.337) BEST, P30 under-vetoes. SPY OPTIMIZATION CONVERGED at P20 champion. Discard.","timestamp":1782751577088,"segment":1,"confidence":5.949089623475341,"asi":{"hypothesis":"Iter13 (SPY): P30 (col 2, less conservative downside 30th percentile) at threshold 0.30. P30 > P20 so fewer vetoes at same threshold. Final quantile variant to bracket the choice.","result":"UNDER-VETOTES: worst_year 0.333 (floor=2015 0.33) vs P20's 0.337. veto_pct 0.5% (P30@0.30 vetoes fewer than P20@0.30's 1.4%). 2015 0.33 vs 0.52, 2019 0.62 vs 1.25 (lost downside protection). robust 0.80 vs 0.90, perturb_floor +0.12 vs +0.17. Similar to P20@0.25 (under-vetoing).","decision":"DISCARD -- P30@0.30 under-vetoes (0.5%) and loses the 2015/2019 downside protection that P20@0.30 (1.4%) provides. P20 is the quantile-veto sweet spot.","conclusion":"QUANTILE CHOICE FULLY BRACKETED: P10 (col 0) -> 0% veto uncalibratable -> 0.282; P20 (col 1, 0.30) -> 1.4% veto -> 0.337 BEST; P30 (col 2, 0.30) -> 0.5% veto under-vetoes -> 0.333. P20 (col 1, threshold 0.30) is the robust optimum. SPY OPTIMIZATION CONVERGED: 13 experiments (2 keeps). The P20 quantile veto champion (worst_year 0.337, ALL 6 checklist tests PASS, 10x the baseline) is the robust Pareto point. The 2022 floor is pinned at 0.34 (structural for 2-stock monthly momentum). Phase 3 (quantile veto) VALIDATED; Phase 4 (vol-gate) is the wrong direction.","next_action":"SPY OPTIMIZATION CONVERGED. Update prompt.md/ideas.md with the quantile bracketing + convergence. The P20 champion (iter5, commit 11ad309) is the final robust champion: worst_year 0.337, all 6 tests PASS, 10x baseline. Remaining New directions phases (Kronos backbone, ICF, prune-finetune) are bigger efforts deferred to ideas.md."}}
{"run":43,"commit":"aed44a2","metric":0.434707,"metrics":{"best_year_sharpe":2.656458,"cagr":0.705373,"calmar":1.632996,"information_ratio":1.321879,"max_drawdown":-0.43195,"mean_year_sharpe":1.258593,"n_years":11,"perturb_mean_sharpe":1.391564,"perturb_mean_worst_year":0.24486,"perturb_robust_std":0.03827,"perturb_sharpe_std":0.026762,"perturb_worst_year_std":0.100254,"robust_score":0.934713,"sharpe":1.400821,"sortino":2.008053,"std_year_sharpe":0.64776,"veto_pct":0.013925,"year_2015_sharpe":0.515489,"year_2016_sharpe":1.840246,"year_2017_sharpe":0.802105,"year_2018_sharpe":0.982991,"year_2019_sharpe":1.249032,"year_2020_sharpe":1.968698,"year_2021_sharpe":1.061336,"year_2022_sharpe":0.434707,"year_2023_sharpe":1.518663,"year_2024_sharpe":2.656458,"year_2025_sharpe":0.814796,"year_2022_cagr":0.152286,"year_2018_cagr":0.366704,"year_2025_cagr":0.411582},"status":"keep","description":"Iter14 (SPY): sma_trend 201->210 on P20 base. CLEAN KEEP: worst_year 0.337->0.435 (2022 floor 0.34->0.43), robust 0.93, perturb_worst_std DROPPED 0.13->0.10, perturbed floor +0.24. Honest checklist T4 flagged it; perturbation confirmed not overfit. Longer trend filter complements P20 veto.","timestamp":1782752435937,"segment":1,"confidence":7.871152750770925,"asi":{"hypothesis":"Iter14 (SPY): sma_trend 201->210 on the P20 base. The HONEST checklist T4 (after fixing the checklist to honor use_quantile_veto) flagged this as a +0.098 single-run primary gain (0.3368 -> 0.4347). Per the iter12 lesson (single-run T4 gains can explode perturb_worst_std), confirm with the perturbation test before keeping.","result":"CLEAN KEEP -- perturbation CONFIRMS not overfit: worst_year 0.337 -> 0.435 (2022 floor 0.34 -> 0.43, +0.098 real gain). robust_score 0.90 -> 0.93 (UP). perturb_worst_std 0.13 -> 0.10 (DROPPED -- more stable). perturb_mean_worst_year +0.17 -> +0.24 (perturbed floor UP). perturb_sharpe_std 0.07 -> 0.03 (DROPPED dramatically). sharpe 1.38 -> 1.40, cagr 0.68 -> 0.71, calmar 1.58 -> 1.63, sortino 1.99 -> 2.01. 2022 0.34->0.43, 2016 1.69->1.84, 2017 0.67->0.80, 2023 1.40->1.52. All 11 years positive, veto_pct 1.4% (same).","decision":"KEEP -- primary improved +0.098 AND robust_score up AND perturb_worst_std DROPPED AND perturbed floor up. This is the iter18/iter21 real-win pattern (primary up + stability up = not overfit). The overfitting guard is satisfied (perturb_worst_std fell, did not rise). The disciplined flow worked: honest checklist T4 flagged the candidate, perturbation test confirmed it.","key_insight":"sma_trend=210 (~10-month trend filter vs 201's ~9.5-month) on the P20 base lifts the 2022 floor 0.34 -> 0.43. A longer trend filter is more conservative (requires a longer uptrend confirmation), which in the 2022 bear market vetoes more aggressive momentum names -- complementary to the P20 downside-liquidity veto. The combination (P20 volume veto + longer trend filter) is robust. This is the FIRST primary improvement above the P20 champion's pinned 0.34 floor -- sma_trend was the lever the honest checklist revealed.","tooling_fix":"CRITICAL: fixed overfitting_checklist.py to honor use_quantile_veto (was hardcoding mean veto -> the prior 'all 6 tests PASS' was on a PHANTOM config). Honest re-run also PASSES (T1 cv 4.6%, T4 spread 0.492, T6 PASS) with correct evidence (baseline 0.3368). The T4 fix (adaptive veto_threshold +/-0.05) + quantile honor revealed the sma_trend=210 candidate that the phantom config missed.","next_action":"Iter15: test sma_trend=220 (push the trend filter longer) to find the sweet spot. The honest checklist T4 tested 210 (best) but not 220. If 220 lifts the floor further with stable perturbation, keep. If it drops/overfits, 210 is the sweet spot. Watch perturb_worst_std (guard) -- the iter12 lesson: confirm any T4 gain with perturbation."}}
{"run":44,"commit":"aed44a2","metric":0.355632,"metrics":{"best_year_sharpe":2.774843,"cagr":0.725112,"calmar":1.678692,"information_ratio":1.352497,"max_drawdown":-0.43195,"mean_year_sharpe":1.264666,"n_years":11,"perturb_mean_sharpe":1.381994,"perturb_mean_worst_year":0.086031,"perturb_robust_std":0.103887,"perturb_sharpe_std":0.07828,"perturb_worst_year_std":0.161256,"robust_score":0.916095,"sharpe":1.42503,"sortino":2.051797,"std_year_sharpe":0.697143,"veto_pct":0.013938,"year_2015_sharpe":0.515489,"year_2016_sharpe":1.840246,"year_2017_sharpe":0.802105,"year_2018_sharpe":0.899595,"year_2019_sharpe":1.550425,"year_2020_sharpe":1.968698,"year_2021_sharpe":0.870837,"year_2022_sharpe":0.355632,"year_2023_sharpe":1.518663,"year_2024_sharpe":2.774843,"year_2025_sharpe":0.814796,"year_2022_cagr":0.120314,"year_2018_cagr":0.327369,"year_2025_cagr":0.411582},"status":"discard","description":"Iter15 (SPY): sma_trend 210->220. Past the sweet spot: 0.435->0.356 (2022 floor down), perturb_worst_std 0.10->0.16 (rose). Peak years up but weak years down -- return-chasing. sma_trend=210 bracketed as the sweet spot. Discard.","timestamp":1782752565004,"segment":1,"confidence":13.731398516335725,"asi":{"hypothesis":"Iter15 (SPY): sma_trend 210->220 (push the trend filter longer to find the sweet spot).","result":"PAST THE SWEET SPOT: worst_year 0.435 -> 0.356 (2022 floor 0.43 -> 0.36, DOWN). perturb_worst_std 0.10 -> 0.16 (UP, worse). perturb_mean_worst_year +0.24 -> +0.09 (DOWN). 2018 0.98->0.90, 2021 1.06->0.87 (weak years worse). Peak years up (2024 2.66->2.77, 2019 1.25->1.55) -- return-chasing. sharpe 1.40->1.43, cagr 0.71->0.73 (slight up but floor down).","decision":"DISCARD -- primary regressed (0.435->0.356) AND perturb_worst_std rose (0.10->0.16). 220 is past the sweet spot: longer trend filter chases peak-year return at the cost of the 2022 floor and stability. sma_trend=210 is the sweet spot.","conclusion":"sma_trend BRACKETED: 201 -> 0.337; 210 -> 0.435 BEST (iter14, KEPT); 220 -> 0.356 (over-pushed). 210 is the robust optimum (~10-month trend filter). The longer filter complements the P20 downside-liquidity veto by requiring a longer uptrend confirmation -- but only up to 210; 220 is too conservative and chases peaks.","next_action":"Iter16: test sma_slow 50->45 on the sma_trend=210 base. The honest checklist T4 showed sma_slow=45 -> 0.3556 (+0.019 single-run) on the 201 base. On the 210 base it may combine. MUST confirm with perturbation (iter12 lesson: sma tweaks can explode perturb_worst_std -- on IWV sma_slow=45 was textbook overfit). Watch perturb_worst_std guard."}}
{"run":45,"commit":"aed44a2","metric":0.355632,"metrics":{"best_year_sharpe":2.538533,"cagr":0.725524,"calmar":1.679646,"information_ratio":1.3802,"max_drawdown":-0.43195,"mean_year_sharpe":1.273389,"n_years":11,"perturb_mean_sharpe":1.389483,"perturb_mean_worst_year":0.184709,"perturb_robust_std":0.105504,"perturb_sharpe_std":0.088198,"perturb_worst_year_std":0.197363,"robust_score":0.958528,"sharpe":1.433889,"sortino":2.056757,"std_year_sharpe":0.629722,"veto_pct":0.013956,"year_2015_sharpe":0.511454,"year_2016_sharpe":1.840246,"year_2017_sharpe":0.802105,"year_2018_sharpe":0.982991,"year_2019_sharpe":1.386419,"year_2020_sharpe":1.93252,"year_2021_sharpe":1.061336,"year_2022_sharpe":0.355632,"year_2023_sharpe":1.627769,"year_2024_sharpe":2.538533,"year_2025_sharpe":0.96828,"year_2022_cagr":0.120314,"year_2018_cagr":0.366704,"year_2025_cagr":0.523827},"status":"discard","description":"Iter16 (SPY): sma_slow 50->45 on 210 base. OVERFIT: perturb_worst_std EXPLODED 0.10->0.20 (2x), worst_year 0.435->0.356. Perturbation caught what T4 missed (same as IWV iter14). sma_slow=50 confirmed optimal. Discard.","timestamp":1782752688007,"segment":1,"confidence":7.871152750770925,"asi":{"hypothesis":"Iter16 (SPY): sma_slow 50->45 on the sma_trend=210 base. The honest checklist T4 showed sma_slow=45 -> 0.3556 (+0.019 single-run) on the 201 base. On the 210 base it may combine. MUST confirm with perturbation (iter12 lesson: sma_slow=45 was textbook overfit on IWV, perturb_worst_std exploded 0.27->0.42).","result":"OVERFIT -- perturb_worst_std EXPLODED 0.10 -> 0.20 (2x, at the guard threshold). worst_year 0.435 -> 0.356 (2022 floor 0.43 -> 0.36, DOWN). 2024 2.66->2.54 (peak down), 2023 1.52->1.63 (up), 2025 0.81->0.97 (up). robust 0.93->0.96 (up but from meanY not floor). perturb_mean_worst_year +0.24 -> +0.18 (DOWN).","decision":"DISCARD -- primary regressed (0.435->0.356) AND perturb_worst_std exploded (0.10->0.20, 2x). The perturbation test caught what single-run T4 missed: sma_slow=45 is OVERFIT on SPY too (same as IWV iter14). The iter12 lesson holds: sma tweaks can pass single-run T4 but explode perturbation instability. sma_slow=50 confirmed optimal.","conclusion":"sma_slow=50 confirmed optimal on SPY (45 overfit, perturb_worst_std 2x). The honest checklist T4's sma_slow=45 candidate was a single-run false positive -- the perturbation test (the real judge) rejects it. This validates the disciplined flow: T4 flags -> perturbation confirms/rejects.","next_action":"Iter17: test veto_horizon 21->10 on the sma_trend=210 P20 base. Directly tied to the P20 veto mechanism: the P20 veto sums q{col}_h{h} for h in range(veto_horizon); a shorter horizon (10) averages a shorter downside-liquidity forecast window -> more reactive to near-term liquidity stress. On IWV 21->10 was a wash (iter20) but the P20 veto mechanism differs. Watch perturb_worst_std."}}
{"run":46,"commit":"aed44a2","metric":0.434707,"metrics":{"best_year_sharpe":2.656458,"cagr":0.705373,"calmar":1.632996,"information_ratio":1.321879,"max_drawdown":-0.43195,"mean_year_sharpe":1.258593,"n_years":11,"perturb_mean_sharpe":1.391564,"perturb_mean_worst_year":0.24486,"perturb_robust_std":0.03827,"perturb_sharpe_std":0.026762,"perturb_worst_year_std":0.100254,"robust_score":0.934713,"sharpe":1.400821,"sortino":2.008053,"std_year_sharpe":0.64776,"veto_pct":0.013925,"year_2015_sharpe":0.515489,"year_2016_sharpe":1.840246,"year_2017_sharpe":0.802105,"year_2018_sharpe":0.982991,"year_2019_sharpe":1.249032,"year_2020_sharpe":1.968698,"year_2021_sharpe":1.061336,"year_2022_sharpe":0.434707,"year_2023_sharpe":1.518663,"year_2024_sharpe":2.656458,"year_2025_sharpe":0.814796,"year_2022_cagr":0.152286,"year_2018_cagr":0.366704,"year_2025_cagr":0.411582},"status":"discard","description":"Iter17 (SPY): veto_horizon 21->10. BIT-IDENTICAL no-op (worst_year 0.4347 == champion). The P20 veto at 0.30 is so sparse (1.4%) the vetoed set is horizon-invariant. Dead lever. Discard.","timestamp":1782752785554,"segment":1,"confidence":7.871152750770925,"asi":{"hypothesis":"Iter17 (SPY): veto_horizon 21->10 on the sma_trend=210 P20 base. The P20 veto sums q{col}_h{h} for h in range(veto_horizon); a shorter horizon (10) averages a shorter downside-liquidity forecast window. On IWV 21->10 was a wash (iter20).","result":"BIT-IDENTICAL NO-OP: worst_year 0.4347 == 0.4347, ALL metrics identical to iter14 champion. veto_pct 1.4% (same). runtime dropped 95s->64s (less computation) but the veto MASK is identical.","decision":"DISCARD -- no-op (bit-identical). The P20 veto at threshold 0.30 is so sparse (1.4%) that the SAME names are vetoed regardless of whether the downside-liquidity forecast is averaged over 10 or 21 steps. The veto decision is horizon-invariant at this threshold. veto_horizon is a dead lever.","conclusion":"veto_horizon EXHAUSTED (no-op at P20 threshold 0.30; the vetoed set is horizon-invariant). 21 stays (the champion). The P20 veto is robust to the forecast-averaging window -- a sign of a well-calibrated sparse gate, not a fragile parameter.","next_action":"Iter18: test ts_mom_skip 0->1 (10-1 momentum, exclude the recent reversal month) on the sma_trend=210 P20 base. On IWV 10-1 regressed the floor (0.31->0.28) but improved stability. On SPY the 2022 bear market might respond differently -- skip=1 reduces whipsaw from the most recent reversal-contaminated month. Watch the 2022 floor and perturb_worst_std."}}
{"run":47,"commit":"aed44a2","metric":0.11646,"metrics":{"best_year_sharpe":2.782684,"cagr":0.812087,"calmar":1.880046,"information_ratio":1.497111,"max_drawdown":-0.43195,"mean_year_sharpe":1.412678,"n_years":11,"perturb_mean_sharpe":1.539657,"perturb_mean_worst_year":0.194727,"perturb_robust_std":0.102908,"perturb_sharpe_std":0.056881,"perturb_worst_year_std":0.219969,"robust_score":1.016866,"sharpe":1.548649,"sortino":2.243029,"std_year_sharpe":0.791623,"veto_pct":0.014148,"year_2015_sharpe":0.790742,"year_2016_sharpe":2.020513,"year_2017_sharpe":1.466195,"year_2018_sharpe":0.845361,"year_2019_sharpe":1.626453,"year_2020_sharpe":2.542803,"year_2021_sharpe":0.653629,"year_2022_sharpe":0.11646,"year_2023_sharpe":1.764246,"year_2024_sharpe":2.782684,"year_2025_sharpe":0.930369,"year_2022_cagr":0.027518,"year_2018_cagr":0.303135,"year_2025_cagr":0.501696},"status":"discard","description":"Iter18 (SPY): ts_mom_skip 0->1 (10-1 momentum). 2022 floor crashed (0.43->0.12), perturb_worst_std EXPLODED 0.10->0.22 (guard violated). Same IWV iter25 pattern: skip=1 chases avg return, makes weak years weaker. ts_mom_skip=0 confirmed optimal. Discard.","timestamp":1782752921719,"segment":1,"confidence":7.871152750770925,"asi":{"hypothesis":"Iter18 (SPY): ts_mom_skip 0->1 (10-1 momentum, exclude the recent reversal month) on the sma_trend=210 P20 base. On IWV 10-1 regressed the floor (0.31->0.28) but improved stability. On SPY the 2022 bear market might respond differently (skip=1 reduces whipsaw).","result":"2022 FLOOR CRASHED + INSTABILITY EXPLODED: worst_year 0.435 -> 0.116 (2022 0.43 -> 0.12). perturb_worst_std 0.10 -> 0.22 (EXPLODED 2x, guard violated: 0.10+0.10=0.20 threshold). BUT secondaries hugely up: sharpe 1.40->1.55, cagr 0.71->0.81, robust 0.93->1.02, calmar 1.63->1.88, meanY 1.26->1.41. Good years way up (2016 1.84->2.02, 2017 0.80->1.47, 2019 1.25->1.63, 2020 1.97->2.54, 2023 1.52->1.76). Weak years down (2022 0.43->0.12, 2018 0.98->0.85, 2021 1.06->0.65). stdY 0.65->0.79 (more peak-dependent).","decision":"DISCARD -- 2022 floor crashed (0.43->0.12) AND perturb_worst_std exploded (0.10->0.22, guard violated). This is EXACTLY the IWV iter25 pattern: skip=1 is a higher-average-return signal but NOT floor-optimal -- makes good years greater, weak years weaker. The 2022 floor is the primary mandate. ts_mom_skip=0 confirmed optimal on SPY (same as IWV).","conclusion":"ts_mom_skip EXHAUSTED on SPY: 0 is the floor-robust optimum (10-0 momentum); 1 chases average return at the floor's expense + explodes perturb_worst_std. The 10-0 momentum (include the recent month) is counterintuitively BETTER for the 2022 floor than the academic 10-1 -- because in 2022 the recent-month momentum (skip=0) captures the ongoing bear-market trend better than skipping it.","next_action":"Iter19: test vol_lookback 21->34 (sizing lever) on the sma_trend=210 P20 base. vol_lookback affects inverse-vol SIZING across the 2 holdings (not selection); a longer window (34) gives smoother vol estimates -> potentially better 2022 risk-balancing. Watch the 2022 floor (primary) -- if it lifts, keep; if unchanged, discard per primary discipline."}}
